id,url,raw_text,username,datetime_tweet,to,mentions,hashtags,retweets,favorites,geo,label,clean_text
1269392528639438849,https://twitter.com/Borschee81/status/1269392528639438849,Why is he smelling a covid test swab? Or is he using it to pick chicken nuggets out of his teeth? #WTF2020 #Trump #Dumbo #COVID19 #Pandemic2020 #nomask ,Borschee81,2020-06-06 22:15:37+00:00,,,#WTF2020 #Trump #Dumbo #COVID19 #Pandemic2020 #nomask,0,1,,neg,why is he smelling a covid test swab? or is he using it to pick chicken nuggets out of his teeth? #wtf2020 #trump #dumbo #covid19 #pandemic2020   
1269390600761212930,https://twitter.com/ruthandirving/status/1269390600761212930,Its so damn obvious this is a whole damn conspiracy...100000%. Thousands congregate no problem. Yet in a week if its more than 6 watch out & those masks what a joke. If u have breathing probs. u r exempt. Of course 60% of oxygen is blocked #nomask Dumb conformists wearing them ,ruthandirving,2020-06-06 22:07:58+00:00,Charlotte3003G,,#nomask,8,16,,neg,its so damn obvious this is a whole damn conspiracy...100000%. thousands congregate no problem. yet in a week if its more than 6 watch out & those masks what a joke. if u have breathing probs. u r exempt. of course 60% of oxygen is blocked   dumb conformists wearing them 
1269357341461241856,https://twitter.com/B3arArms/status/1269357341461241856,Ok here’s the scoop #NoMask for me and a 1/4 of customers . I feel like I got that look from the other no mask bro . Not hassled or not felt like eyes on me. But still too many out there that need the #GreatAwakening Or it could of been my shirt! ,B3arArms,2020-06-06 19:55:48+00:00,QTruther,,#NoMask #GreatAwakening,3,4,,neg,ok here’s the scoop   for me and a 1/4 of customers . i feel like i got that look from the other no mask bro . not hassled or not felt like eyes on me. but still too many out there that need the #greatawakening or it could of been my shirt! 
1269354608981348352,https://twitter.com/matykowski_m/status/1269354608981348352,Never have never will..#nomask,matykowski_m,2020-06-06 19:44:56+00:00,MaineMartin3,,#nomask,0,2,,neg,never have never will.. 
1269346438183563271,https://twitter.com/Ervikram44Kumar/status/1269346438183563271,#EducationMinister @Jagarnathji_mla how you come irresponsible brutally avoiding regulations for #COVID19 #nosocialDistancing #nomask #morethan100 crowd. @HemantSorenJMM @PMOIndia @JharkhandPolice @BokaroDc .. And posting on social media..is rule for only poor people #Majdoor .,Ervikram44Kumar,2020-06-06 19:12:28+00:00,,@Jagarnathji_mla @HemantSorenJMM @PMOIndia @JharkhandPolice @BokaroDc,#EducationMinister #COVID19 #nosocialDistancing #nomask #morethan100 #Majdoor,0,1,,neg,#educationminister @jagarnathji_mla how you come irresponsible brutally avoiding regulations for #covid19 #nosocialdistancing   #morethan100 crowd. @hemantsorenjmm @pmoindia @jharkhandpolice @bokarodc .. and posting on social media..is rule for only poor people #majdoor .
1269342798693773313,https://twitter.com/mdean01468235/status/1269342798693773313,Stand up against the fascist bullies #nomask #Liberalsarentliberal they are intolerant,mdean01468235,2020-06-06 18:58:01+00:00,SidneyPowell1,,#nomask #Liberalsarentliberal,1,2,,neg,stand up against the fascist bullies   #liberalsarentliberal they are intolerant
1269323017240432641,https://twitter.com/fxdeluca/status/1269323017240432641,If teachers and coaches can march as a group - they can surely teach in person. #OpenEverywhere #schoolsreopening ⁦@NC_Governor⁩ #ncleg #ncpol ⁦@WCPSS⁩ #nomask ? ,fxdeluca,2020-06-06 17:39:24+00:00,,@NC_Governor @WCPSS,#OpenEverywhere #schoolsreopening #ncleg #ncpol #nomask,1,2,,neg,if teachers and coaches can march as a group - they can surely teach in person. #openeverywhere #schoolsreopening ⁦@nc_governor⁩ #ncleg #ncpol ⁦@wcpss⁩   ? 
1269310047647084544,https://twitter.com/pauli_grandpa/status/1269310047647084544,Making pizza without a mask Little Caesars 1908-18 at ReisterstownRoad Baltimore! #mask #noMask ,pauli_grandpa,2020-06-06 16:47:52+00:00,,,#mask #noMask,0,0,,neg,making pizza without a mask little caesars 1908-18 at reisterstownroad baltimore! #mask   
1269295036136656897,https://twitter.com/dmharsh13/status/1269295036136656897,#Eric Garcetti Needs to fully open LA County NOW Kneels while surrounded by protestors #NoMask #NoSocialDistancing,dmharsh13,2020-06-06 15:48:13+00:00,CoreysDigs,,#Eric #NoMask #NoSocialDistancing,3,3,,neg,#eric garcetti needs to fully open la county now kneels while surrounded by protestors   #nosocialdistancing
1269294857580929024,https://twitter.com/1Brasso/status/1269294857580929024,Me too...went to @Menards wasn’t let in because they have a rule that everyone wears a mask and I politely said I refuse to wear a mask and she told me I wasn’t allowed in...so off to @HomeDepot I go....#nomask,1Brasso,2020-06-06 15:47:31+00:00,JudiMichels,@Menards @HomeDepot,#nomask,1,2,,neg,me too...went to @menards wasn’t let in because they have a rule that everyone wears a mask and i politely said i refuse to wear a mask and she told me i wasn’t allowed in...so off to @homedepot i go.... 
1269290531881922562,https://twitter.com/isnt_it_red/status/1269290531881922562,We will not conform to your demands for us to be muzzled. Hiding facial expressions is not natural. THINK before you judge people who refuse Tyranny! #coronavirus #nomask #lockdown #coronahoax #plandemic #plandemic2020 #Freemasons #FakePandemic #hoaxvirus @BorisJohnson,isnt_it_red,2020-06-06 15:30:19+00:00,,@BorisJohnson,#coronavirus #nomask #lockdown #coronahoax #plandemic #plandemic2020 #Freemasons #FakePandemic #hoaxvirus,10,19,,neg,we will not conform to your demands for us to be muzzled. hiding facial expressions is not natural. think before you judge people who refuse tyranny! #coronavirus   #lockdown #coronahoax #plandemic #plandemic2020 #freemasons #fakepandemic #hoaxvirus @borisjohnson
1269287090036113409,https://twitter.com/ravensfinest67/status/1269287090036113409,Poolside today...finally got to put on my lips #nomask @Silverton New Jersey https://www.instagram.com/p/CBGSzTHjd-u/?igshid=knsazip4sg57,ravensfinest67,2020-06-06 15:16:39+00:00,,,#nomask,0,0,,neg,poolside today...finally got to put on my lips   @silverton new jersey https://www.instagram.com/p/cbgszthjd-u/?igshid=knsazip4sg57
1269265739795574784,https://twitter.com/OrcasRevenge/status/1269265739795574784,.@GovRicketts .@negop It is time to get rid of the mask. No one in the state should have to wear one. You are just providing cover for people who want to do harm to the public. The virus was a lie. The reason to wear mask was a lie. Think for yourself. #NoMask #ElectionYearScam,OrcasRevenge,2020-06-06 13:51:48+00:00,,@GovRicketts @NEGOP,#NoMask #ElectionYearScam,0,0,,neg,.@govricketts .@negop it is time to get rid of the mask. no one in the state should have to wear one. you are just providing cover for people who want to do harm to the public. the virus was a lie. the reason to wear mask was a lie. think for yourself.   #electionyearscam
1269256385541398529,https://twitter.com/ptrain51602/status/1269256385541398529,How about the slobbery mic that was shared? #nomask,ptrain51602,2020-06-06 13:14:38+00:00,RepublicanRI,,#nomask,2,6,,neg,how about the slobbery mic that was shared?  
1269231449904906242,https://twitter.com/CherylBoruszko/status/1269231449904906242,So let me get this straight a home made mask won’t help you but it will help others.. who presumably are also in home made masks that won’t help them??? Is this double speaking or just insanity? #nomask ,CherylBoruszko,2020-06-06 11:35:33+00:00,,,#nomask,13,32,,neg,so let me get this straight a home made mask won’t help you but it will help others.. who presumably are also in home made masks that won’t help them??? is this double speaking or just insanity?   
1269180941920014336,https://twitter.com/rebusbalatti/status/1269180941920014336,#Seaview #apartment? No on the sea literally Fast &amp; Furious the best of the #UK flavours is here ... #economy #lifestyle #maltaway http://www.maltaway.com #summer #malta #maltaway #nomask #nolockdown #covid19 The only… https://www.instagram.com/p/CBFiiE9hIs2/?igshid=slrjelgd6uro,rebusbalatti,2020-06-06 08:14:51+00:00,,,#Seaview #apartment #UK #economy #lifestyle #maltaway #summer #malta #maltaway #nomask #nolockdown #covid19,0,0,,neg,#seaview #apartment? no on the sea literally fast &amp; furious the best of the #uk flavours is here ... #economy #lifestyle #maltaway http://www.maltaway.com #summer #malta #maltaway   #nolockdown #covid19 the only… https://www.instagram.com/p/cbfiie9his2/?igshid=slrjelgd6uro
1269173934542385153,https://twitter.com/AadiAchint/status/1269173934542385153,@mysurucorp @DCMysuru @Mysuru_Infra @SPmysuru @CPMysuru @Karnataka_DIPR may I request street vendors and small shops are advised to follow #SocialDistancing #nomask was being worn we had over 500 cases yesterday. Nayaya Marg Siddharthanagar ,AadiAchint,2020-06-06 07:47:00+00:00,,@mysurucorp @DCMysuru @Mysuru_Infra @SPmysuru @CPMysuru @Karnataka_DIPR,#SocialDistancing #nomask,2,2,,neg,@mysurucorp @dcmysuru @mysuru_infra @spmysuru @cpmysuru @karnataka_dipr may i request street vendors and small shops are advised to follow #socialdistancing   was being worn we had over 500 cases yesterday. nayaya marg siddharthanagar 
1269141043305500672,https://twitter.com/GaganCh88990453/status/1269141043305500672,Conditions are made to keep you your family members and colleagues safe in this epidemic situation..... Use of Mask #Sanitize Your Handsproducts and the place which uses mostly..... #Balaji_Sweets_Center #NoMask #NoEntry #Covid19 Please do your best to be safe,GaganCh88990453,2020-06-06 05:36:18+00:00,,,#Sanitize #Balaji_Sweets_Center #NoMask #NoEntry #Covid19,0,3,,neg,conditions are made to keep you your family members and colleagues safe in this epidemic situation..... use of mask #sanitize your handsproducts and the place which uses mostly..... #balaji_sweets_center   #noentry #covid19 please do your best to be safe
1269104238304661511,https://twitter.com/RacingFireman/status/1269104238304661511,Great news for us first responders.. But Im not wearing a damn mask in June... In Miami.... Sorry... I love my Nascar Trucks but Ill pass on this. #choiceoffreedom #nomask #,RacingFireman,2020-06-06 03:10:03+00:00,bobpockrass,,#choiceoffreedom #nomask,0,0,,neg,great news for us first responders.. but im not wearing a damn mask in june... in miami.... sorry... i love my nascar trucks but ill pass on this. #choiceoffreedom   #
1269413933003177989,https://twitter.com/WbsMark/status/1269413933003177989,“I can see Dead People” #CoronaIsNotAJoke #OpenEverywhere #COVID__19 #lasvegasstrip #SocialDistancing #nomask,WbsMark,2020-06-06 23:40:40+00:00,,,#CoronaIsNotAJoke #OpenEverywhere #COVID__19 #lasvegasstrip #SocialDistancing #nomask,0,0,,neg,“i can see dead people” #coronaisnotajoke #openeverywhere #covid__19 #lasvegasstrip #socialdistancing  
1269376927275446272,https://twitter.com/robbievandy/status/1269376927275446272,#nomask #protestmasks #endrioting I will not conform to your nazi demands of wearing a mask and social distancing if you do not stop the riots and protests. If they can riot and protest I can live life like it was prior to the boogeyman covid-19,robbievandy,2020-06-06 21:13:38+00:00,GovMLG,,#nomask #protestmasks #endrioting,0,0,,neg,  #protestmasks #endrioting i will not conform to your nazi demands of wearing a mask and social distancing if you do not stop the riots and protests. if they can riot and protest i can live life like it was prior to the boogeyman covid-19
1269363341526360064,https://twitter.com/turtlephotos/status/1269363341526360064,This is all a hox #nomask #novax #FalseFlag #QAnon #Coronavirus,turtlephotos,2020-06-06 20:19:38+00:00,,,#nomask #novax #FalseFlag #QAnon #Coronavirus,0,0,,neg,this is all a hox   #novax #falseflag #qanon #coronavirus
1269346077855055872,https://twitter.com/vinceleet/status/1269346077855055872,Visitors to #Dollywood this summer. #NoMask #DollyParton #FreeTn #Libertarian #Freedom,vinceleet,2020-06-06 19:11:02+00:00,,,#Dollywood #NoMask #DollyParton #FreeTn #Libertarian #Freedom,0,0,,neg,visitors to #dollywood this summer.   #dollyparton #freetn #libertarian #freedom
1269333941254791169,https://twitter.com/rahalj/status/1269333941254791169,Glomark please wear masks when you make deliveries! #Glomark #Nomask,rahalj,2020-06-06 18:22:49+00:00,,,#Glomark #Nomask,0,1,,neg,glomark please wear masks when you make deliveries! #glomark  
1269317568801779713,https://twitter.com/judyandtrev/status/1269317568801779713,Interesting short video re: #SocialDistancing during #COVID19 #nomask ,judyandtrev,2020-06-06 17:17:45+00:00,,,#SocialDistancing #COVID19 #nomask,0,0,,neg,interesting short video re: #socialdistancing during #covid19   
1269306516382691328,https://twitter.com/MonicaPSoCal/status/1269306516382691328,Amen. Remove your mask! #nomask #facecoverings #breathfreshair #COVID19,MonicaPSoCal,2020-06-06 16:33:50+00:00,BreitbartNews,,#nomask #facecoverings #breathfreshair #COVID19,0,0,,neg,amen. remove your mask!   #facecoverings #breathfreshair #covid19
1269279055397830656,https://twitter.com/WokenMama/status/1269279055397830656,Do you see it? This is humiliation not strength!! #NoKneeling #nomask #agenda #DeepState #CabalTakedown #StrongerTogether #WWG1WGA,WokenMama,2020-06-06 14:44:43+00:00,1Romans58,,#NoKneeling #nomask #agenda #DeepState #CabalTakedown #StrongerTogether #WWG1WGA,1,1,,neg,do you see it? this is humiliation not strength!! #nokneeling   #agenda #deepstate #cabaltakedown #strongertogether #wwg1wga
1269224928206782464,https://twitter.com/sherryperry15/status/1269224928206782464,13 days since protests and riots started. ZERO new cases! We’re in last place to open! Good job #FakeNewsPandemic ! #openMassachusettsNow #norestrictions #nomask @MassLtGov stop your ‘reopening” BS ! We’re done OPEN restaurants gyms shops #NoMasks,sherryperry15,2020-06-06 11:09:38+00:00,MassGovernor,@MassLtGov,#FakeNewsPandemic #openMassachusettsNow #norestrictions #nomask #NoMasks,0,1,,neg,13 days since protests and riots started. zero new cases! we’re in last place to open! good job #fakenewspandemic ! #openmassachusettsnow #norestrictions   @massltgov stop your ‘reopening” bs ! we’re done open restaurants gyms shops  s
1269198093418991617,https://twitter.com/AMJami1392/status/1269198093418991617,#nomask #noservice #justbata This is what Pakistanis think ,AMJami1392,2020-06-06 09:23:00+00:00,,,#nomask #noservice #justbata,0,1,,neg,  #noservice #justbata this is what pakistanis think 
1269175543351541760,https://twitter.com/AadiAchint/status/1269175543351541760,Medical shop with #nomask worn by any of the employees. https://twitter.com/AadiAchint/status/1269174177002483712,AadiAchint,2020-06-06 07:53:24+00:00,,,#nomask,0,0,,neg,medical shop with   worn by any of the employees. https://twitter.com/aadiachint/status/1269174177002483712
1269072750683000833,https://twitter.com/JonathanBarber_/status/1269072750683000833,@realDonaldTrump @FBI @oanow @TheAUPlainsman @AuburnPolice This is how you handle THEM #AntifaTerrorists #Antifas #ANTIFA #Auburn #Tigers #WDE #nothappeninghere #OnthePlains #TigerBait #NOMASK #POLICY,JonathanBarber_,2020-06-06 01:04:56+00:00,,@realDonaldTrump @FBI @oanow @TheAUPlainsman @AuburnPolice,#AntifaTerrorists #Antifas #ANTIFA #Auburn #Tigers #WDE #nothappeninghere #OnthePlains #TigerBait #NOMASK #POLICY,0,0,,neg,@realdonaldtrump @fbi @oanow @theauplainsman @auburnpolice this is how you handle them #antifaterrorists #antifas #antifa #auburn #tigers #wde #nothappeninghere #ontheplains #tigerbait   #policy
1269066479799988224,https://twitter.com/kp07016065/status/1269066479799988224,Should have been PATHETIC!! @BarackObama @JoeBiden @staceyabrams @KamalaHarris @dbongino @POTUS @JohnBrennan #Obamagate #NoMask #TrumpLandslideVictory2020 #TrumpLandslideVictory2020 #TrumpLandslideVictory2020 #TrumpLandslide2020 #TrumpLandslide2020 #TrumpLandslide2020,kp07016065,2020-06-06 00:40:01+00:00,kp07016065,@BarackObama @JoeBiden @staceyabrams @KamalaHarris @dbongino @POTUS @JohnBrennan,#Obamagate #NoMask #TrumpLandslideVictory2020 #TrumpLandslideVictory2020 #TrumpLandslideVictory2020 #TrumpLandslide2020 #TrumpLandslide2020 #TrumpLandslide2020,0,0,,neg,should have been pathetic!! @barackobama @joebiden @staceyabrams @kamalaharris @dbongino @potus @johnbrennan #obamagate   #trumplandslidevictory2020 #trumplandslidevictory2020 #trumplandslidevictory2020 #trumplandslide2020 #trumplandslide2020 #trumplandslide2020
1269059654132342790,https://twitter.com/grindelwaldo/status/1269059654132342790,#nomask,grindelwaldo,2020-06-06 00:12:54+00:00,borghi_claudio,,#nomask,0,0,,neg, 
