id,url,raw_text,username,datetime_tweet,to,mentions,hashtags,retweets,favorites,geo,label,clean_text
1287152375346663424,https://twitter.com/TrueBLB/status/1287152375346663424,Makes me laugh the mask pushers tell me I’m an idiot and need to follow the science. yes the science says masks are useless and not necessary but ok keep getting hostile with me Dr Karen on Twitter #lol #covid #nomask #covidlies #survivalrate98 #notakiller #canada #usa,TrueBLB,2020-07-25 22:26:55+00:00,,,#lol #covid #nomask #covidlies #survivalrate98 #notakiller #canada #usa,1,25,,neg,makes me laugh the mask pushers tell me i’m an idiot and need to follow the science. yes the science says masks are useless and not necessary but ok keep getting hostile with me dr karen on twitter #lol #covid   #covidlies #survivalrate98 #notakiller #canada #usa
1287136671717261312,https://twitter.com/NTravel76/status/1287136671717261312,Currently in menorca just found out we have to now quarantine for 14 days on arrival home (due to surge in “cases” only 3 deaths in 24hrs )! Masks have been mandatory for a while in Spain think we can now probs agree they don’t work #kbf #NoMask,NTravel76,2020-07-25 21:24:31+00:00,,,#kbf #NoMask,3,6,,neg,currently in menorca just found out we have to now quarantine for 14 days on arrival home (due to surge in “cases” only 3 deaths in 24hrs )! masks have been mandatory for a while in spain think we can now probs agree they don’t work #kbf  
1287132355795263490,https://twitter.com/Tanya_USA/status/1287132355795263490,Katy Hopkins makes a video I agree with! RT if you agree! #facemasks #nomaskselfie #NoMask #mask,Tanya_USA,2020-07-25 21:07:22+00:00,SocialistBooksy,,#facemasks #nomaskselfie #NoMask #mask,15,26,,neg,katy hopkins makes a video i agree with! rt if you agree! #facemasks  selfie   #mask
1287094664902914050,https://twitter.com/EstelleHitchon/status/1287094664902914050,I've come to the conclusion that sadly most people are thick as mince. This thing ain't over people. #NoSocialDistancing #NoMask. Second spike seems imminent from what I've seen today. Need to mandate mask as a minimum.,EstelleHitchon,2020-07-25 18:37:35+00:00,,,#NoSocialDistancing #NoMask,1,17,,neg,i've come to the conclusion that sadly most people are thick as mince. this thing ain't over people. #nosocialdistancing  . second spike seems imminent from what i've seen today. need to mandate mask as a minimum.
1287083552731992065,https://twitter.com/SelaReport/status/1287083552731992065,Masks are a scientific and medical abomination. This has gone way too far. Burn the masks. #BurnTheMasks #KBF #covidiods #covid1984 #NoMask #NoNewNormal #FireFauciNow #ExposeBillGates #covidhoax #WWGIWGA,SelaReport,2020-07-25 17:53:26+00:00,,,#BurnTheMasks #KBF #covidiods #covid1984 #NoMask #NoNewNormal #FireFauciNow #ExposeBillGates #covidhoax #WWGIWGA,35,88,,neg,masks are a scientific and medical abomination. this has gone way too far. burn the masks. #burnthemasks #kbf #covidiods #covid1984   #nonewnormal #firefaucinow #exposebillgates #covidhoax #wwgiwga
1287071183389810689,https://twitter.com/lee_3po/status/1287071183389810689,Hey @GovPhilScott just a reminder that myself and many others I know aren't wearing the mask. Mandate all you want. It isn't written and agreed upon law to force the wearing of masks. Stop being a tyrant. #NoMask,lee_3po,2020-07-25 17:04:17+00:00,,@GovPhilScott,#NoMask,4,25,,neg,hey @govphilscott just a reminder that myself and many others i know aren't wearing the mask. mandate all you want. it isn't written and agreed upon law to force the wearing of masks. stop being a tyrant.  
1287049337739128833,https://twitter.com/CreativeDeduct/status/1287049337739128833,We need to stop normalising government dictating our lives. Wearing a mask may be a small sacrifice but not wearing it sends a big message. #NoMask,CreativeDeduct,2020-07-25 15:37:28+00:00,,,#NoMask,3,17,,neg,we need to stop normalising government dictating our lives. wearing a mask may be a small sacrifice but not wearing it sends a big message.  
1287023459441225728,https://twitter.com/Matrixejected1/status/1287023459441225728,We need some #nomask #gopro videos of maskless adventures in public...,Matrixejected1,2020-07-25 13:54:39+00:00,,,#nomask #gopro,1,6,,neg,we need some   #gopro videos of maskless adventures in public...
1286996818648236032,https://twitter.com/lncognitoBadger/status/1286996818648236032,How about the fact NONE of the masks these people are wearing are intended for medical or surgical use? Or does that not matter? #NoMask #NoMandatedVaccines,lncognitoBadger,2020-07-25 12:08:47+00:00,DeAnna4Congress,,#NoMask #NoMandatedVaccines,8,15,,neg,how about the fact none of the masks these people are wearing are intended for medical or surgical use? or does that not matter?   #nomandatedvaccines
1286986510257004544,https://twitter.com/GretaAurora/status/1286986510257004544,Here’s another #NoMaskSelfie due to popular demand! I can’t believe how easy it has become to stir powerful emotions in people. We really are living in a bizarre comedy sketch. #NoMask #NoMaskOnMe #NoToMasks,GretaAurora,2020-07-25 11:27:49+00:00,,,#NoMaskSelfie #NoMask #NoMaskOnMe #NoToMasks,3,47,,neg,here’s another  selfie due to popular demand! i can’t believe how easy it has become to stir powerful emotions in people. we really are living in a bizarre comedy sketch.    onme #notomasks
1286963739812663296,https://twitter.com/ixi0310/status/1286963739812663296,#NoMask #MaskSelfie got one on order tho ,ixi0310,2020-07-25 09:57:20+00:00,,,#NoMask #MaskSelfie,1,13,,neg,  #maskselfie got one on order tho 
1286959601842356225,https://twitter.com/GFL9112/status/1286959601842356225,#NoMaskSelfie Imagine masks being so necessary that they're implemented four months after the pandemic started and when deaths are at the lowest they've ever been... #NoMask #Masks,GFL9112,2020-07-25 09:40:54+00:00,,,#NoMaskSelfie #NoMask #Masks,5,24,,neg, selfie imagine masks being so necessary that they're implemented four months after the pandemic started and when deaths are at the lowest they've ever been...   #masks
1286949564004564993,https://twitter.com/uklibertyparty/status/1286949564004564993,A business has every right to require you to wear a mask on its premises. A business under government compulsion to require you to wear a mask on its premises should tell government to fuck off. #NoMask ,uklibertyparty,2020-07-25 09:01:01+00:00,Telegraph,,#NoMask,8,15,,neg,a business has every right to require you to wear a mask on its premises. a business under government compulsion to require you to wear a mask on its premises should tell government to fuck off.   
1286940876204367872,https://twitter.com/Charlotte3003G/status/1286940876204367872,It's very warm and humid today. Noticing people on the tube struggling with the masks. A few breaking into a sweat. Most people having to pull the masks down under their chins. At what point will people realise this has nothing to do with protection from viruses? #NoMask,Charlotte3003G,2020-07-25 08:26:29+00:00,,,#NoMask,49,252,,neg,it's very warm and humid today. noticing people on the tube struggling with the masks. a few breaking into a sweat. most people having to pull the masks down under their chins. at what point will people realise this has nothing to do with protection from viruses?  
1286917451855343617,https://twitter.com/CoronaDoubter/status/1286917451855343617,The only slight plus I can see from this crazy mask decision is that it has made a lot of people wake up to the madness of the whole thing #nomask #COVID19 #endthelockdownuk,CoronaDoubter,2020-07-25 06:53:24+00:00,,,#nomask #COVID19 #endthelockdownuk,29,141,,neg,the only slight plus i can see from this crazy mask decision is that it has made a lot of people wake up to the madness of the whole thing   #covid19 #endthelockdownuk
1286914156797612034,https://twitter.com/Maverick20182/status/1286914156797612034,I went shopping at my local supermarket today... #NoMaskSelfie #NoMasks #nomask #FakePandemic,Maverick20182,2020-07-25 06:40:19+00:00,,,#NoMaskSelfie #NoMasks #nomask #FakePandemic,24,80,,neg,i went shopping at my local supermarket today...  selfie  s   #fakepandemic
1286847132003995648,https://twitter.com/MaryJoe38642126/status/1286847132003995648,#Where’s #Your #Mask? I Thought They Were Now Acceptable By Trump Standards That They Are #Patriotic #NoMask #NoSocialDistancing .@POTUS Setting the #Example w #USA having over #4M #Covid19 #Cases pic.twitter.com/4e9RhFqRqS,MaryJoe38642126,2020-07-25 02:13:59+00:00,realDonaldTrump,@POTUS,#Where #Your #Mask #Patriotic #NoMask #NoSocialDistancing #Example #USA #4M #Covid19 #Cases,13,4,,neg,#where’s #your #mask? i thought they were now acceptable by trump standards that they are #patriotic   #nosocialdistancing .@potus setting the #example w #usa having over #4m #covid19 #cases pic.twitter.com/4e9rhfqrqs
1287065722997354497,https://twitter.com/KarenRHooper/status/1287065722997354497,Pleased to see everyone complying with mask wearing in my local Co-Op.I have delivered care to multiple patients with COVID19 the past few months wearing a mask & not developed Corona virus or passed it on. Coincidence I don't think so #COVID19 #wearamask #NoMask #coronavirus,KarenRHooper,2020-07-25 16:42:35+00:00,,,#COVID19 #wearamask #NoMask #coronavirus,0,6,,neg,pleased to see everyone complying with mask wearing in my local co-op.i have delivered care to multiple patients with covid19 the past few months wearing a mask & not developed corona virus or passed it on. coincidence i don't think so #covid19 #wearamask   #coronavirus
1287060514363899904,https://twitter.com/LisenPhotograp1/status/1287060514363899904,Is this what you call double standards? #NoMask #CovidHoax,LisenPhotograp1,2020-07-25 16:21:53+00:00,,,#NoMask #CovidHoax,5,11,,neg,is this what you call double standards?   #covidhoax
1287047151613349889,https://twitter.com/Michael54151899/status/1287047151613349889,This is really the time to stand up and be counted. Enough is a enough. Together we are stronger. Let’s open up and break down this illusionary reality no more division judgement delusion and hatred. Love is the answer #GreatAwakening #NoMask #love,Michael54151899,2020-07-25 15:28:47+00:00,,,#GreatAwakening #NoMask #love,0,4,,neg,this is really the time to stand up and be counted. enough is a enough. together we are stronger. let’s open up and break down this illusionary reality no more division judgement delusion and hatred. love is the answer #greatawakening   #love
1287043772912549889,https://twitter.com/WokenMama/status/1287043772912549889,1% get this virus. This is #tyranny @doniveson @jkenney our freedoms are being removed. #nomask #fascism,WokenMama,2020-07-25 15:15:22+00:00,dockaurG,@doniveson @jkenney,#tyranny #nomask #fascism,1,2,,neg,1% get this virus. this is #tyranny @doniveson @jkenney our freedoms are being removed.   #fascism
1287040478278377472,https://twitter.com/CAblond1/status/1287040478278377472,Fauci Goes Maskless in D.C. Which Exempts ‘on Duty’ Government Employees from Enforcement https://www.breitbart.com/politics/2020/07/24/fauci-goes-maskless-in-d-c-which-exempts-on-duty-government-employees-from-enforcement/ #FireFauciNow #ConstitutionOverCoronavirus #CancelDemocrats #BuildTheWall #LiberalismIsAMentalDisorder #NoMask #billofrights,CAblond1,2020-07-25 15:02:16+00:00,,,#FireFauciNow #ConstitutionOverCoronavirus #CancelDemocrats #BuildTheWall #LiberalismIsAMentalDisorder #NoMask #billofrights,3,1,,neg,fauci goes maskless in d.c. which exempts ‘on duty’ government employees from enforcement https://www.breitbart.com/politics/2020/07/24/fauci-goes-maskless-in-d-c-which-exempts-on-duty-government-employees-from-enforcement/ #firefaucinow #constitutionovercoronavirus #canceldemocrats #buildthewall #liberalismisamentaldisorder   #billofrights
1286966149645766656,https://twitter.com/KatharineJadee/status/1286966149645766656,Phew what a morning. Been to the gym and it was AMAZING! People just getting on with their lives chatting laughing . then to @sainsburys - #nomask very supportive. Save one customer mumbling something. They even have a ‘be kind not all disabilities are visible announcement ,KatharineJadee,2020-07-25 10:06:55+00:00,,@sainsburys,#nomask,0,6,,neg,phew what a morning. been to the gym and it was amazing! people just getting on with their lives chatting laughing . then to @sainsburys -   very supportive. save one customer mumbling something. they even have a ‘be kind not all disabilities are visible announcement 
1286907680616054790,https://twitter.com/otter_fancy/status/1286907680616054790,To people who refuse to wear masks #nomask #NoMaskSelfie wear a mask please,otter_fancy,2020-07-25 06:14:35+00:00,,,#nomask #NoMaskSelfie,3,13,,neg,to people who refuse to wear masks    selfie wear a mask please
1286848934854328321,https://twitter.com/CrunchyDoughnu1/status/1286848934854328321,Yup! Like going to the grocery store without a mask on... #NoMask #NoMasks #masksdontwork,CrunchyDoughnu1,2020-07-25 02:21:09+00:00,bunnehbooboo,,#NoMask #NoMasks #masksdontwork,2,4,,neg,yup! like going to the grocery store without a mask on...    s #masksdontwork
1286823331531038720,https://twitter.com/catholicinusa/status/1286823331531038720,ANTHONY FAUCI at WASHINGTON NATIONALS game. NO MASK NO SOCIAL DISTANCING #FauciTheFraud #FauciFirstPitch #NoMask ,catholicinusa,2020-07-25 00:39:24+00:00,,,#FauciTheFraud #FauciFirstPitch #NoMask,2,2,,neg,anthony fauci at washington nationals game. no mask no social distancing #faucithefraud #faucifirstpitch   
1286821575539318784,https://twitter.com/geoshoots/status/1286821575539318784,That's real nice. Now get Governor Sisolak to let us go & enjoy these small businesses. #NoMask #OpenNevada,geoshoots,2020-07-25 00:32:26+00:00,SenJackyRosen,,#NoMask #OpenNevada,0,0,,neg,that's real nice. now get governor sisolak to let us go & enjoy these small businesses.   #opennevada
1286820695239008256,https://twitter.com/parrotheadat40/status/1286820695239008256,No they are not. #NoMask #NoMaskMandates,parrotheadat40,2020-07-25 00:28:56+00:00,Tennessean,,#NoMask #NoMaskMandates,0,2,,neg,no they are not.    mandates
1286819819577278464,https://twitter.com/swellbs/status/1286819819577278464,Fauci Baseball #FauciFirstPitch #DrFauci #FauciTheFraud #Fauci #NoMask ,swellbs,2020-07-25 00:25:27+00:00,,,#FauciFirstPitch #DrFauci #FauciTheFraud #Fauci #NoMask,4,10,,neg,fauci baseball #faucifirstpitch #drfauci #faucithefraud #fauci   
1286819324603314182,https://twitter.com/DoddTiffany/status/1286819324603314182,#noshoes #nomask #noproblems #TalktoTiff,DoddTiffany,2020-07-25 00:23:29+00:00,,,#noshoes #nomask #noproblems #TalktoTiff,0,0,,neg,#noshoes   #noproblems #talktotiff
1286817531735478276,https://twitter.com/DeanPeasley/status/1286817531735478276,#NoMask #nan #COVID19,DeanPeasley,2020-07-25 00:16:22+00:00,,,#NoMask #nan #COVID19,0,0,,neg,  #nan #covid19
1286815382687191040,https://twitter.com/SunRisenShine7/status/1286815382687191040,FIRE NENSHI... NENSHI OUT OF OFFICE NOW! #FireNenshi #NoMask https://twitter.com/cityofcalgary/status/1286759892292755456,SunRisenShine7,2020-07-25 00:07:49+00:00,,,#FireNenshi #NoMask,0,0,,neg,fire nenshi... nenshi out of office now! #firenenshi   https://twitter.com/cityofcalgary/status/1286759892292755456
