id,url,raw_text,username,datetime_tweet,to,mentions,hashtags,retweets,favorites,geo,label,clean_text
1253835817971138561,https://twitter.com/bwcorky/status/1253835817971138561,@SpeakerPelosi @SenSchumer @dougducey Tomorrow I am going to Work!!! You are not restricting my Freedom or Rights anymore. Don’t like it to bad!!! I Don’t Work For You!! You Work For Me Get It!!! #NoMask,bwcorky,2020-04-24 23:58:48+00:00,,@SpeakerPelosi @SenSchumer @dougducey,#NoMask,0,0,,neg,@speakerpelosi @senschumer @dougducey tomorrow i am going to work!!! you are not restricting my freedom or rights anymore. don’t like it to bad!!! i don’t work for you!! you work for me get it!!!  
1253814219608338432,https://twitter.com/ShawnpKnox/status/1253814219608338432,My last damn face mask and my string went and broke! Just my damn luck #coronavirus #maskless #nomask #stayawayfromme https://www.instagram.com/p/B_YWjhShF9R/?igshid=jko08b6frzl1,ShawnpKnox,2020-04-24 22:32:59+00:00,,,#coronavirus #maskless #nomask #stayawayfromme,0,1,,neg,my last damn face mask and my string went and broke! just my damn luck #coronavirus #maskless   #stayawayfromme https://www.instagram.com/p/b_ywjhshf9r/?igshid=jko08b6frzl1
1253788643728252928,https://twitter.com/tropicalgirl_70/status/1253788643728252928,More orders Alot of employers are now making their employees wear a mask a lot do not want to but need their job. So in order to go to any store we too will have to wear them to buy groceries. Good thing we buy #storeablefood #controlthemasses #standyourground #nomask,tropicalgirl_70,2020-04-24 20:51:21+00:00,GovMikeDeWine,,#storeablefood #controlthemasses #standyourground #nomask,0,3,,neg,more orders alot of employers are now making their employees wear a mask a lot do not want to but need their job. so in order to go to any store we too will have to wear them to buy groceries. good thing we buy #storeablefood #controlthemasses #standyourground  
1253776798774710273,https://twitter.com/conservogirl/status/1253776798774710273,So ridiculous what’s happening in this country! #MAFreeAgain #NoMask,conservogirl,2020-04-24 20:04:17+00:00,PureMichGirl,,#MAFreeAgain #NoMask,0,1,,neg,so ridiculous what’s happening in this country! #mafreeagain  
1253772527777783810,https://twitter.com/Jennifer25anne/status/1253772527777783810,@GovLarryHogan our hope is gone our hearts broken. We need the medical exemptions on masks. I need to go to the store and I need to take my children. #nomask,Jennifer25anne,2020-04-24 19:47:19+00:00,,@GovLarryHogan,#nomask,0,1,,neg,@govlarryhogan our hope is gone our hearts broken. we need the medical exemptions on masks. i need to go to the store and i need to take my children.  
1253723911168065541,https://twitter.com/JuggernautofJoy/status/1253723911168065541,I guess self population control is happening in 2020. #nomask,JuggernautofJoy,2020-04-24 16:34:08+00:00,,,#nomask,0,0,,neg,i guess self population control is happening in 2020.  
1253719755514679297,https://twitter.com/Ly0nHE4Rt/status/1253719755514679297,@GovWhitmer PLANDEMIC @realDonaldTrump #ImpeachWhitmer #minipelosi #PureMichigan #LiesLiesLies #nomask #idc,Ly0nHE4Rt,2020-04-24 16:17:37+00:00,GovWhitmer,@GovWhitmer @realDonaldTrump,#ImpeachWhitmer #minipelosi #PureMichigan #LiesLiesLies #nomask #idc,0,1,,neg,@govwhitmer plandemic @realdonaldtrump #impeachwhitmer #minipelosi #puremichigan #lieslieslies   #idc
1253677628755791877,https://twitter.com/tx1iron/status/1253677628755791877,When these are the only footwear choice you need to make each day. #selfquarfarmtining #texas #countryliving #colemancounty #westtexascountry #farmwork @RedWingShoes #boots #covid19 #nowifi. #nomask #noproblem,tx1iron,2020-04-24 13:30:13+00:00,,@RedWingShoes,#selfquarfarmtining #texas #countryliving #colemancounty #westtexascountry #farmwork #boots #covid19 #nowifi #nomask #noproblem,0,3,,neg,when these are the only footwear choice you need to make each day. #selfquarfarmtining #texas #countryliving #colemancounty #westtexascountry #farmwork @redwingshoes #boots #covid19 #nowifi.   #noproblem
1253643156240961537,https://twitter.com/forcedanarchy/status/1253643156240961537,@NYGovCuomo Watch this! Actual medical doctors who have a different view than yours #nomask #nogloves END THE LOCKDOWN! https://m.youtube.com/watch?t=447s&amp;v=xfLVxx_lBLU#menu https://m.youtube.com/watch?v=zb6j7o1pLBw,forcedanarchy,2020-04-24 11:13:14+00:00,,@NYGovCuomo,#nomask #nogloves,0,0,,neg,@nygovcuomo watch this! actual medical doctors who have a different view than yours   #nogloves end the lockdown! https://m.youtube.com/watch?t=447s&amp;v=xflvxx_lblu#menu https://m.youtube.com/watch?v=zb6j7o1plbw
1253635015449116676,https://twitter.com/anilmaske301986/status/1253635015449116676,@mihirkotecha ji Irresponsible #No_Socialdistancing #Nomask #NoGloves while packing &amp; distribution of essential foods Kit's to needy people's in Mulund. I wonder how many will be running in hospital if no safety measurements taken.This is reckless @Dev_Fadnavis #COVID19,anilmaske301986,2020-04-24 10:40:53+00:00,,@mihirkotecha @Dev_Fadnavis,#No_Socialdistancing #Nomask #NoGloves #COVID19,0,1,,neg,@mihirkotecha ji irresponsible #no_socialdistancing   #nogloves while packing &amp; distribution of essential foods kit's to needy people's in mulund. i wonder how many will be running in hospital if no safety measurements taken.this is reckless @dev_fadnavis #covid19
1253594854300561409,https://twitter.com/forcedanarchy/status/1253594854300561409,Still think this is about health? This is about control and compliance... WE MUST STAND UP! #nomask https://m.youtube.com/watch?v=NzvmusWUmQs&amp;fbclid=IwAR2neAFMZ_yRufhaGmwJsIDIiQ84rsKPLiRjxk1G2bEPZMIEpGQvdIjlr38&amp;feature=emb_title,forcedanarchy,2020-04-24 08:01:18+00:00,,,#nomask,1,2,,neg,still think this is about health? this is about control and compliance... we must stand up!   https://m.youtube.com/watch?v=nzvmuswumqs&amp;fbclid=iwar2neafmz_yrufhagmwjsidiiq84rskplirjxk1g2bepzmiepgqvdijlr38&amp;feature=emb_title
1253593550417211392,https://twitter.com/senn60/status/1253593550417211392,And the frightened subservient public happily plays right into their slimy hands. @WWG1WGATrumper @RED_IN_PA @RememberPaoli @ZyroFoxtrot @LowInfoTweeter @LowInfoTweeter #IwillNOTComply #NOmask ##WeAreBeingPlayed,senn60,2020-04-24 07:56:07+00:00,Aliciastarr001,@WWG1WGATrumper @RED_IN_PA @RememberPaoli @ZyroFoxtrot @LowInfoTweeter @LowInfoTweeter,#IwillNOTComply #NOmask #WeAreBeingPlayed,0,0,,neg,and the frightened subservient public happily plays right into their slimy hands. @wwg1wgatrumper @red_in_pa @rememberpaoli @zyrofoxtrot @lowinfotweeter @lowinfotweeter #iwillnotcomply   ##wearebeingplayed
1253591383157456901,https://twitter.com/senn60/status/1253591383157456901,Then go and patronize a business that isn’t run by subservient idiots. There are plenty of them. #IwillNOTComply #WeAreBeingPlayed #NoMask #TheVirusIsAHoax,senn60,2020-04-24 07:47:31+00:00,Shannon70798106,,#IwillNOTComply #WeAreBeingPlayed #NoMask #TheVirusIsAHoax,0,0,,neg,then go and patronize a business that isn’t run by subservient idiots. there are plenty of them. #iwillnotcomply #wearebeingplayed   #thevirusisahoax
1253590106964926464,https://twitter.com/NatHawker/status/1253590106964926464,2/2. Without following best practice a mask is pointless if he has it it is now blown out of the valve of the mask onto his clothes and hands. If he doesn't have it and the mask has caught the droplets now he's touched the mask the droplets are on his hands. #mask #NoMask,NatHawker,2020-04-24 07:42:26+00:00,,,#mask #NoMask,0,2,,neg,2/2. without following best practice a mask is pointless if he has it it is now blown out of the valve of the mask onto his clothes and hands. if he doesn't have it and the mask has caught the droplets now he's touched the mask the droplets are on his hands. #mask  
1253585651540406273,https://twitter.com/Wolverine_201/status/1253585651540406273,Not enough photo-op opportunities in her constituency for the lady with #NoMask,Wolverine_201,2020-04-24 07:24:44+00:00,Deepakmanja,,#NoMask,0,2,,neg,not enough photo-op opportunities in her constituency for the lady with  
1253562005543247872,https://twitter.com/VivianLiu6/status/1253562005543247872,What’s wrong with Americans now? #MAGA2020 #COVID19 #nomask #Conservatives,VivianLiu6,2020-04-24 05:50:46+00:00,,,#MAGA2020 #COVID19 #nomask #Conservatives,1,0,,neg,what’s wrong with americans now? #maga2020 #covid19   #conservatives
1253523111502381056,https://twitter.com/BobBentz/status/1253523111502381056,My favorite for many reasons. #nomask #COVID19 #proofread #protest #SignsYoureACOVIDIOT,BobBentz,2020-04-24 03:16:13+00:00,,,#nomask #COVID19 #proofread #protest #SignsYoureACOVIDIOT,0,0,,neg,my favorite for many reasons.   #covid19 #proofread #protest #signsyoureacovidiot
1253510884229615616,https://twitter.com/forcedanarchy/status/1253510884229615616,@NYGovCuomo So you think you know more than WHO??? No need for healthy people to wear mask! Science not superstition https://www.businessinsider.com/who-no-need-for-healthy-people-to-wear-face-masks-2020-4 #nomask,forcedanarchy,2020-04-24 02:27:38+00:00,,@NYGovCuomo,#nomask,0,0,,neg,@nygovcuomo so you think you know more than who??? no need for healthy people to wear mask! science not superstition https://www.businessinsider.com/who-no-need-for-healthy-people-to-wear-face-masks-2020-4  
1253481639956459520,https://twitter.com/SuPerlative73/status/1253481639956459520,|| Quarantine Face || Look Ma No Mask || #QuarantineFace #IAmSmiling #SelfLord #NoMask #FuckTheRona @North Potomac Maryland https://www.instagram.com/p/B_V_UOXAqjn/?igshid=v0siwc67m7rk,SuPerlative73,2020-04-24 00:31:26+00:00,,,#QuarantineFace #IAmSmiling #SelfLord #NoMask #FuckTheRona,0,0,,neg,|| quarantine face || look ma no mask || #quarantineface #iamsmiling #selflord   #fucktherona @north potomac maryland https://www.instagram.com/p/b_v_uoxaqjn/?igshid=v0siwc67m7rk
1253478481159229440,https://twitter.com/skyculturemuse/status/1253478481159229440,Remember days like these... Remember when we could jump shout And sweat in public with our faces uncovered... . . #nomaskneeded #nomask #nomasks #dancelikenooneiswatching #shoutoutforshoutout #harlemnyc… https://www.instagram.com/p/B_V93IShQAb/?igshid=1et8607j6201v,skyculturemuse,2020-04-24 00:18:53+00:00,,,#nomaskneeded #nomask #nomasks #dancelikenooneiswatching #shoutoutforshoutout #harlemnyc,0,0,,neg,remember days like these... remember when we could jump shout and sweat in public with our faces uncovered... . .  needed    s #dancelikenooneiswatching #shoutoutforshoutout #harlemnyc… https://www.instagram.com/p/b_v93ishqab/?igshid=1et8607j6201v
1253768125851398144,https://twitter.com/BespokeKimberly/status/1253768125851398144,75 in San Diego! #nomask,BespokeKimberly,2020-04-24 19:29:49+00:00,cjtruth,,#nomask,0,4,,neg,75 in san diego!  
