id,url,raw_text,username,datetime_tweet,to,mentions,hashtags,retweets,favorites,geo,label,clean_text
1253833176885137414,https://twitter.com/jeneuston/status/1253833176885137414,mask of the day @LibertyLondon zodiac print handmade by Casting Director Legend//Seamstress Extraordinaire Allison Jones #WearAMask #grateful #longdistancefriendship ,jeneuston,2020-04-24 23:48:19+00:00,,@LibertyLondon,#WearAMask #grateful #grateful #longdistancefriendship,1,51,,pos,mask of the day @libertylondon zodiac print handmade by casting director legend//seamstress extraordinaire allison jones   #grateful #longdistancefriendship 
1253825694213128193,https://twitter.com/MindfulMajority/status/1253825694213128193,#Colorado's Governor @JaredPolis leading by example. #WearAMask #StopTheSpread,MindfulMajority,2020-04-24 23:18:35+00:00,,@jaredpolis,#Colorado #WearAMask #StopTheSpread,5,6,,pos,#colorado's governor @jaredpolis leading by example.   #stopthespread
1253813135443705856,https://twitter.com/Alexandra_Arts/status/1253813135443705856,"Vincent van Gogh ""Almond Blossom"" edited magenta #facemask #zazzle #zazzlemade #facemasks #diymask #facemasks4all #WearAMask #vangogh https://www.zazzle.com/z/atr5ajtq via @zazzle",Alexandra_Arts,2020-04-24 22:28:40+00:00,,@zazzle,#facemask #zazzle #zazzlemade #facemasks #diymask #facemasks4all #WearAMask #vangogh,4,8,,pos,"vincent van gogh ""almond blossom"" edited magenta #facemask #zazzle #zazzlemade #facemasks #diymask #facemasks4all   #vangogh https://www.zazzle.com/z/atr5ajtq via @zazzle"
1253805061672775689,https://twitter.com/GKMSOnline/status/1253805061672775689,Our locations in St. Catherine are now closed but a big THANK YOU to all our customers who followed the rules. We will be open tomorrow at 8 AM. Just remember to #WearAMask #Stand6FtApart #WU #BillExpress #FXTrader #GKMS,GKMSOnline,2020-04-24 21:56:35+00:00,,,#WearAMask #Stand6FtApart #WU #BillExpress #FXTrader #GKMS,3,16,,pos,our locations in st. catherine are now closed but a big thank you to all our customers who followed the rules. we will be open tomorrow at 8 am. just remember to   #stand6ftapart #wu #billexpress #fxtrader #gkms
1253780121439199232,https://twitter.com/aHEMandias/status/1253780121439199232,More & more evidence that #COVID19 is droplet-spread outside of environments like hospitals/residential treatment where it may be mechanically aerosolized. — #WearAMask #StayAtHome if possible @RadChick4Cast @Cara_TXZEAL @turnbolt11 @5afe_,aHEMandias,2020-04-24 20:17:29+00:00,zeynep,@RadChick4Cast @Cara_TXZEAL @turnbolt11 @5afe_,#COVID19 #WearAMask #StayAtHome #StayAtHome,4,8,,pos,more & more evidence that #covid19 is droplet-spread outside of environments like hospitals/residential treatment where it may be mechanically aerosolized. —   #stayathome if possible @radchick4cast @cara_txzeal @turnbolt11 @5afe_
1253769099601235975,https://twitter.com/GKMSOnline/status/1253769099601235975,Thank you Portmore!!! Getting the message loud and clear: #WearAMask #KeepYourDistance #BeSafe #WeCare and it's clear that you do too #GKMS #WU #BillExpress #FXTrader,GKMSOnline,2020-04-24 19:33:41+00:00,,,#WearAMask #KeepYourDistance #BeSafe #WeCare #GKMS #WU #BillExpress #FXTrader,20,54,,pos,thank you portmore!!! getting the message loud and clear:   #keepyourdistance #besafe #wecare and it's clear that you do too #gkms #wu #billexpress #fxtrader
1253729845156220928,https://twitter.com/GhazanGJ/status/1253729845156220928,Please wear a mask when outside it will keep you & others around you safe. It’s important not to touch the mask on the outside or leave it lying around. The outside surface of the mask is contaminated. Watch a video on YouTube of how to properly wear & remove a mask #WearAMask ,GhazanGJ,2020-04-24 16:57:42+00:00,Jhagra,,#WearAMask,5,18,,pos,please wear a mask when outside it will keep you & others around you safe. it’s important not to touch the mask on the outside or leave it lying around. the outside surface of the mask is contaminated. watch a video on youtube of how to properly wear & remove a mask   
1253726422876786688,https://twitter.com/tizzywoman/status/1253726422876786688,Spellcheck. It’s a beautiful thing. #WearAMask #NoBananas no matter whether the occupant recommends them or not.,tizzywoman,2020-04-24 16:44:06+00:00,,,#WearAMask #NoBananas,23,32,,pos,spellcheck. it’s a beautiful thing.   #nobananas no matter whether the occupant recommends them or not.
1253715465165312005,https://twitter.com/anneleaderegval/status/1253715465165312005,Proud to be a member of #TeamDoug and help my fellow Alabamians with a blood donation. If you go out #WearAMask and #WashYourHands! Thankful @DougJones is hard at work to help us stay safe and prepare for the long slow recovery ahead #alpolitics #OneAlabama – at LifeSouth Community Blood Center,anneleaderegval,2020-04-24 16:00:34+00:00,,@DougJones,#TeamDoug #WearAMask #WashYourHands #WashYourHands #alpolitics #OneAlabama,9,23,,pos,proud to be a member of #teamdoug and help my fellow alabamians with a blood donation. if you go out   and #washyourhands! thankful @dougjones is hard at work to help us stay safe and prepare for the long slow recovery ahead #alpolitics #onealabama – at lifesouth community blood center
1253712883403259909,https://twitter.com/iamjrbourne/status/1253712883403259909,Hey guys @IanBohen and I will see ya next Friday. Hope y’all are staying safe and well!! #StayHome #WearAMask,iamjrbourne,2020-04-24 15:50:18+00:00,,@IanBohen,#StayHome #StayHome #WearAMask,21,675,,pos,hey guys @ianbohen and i will see ya next friday. hope y’all are staying safe and well!! #stayhome  
1253686954631274498,https://twitter.com/NAICobservatory/status/1253686954631274498,Recently team radar got some interesting images from an observation. As Dr. Virkki tried to explain that a mask did not have much use in this case Greg just wanted to be a part of things. #wearamask #asteroid #friday #nasa #fridayvibes #greg #minicomic #comics #science – at Arecibo Observatory,NAICobservatory,2020-04-24 14:07:17+00:00,,,#wearamask #asteroid #friday #nasa #fridayvibes #greg #minicomic #comics #science,17,43,,pos,recently team radar got some interesting images from an observation. as dr. virkki tried to explain that a mask did not have much use in this case greg just wanted to be a part of things.   #asteroid #friday #nasa #fridayvibes #greg #minicomic #comics #science – at arecibo observatory
1253662749848199168,https://twitter.com/KristinAndrewz/status/1253662749848199168,How humans are not the only species with even silly social norms. BTW my old Doc Martins. Relevance for understanding #NormChange #Covid_19 #StopShakingHands #WearAMask ,KristinAndrewz,2020-04-24 12:31:06+00:00,CambUP_PHILNYUK,,#NormChange #Covid_19 #StopShakingHands #WearAMask,1,9,,pos,how humans are not the only species with even silly social norms. btw my old doc martins. relevance for understanding #normchange #covid_19 #stopshakinghands   
1253656601208205313,https://twitter.com/ChouettePupuce/status/1253656601208205313,#ClaytonCardenas #josephRaymondLucero Hello #MayansFamily Good day to all ! Create your own style cultivate your difference. This is what makes the wealth of the world... #MayansFX #MayansMC #YouCanSaveLives #StayAtHome #StaySafe #WearaMask ,ChouettePupuce,2020-04-24 12:06:40+00:00,,,#ClaytonCardenas #josephRaymondLucero #MayansFamily #MayansFX #MayansMC #YouCanSaveLives #StayAtHome #StayAtHome #StaySafe #WearaMask,0,22,,pos,#claytoncardenas #josephraymondlucero hello #mayansfamily good day to all ! create your own style cultivate your difference. this is what makes the wealth of the world... #mayansfx #mayansmc #youcansavelives #stayathome #staysafe   
1253648497200345089,https://twitter.com/RealMichaelGuy/status/1253648497200345089,Ultraviolet blood irradiation (UBI) was extensively used in the 1940s and 1950s to treat many diseases including septicemia pneumonia tuberculosis arthritis asthma and even poliomyelitis. Yeah UV works. New delivery methods exist. #WearAMask @MarkYoungTruth @chuckwoolery,RealMichaelGuy,2020-04-24 11:34:28+00:00,,@MarkYoungTruth @chuckwoolery,#WearAMask,926,2252,,pos,ultraviolet blood irradiation (ubi) was extensively used in the 1940s and 1950s to treat many diseases including septicemia pneumonia tuberculosis arthritis asthma and even poliomyelitis. yeah uv works. new delivery methods exist.   @markyoungtruth @chuckwoolery
1253629287049179136,https://twitter.com/ElizMarkowitz/status/1253629287049179136,Thank you to every individual who is willing to act in the interest of the greater good and the most vulnerable. You are appreciated! #COVID19 #covid #coronavirus #StayHome #besafe #WeAreInThisTogether #WearAMask #begood #love,ElizMarkowitz,2020-04-24 10:18:07+00:00,,,#COVID19 #covid #coronavirus #StayHome #StayHome #besafe #WeAreInThisTogether #WearAMask #begood #love,1,24,,pos,thank you to every individual who is willing to act in the interest of the greater good and the most vulnerable. you are appreciated! #covid19 #covid #coronavirus #stayhome #besafe #weareinthistogether   #begood #love
1253620379634896897,https://twitter.com/albyjohnV/status/1253620379634896897,#CoronaAuto introduced in South region GCC. Team #CoronaAuto will fine you Rs.100 if you are found with out wearing a mask. Also will give you 4 cloth masks so as to not repeat the offence. #WearAMask ,albyjohnV,2020-04-24 09:42:44+00:00,,,#CoronaAuto #CoronaAuto #WearAMask,56,247,,pos,#coronaauto introduced in south region gcc. team #coronaauto will fine you rs.100 if you are found with out wearing a mask. also will give you 4 cloth masks so as to not repeat the offence.   
1253559730888273920,https://twitter.com/Jay_Apoorva18/status/1253559730888273920,When people don't follow #StayHome #WearAMask rules set by Govt and roam around not practicing #SocialDistancing The #Tiruppur Police comes up with an innovative way to teach these youth a lesson they'll never forget! #coronavirus #COVID #TNFightsCorona #CoronavirusIndia,Jay_Apoorva18,2020-04-24 05:41:44+00:00,,,#StayHome #StayHome #WearAMask #SocialDistancing #Tiruppur #coronavirus #COVID #TNFightsCorona #CoronavirusIndia,7,37,,pos,when people don't follow #stayhome   rules set by govt and roam around not practicing #socialdistancing the #tiruppur police comes up with an innovative way to teach these youth a lesson they'll never forget! #coronavirus #covid #tnfightscorona #coronavirusindia
1253529088343461892,https://twitter.com/AdarshSindhu/status/1253529088343461892,Face Mask Culture #WearAMask #TelanganaFightsCorona #CoronaWillEndSoon,AdarshSindhu,2020-04-24 03:39:58+00:00,,,#WearAMask #TelanganaFightsCorona #CoronaWillEndSoon,7,488,,pos,face mask culture   #telanganafightscorona #coronawillendsoon
1253500971369369600,https://twitter.com/LBSchoolNurses/status/1253500971369369600,REMINDER: #Wearamask to protect yourself and others when picking up your food! A quick search on your smart phone and you can find many ways to make one out of household items. #coverup #savelives,LBSchoolNurses,2020-04-24 01:48:15+00:00,,,#Wearamask #coverup #savelives,5,14,,pos,reminder:   to protect yourself and others when picking up your food! a quick search on your smart phone and you can find many ways to make one out of household items. #coverup #savelives
1253832612940001280,https://twitter.com/DairyFreeGina/status/1253832612940001280,My husband got tested again today and is isolating himself until he gets results. Could use some prayers good thoughts #coronavirus #StayHomeSaveLives #WashYourHands #WearAMask,DairyFreeGina,2020-04-24 23:46:04+00:00,,,#coronavirus #StayHomeSaveLives #WashYourHands #WashYourHands #WearAMask,0,14,,pos,my husband got tested again today and is isolating himself until he gets results. could use some prayers good thoughts #coronavirus #stayhomesavelives #washyourhands  
1253829105293750273,https://twitter.com/gorillaman65/status/1253829105293750273,Why tf are stupid fucking people making this shit so much harder?? Just put on a bandana or cut up a tshirt. I don’t want to be the one kicking you out of a gas station but I’m not getting myself in trouble for you either. #WearAMask,gorillaman65,2020-04-24 23:32:08+00:00,,,#WearAMask,3,10,,pos,why tf are stupid fucking people making this shit so much harder?? just put on a bandana or cut up a tshirt. i don’t want to be the one kicking you out of a gas station but i’m not getting myself in trouble for you either.  
1253820943279013888,https://twitter.com/CityGrandRapids/status/1253820943279013888,We're reopening our Indian Trails Golf Course on Saturday & our yard waste drop-off site Monday per new #StayHomeStaySafe order. https://bit.ly/2VzR601 #PhysicalDistancing #WearAMask ,CityGrandRapids,2020-04-24 22:59:42+00:00,,,#StayHomeStaySafe #PhysicalDistancing #WearAMask,1,8,,pos,we're reopening our indian trails golf course on saturday & our yard waste drop-off site monday per new #stayhomestaysafe order. https://bit.ly/2vzr601 #physicaldistancing   
1253813338011811846,https://twitter.com/Alexandra_Arts/status/1253813338011811846,"Vincent van Gogh ""Almond Blossom"" #facemask #zazzle #zazzlemade #facemasks #diymask #facemasks4all #WearAMask #vangogh https://www.zazzle.com/z/7cfucwrm via @zazzle",Alexandra_Arts,2020-04-24 22:29:29+00:00,,@zazzle,#facemask #zazzle #zazzlemade #facemasks #diymask #facemasks4all #WearAMask #vangogh,4,7,,pos,"vincent van gogh ""almond blossom"" #facemask #zazzle #zazzlemade #facemasks #diymask #facemasks4all   #vangogh https://www.zazzle.com/z/7cfucwrm via @zazzle"
1253801689355677696,https://twitter.com/payalmehta100/status/1253801689355677696,Another modified order by MHA ... Shops in residential & market complexes other than multi-brand & single-brand malls outside municipal limits can open with 50% staff. Mandatory : #WearAMask &amp; practice #SocialDistancing No relaxation in containment zones/ Red Zones @HMOIndia,payalmehta100,2020-04-24 21:43:11+00:00,,@HMOIndia,#WearAMask #SocialDistancing,2,4,,pos,another modified order by mha ... shops in residential & market complexes other than multi-brand & single-brand malls outside municipal limits can open with 50% staff. mandatory :   &amp; practice #socialdistancing no relaxation in containment zones/ red zones @hmoindia
1253774094979534849,https://twitter.com/CityofVaBeach/status/1253774094979534849,The @VDHgov suggests the following ways you can help during the #COVID19 pandemic. #KeepYourDistance #SocialDistancing #DoYourPartStayApart #WashYourHands #WearAMask #StayAtHome #DisinfectYourDevices #SixFeetApart,CityofVaBeach,2020-04-24 19:53:32+00:00,,@VDHgov,#COVID19 #KeepYourDistance #SocialDistancing #DoYourPartStayApart #WashYourHands #WashYourHands #WearAMask #StayAtHome #StayAtHome #DisinfectYourDevices #SixFeetApart,6,9,,pos,the @vdhgov suggests the following ways you can help during the #covid19 pandemic. #keepyourdistance #socialdistancing #doyourpartstayapart #washyourhands   #stayathome #disinfectyourdevices #sixfeetapart
1253745882920607744,https://twitter.com/JayeRell/status/1253745882920607744,MASK ORDERS! A bunch going out today. #sewing #seamstress #diy #idoalot #budgeting #wearamask #dontsleep #protectyourself #wdywt #cutandsew #thegrindisreal,JayeRell,2020-04-24 18:01:26+00:00,,,#sewing #seamstress #diy #idoalot #budgeting #wearamask #dontsleep #protectyourself #wdywt #cutandsew #thegrindisreal,1,11,,pos,mask orders! a bunch going out today. #sewing #seamstress #diy #idoalot #budgeting   #dontsleep #protectyourself #wdywt #cutandsew #thegrindisreal
1253732809883123715,https://twitter.com/escobarforjudge/status/1253732809883123715,Division III team is committed to safety. #FlattenTheCurve #WearAMask ,escobarforjudge,2020-04-24 17:09:29+00:00,,,#FlattenTheCurve #WearAMask,1,19,,pos,division iii team is committed to safety. #flattenthecurve   
1253726205825744896,https://twitter.com/graceamazes1/status/1253726205825744896,#PiggyPublicServiceAnnouncement #StayHome #WearAMask !!!!!! #StaySafe For those who STILL did not wear masks in the store yesterday #MissGracieSay WEAR a MASK because I DON'T want PigMom or anyone else to get SICK!! AND it's also REQUIRED! So there! #tongueout,graceamazes1,2020-04-24 16:43:15+00:00,,,#PiggyPublicServiceAnnouncement #StayHome #StayHome #WearAMask #StaySafe #MissGracieSay #tongueout,1,8,,pos,#piggypublicserviceannouncement #stayhome   !!!!!! #staysafe for those who still did not wear masks in the store yesterday #missgraciesay wear a mask because i don't want pigmom or anyone else to get sick!! and it's also required! so there! #tongueout
1253717648036282373,https://twitter.com/anneleaderegval/status/1253717648036282373,Itching to get out? Donate blood ! Signup for an appointment at @LifeSouth or @RedCross and #WearAMask #OneAlabama,anneleaderegval,2020-04-24 16:09:14+00:00,,@LifeSouth @RedCross,#WearAMask #OneAlabama,2,3,,pos,itching to get out? donate blood ! signup for an appointment at @lifesouth or @redcross and   #onealabama
1253705280245968899,https://twitter.com/CindersCB/status/1253705280245968899,Those not wearing masks at Grocery Stores should automatically be denied entrance. It’s selfish to put others at risk especially grocery store workers working hard keeping others safe by using extra precautions! #MichiganMorons #Michigan #WearAMask,CindersCB,2020-04-24 15:20:06+00:00,MichStatePolice,,#MichiganMorons #Michigan #WearAMask,2,24,,pos,those not wearing masks at grocery stores should automatically be denied entrance. it’s selfish to put others at risk especially grocery store workers working hard keeping others safe by using extra precautions! #michiganmorons #michigan  
1253699999550132224,https://twitter.com/KtMcH/status/1253699999550132224,Y’all don’t ingest or inject cleaning material. That’s not how it works. #StayHome #WearAMask #WashHands #IgnoreTrump Common sense will get us through.,KtMcH,2020-04-24 14:59:07+00:00,MonaHannaA,,#StayHome #StayHome #WearAMask #WashHands #IgnoreTrump,1,6,,pos,y’all don’t ingest or inject cleaning material. that’s not how it works. #stayhome   #washhands #ignoretrump common sense will get us through.
1253678860257951744,https://twitter.com/Perk58476492/status/1253678860257951744,Before you step out to town wear a mask. Protect your self protect others and protect your family. Lifted lockdown doesn't mean corona is over. #Dontgoviral #Covid19Ghana #StayAtHome #WashYourHands #Socialdistancing #wearamask ,Perk58476492,2020-04-24 13:35:07+00:00,,,#Dontgoviral #Covid19Ghana #StayAtHome #StayAtHome #WashYourHands #WashYourHands #Socialdistancing #wearamask,2,3,,pos,before you step out to town wear a mask. protect your self protect others and protect your family. lifted lockdown doesn't mean corona is over. #dontgoviral #covid19ghana #stayathome #washyourhands #socialdistancing   
1253618576679813122,https://twitter.com/DurgeshG7/status/1253618576679813122, Indian Police Rocks Watch the video till end Whoever was not wearing Mask was Forced to Sit with FAKE #CORONA patient inside Van who was coughing #WearAMask #SignsYoureACOVIDIOT #CoronaVirusChallenge,DurgeshG7,2020-04-24 09:35:34+00:00,,,#CORONA #WearAMask #SignsYoureACOVIDIOT #CoronaVirusChallenge,5,12,,pos, indian police rocks watch the video till end whoever was not wearing mask was forced to sit with fake #corona patient inside van who was coughing   #signsyoureacovidiot #coronaviruschallenge
1253594232180240385,https://twitter.com/AmritaSinghABEF/status/1253594232180240385,Very Important !... Please refuse to relate closely with anyone not wearing a face mask.. Any type of facemask will do... @SrBachchan ji #StayAtHomeSaveLives #WearAMask #facemask #StayHomeStaySafe,AmritaSinghABEF,2020-04-24 07:58:50+00:00,,@SrBachchan,#StayAtHomeSaveLives #StayAtHomeSaveLives #WearAMask #facemask #StayHomeStaySafe,3,4,,pos,very important !... please refuse to relate closely with anyone not wearing a face mask.. any type of facemask will do... @srbachchan ji #stayathomesavelives   #facemask #stayhomestaysafe
1253588486889918465,https://twitter.com/limbachiyarohit/status/1253588486889918465,Let's protect each other by wearing a maskkeeping social distance and washing your hands frequently. Stay safe ! #TMBactionMasqueCONGO #WearAMask #covid19 #covid19out #RDC #Congo #maskchallenge,limbachiyarohit,2020-04-24 07:36:00+00:00,,,#TMBactionMasqueCONGO #WearAMask #covid19 #covid19out #RDC #Congo #maskchallenge,3,14,,pos,let's protect each other by wearing a maskkeeping social distance and washing your hands frequently. stay safe ! #tmbactionmasquecongo   #covid19 #covid19out #rdc #congo #maskchallenge
1253564445403410432,https://twitter.com/Jay_Apoorva18/status/1253564445403410432,"""There can be #coronavirus anywhere that's why govt police are repeatedly requesting people to #StayHome #WearAMask while coming out"" says a #Tiruppur Police officer also informing the person inside IS NOT a #COVID (+ve) patient but a commoner. The fear in the youth's eyes!",Jay_Apoorva18,2020-04-24 06:00:28+00:00,,,#coronavirus #StayHome #StayHome #WearAMask #Tiruppur #COVID,2,8,,pos,"""there can be #coronavirus anywhere that's why govt police are repeatedly requesting people to #stayhome   while coming out"" says a #tiruppur police officer also informing the person inside is not a #covid (+ve) patient but a commoner. the fear in the youth's eyes!"
1253555266722967553,https://twitter.com/robmhgoa/status/1253555266722967553,Come on India let's come together to the fight against #coronavirus as we always do seeing him on striker's end. We wish a very birthday to the legend @sachin_rt #indiafightscorona ##washyourhands #socialdistancing #wearamask #stayathome #jerseyno10 #HappyBirthdaySachin,robmhgoa,2020-04-24 05:24:00+00:00,,@sachin_rt,#coronavirus #indiafightscorona #washyourhands #washyourhands #socialdistancing #wearamask #stayathome #stayathome #jerseyno10 #HappyBirthdaySachin,4,4,,pos,come on india let's come together to the fight against #coronavirus as we always do seeing him on striker's end. we wish a very birthday to the legend @sachin_rt #indiafightscorona ##washyourhands #socialdistancing   #stayathome #jerseyno10 #happybirthdaysachin
1253536944388280327,https://twitter.com/ButUCanCallMeZ/status/1253536944388280327,I’m claustrophobic so wearing a mask makes me feel like I’m suffocating and brings on panic attacks. I still wear one when I have to go in public because I’m not a total tool. #StaySafe #StayHome #WearAMask,ButUCanCallMeZ,2020-04-24 04:11:11+00:00,,,#StaySafe #StayHome #StayHome #WearAMask,2,25,,pos,i’m claustrophobic so wearing a mask makes me feel like i’m suffocating and brings on panic attacks. i still wear one when i have to go in public because i’m not a total tool. #staysafe #stayhome  
1253528236996337668,https://twitter.com/duluthnaacp/status/1253528236996337668,Thanks to WDIO News for covering our 3rd Free Mask Distribution in Superior this early evening. #wearamask ,duluthnaacp,2020-04-24 03:36:35+00:00,,,#wearamask,2,6,,pos,thanks to wdio news for covering our 3rd free mask distribution in superior this early evening.   
1253527987837792260,https://twitter.com/lovelylisa/status/1253527987837792260,Lets get used to & normalize as our new reality. For now until vaccine are you with me? #NewProfilePic #WearAMask #coronavirus #COVID19 Thank you for your amazing leadership @GovSisolak in keeping #Nevada Safe #StayHomeForNevada #StayHomeSaveLives #VegasStrong,lovelylisa,2020-04-24 03:35:36+00:00,,@GovSisolak,#NewProfilePic #WearAMask #coronavirus #COVID19 #Nevada #StayHomeForNevada #StayHomeSaveLives #VegasStrong,0,1,,pos,lets get used to & normalize as our new reality. for now until vaccine are you with me? #newprofilepic   #coronavirus #covid19 thank you for your amazing leadership @govsisolak in keeping #nevada safe #stayhomefornevada #stayhomesavelives #vegasstrong
1253525573231611905,https://twitter.com/AecNewsToday/status/1253525573231611905,Myanmar urged to protect #freeexpression” &amp; all the #Myanmar Morning #news you need to know on one page for April 24 2020 via @AecNewsToday #Independent #Asean #journalism based in #Cambodia #StayHome #isolate #prepare #WearAMask ,AecNewsToday,2020-04-24 03:26:00+00:00,,@AecNewsToday,#freeexpression #Myanmar #news #Independent #Asean #journalism #Cambodia #StayHome #StayHome #isolate #prepare #WearAMask,0,0,,pos,myanmar urged to protect #freeexpression” &amp; all the #myanmar morning #news you need to know on one page for april 24 2020 via @aecnewstoday #independent #asean #journalism based in #cambodia #stayhome #isolate #prepare   
1253520776625451008,https://twitter.com/SharonMcAuley7/status/1253520776625451008,She was making a stand for her patients that are literally not able to speak for themselves. We are patient advocates. #StayHome #WashYourHands #WearAMask #Covid19 ,SharonMcAuley7,2020-04-24 03:06:57+00:00,Samwiswe,,#StayHome #StayHome #WashYourHands #WashYourHands #WearAMask #Covid19,0,2,,pos,she was making a stand for her patients that are literally not able to speak for themselves. we are patient advocates. #stayhome #washyourhands   #covid19 
1253520123450634241,https://twitter.com/YeshiSeli/status/1253520123450634241,Menswear in line with Covid-19. Don’t know whether this is a meme- but an interesting concept and very useful in the present situation #IndiaFightsCorona #WearAMask ,YeshiSeli,2020-04-24 03:04:21+00:00,,,#IndiaFightsCorona #WearAMask,0,0,,pos,menswear in line with covid-19. don’t know whether this is a meme- but an interesting concept and very useful in the present situation #indiafightscorona   
