id,url,raw_text,username,datetime_tweet,to,mentions,hashtags,retweets,favorites,geo,label,clean_text
1252348889216110594,https://twitter.com/burkemaryjane/status/1252348889216110594,Stay in Place. Maintain your space. Cover your face Marin County! #SaveLivesTogether #WearAMask ,burkemaryjane,2020-04-20 21:30:17+00:00,,,#SaveLivesTogether #WearAMask,8,10,,pos,stay in place. maintain your space. cover your face marin county! #savelivestogether   
1252342039489810432,https://twitter.com/PetsforPatriots/status/1252342039489810432,Franky was used as bait had many surgeries to survive + was adopted by a multi-tour #Army veteran who lost his leg in combat. These two warriors were adopted last summer + our hero fund just paid for Franky's visit to @SangoVet where he offered to #WearAMask ,PetsforPatriots,2020-04-20 21:03:04+00:00,,@SangoVet,#Army #WearAMask,6,26,,pos,franky was used as bait had many surgeries to survive + was adopted by a multi-tour #army veteran who lost his leg in combat. these two warriors were adopted last summer + our hero fund just paid for franky's visit to @sangovet where he offered to   
1252342031956893696,https://twitter.com/sheryl_monk/status/1252342031956893696,that they'll abide by the 3 people at a time rule #SocialDistancing and #WearAMask and again putting police in danger while expecting them to enforce this riiight? 2/5 ,sheryl_monk,2020-04-20 21:03:02+00:00,,,#SocialDistancing #WearAMask,7,9,,pos,that they'll abide by the 3 people at a time rule #socialdistancing and   and again putting police in danger while expecting them to enforce this riiight? 2/5 
1252318358613176328,https://twitter.com/Covid19Girls/status/1252318358613176328,wearing a mask in public can help make any trip exciting #GoldenGirls #COVID19 #WearAMask ,Covid19Girls,2020-04-20 19:28:58+00:00,,,#GoldenGirls #COVID19 #WearAMask,12,24,,pos,wearing a mask in public can help make any trip exciting #goldengirls #covid19   
1252314849889202177,https://twitter.com/ellenspicy23/status/1252314849889202177,“If you have to go outside wear a mask” - @EdMarkey | Just dropped some nom papers in the mail to help get Ed on the Ballot. Also I’d like to take a moment to thank my mom in CA for this mask. It has the added bonus of feeling like one of her handmade quilts. #WearAMask ,ellenspicy23,2020-04-20 19:15:01+00:00,,@EdMarkey,#WearAMask,1,12,,pos,“if you have to go outside wear a mask” - @edmarkey | just dropped some nom papers in the mail to help get ed on the ballot. also i’d like to take a moment to thank my mom in ca for this mask. it has the added bonus of feeling like one of her handmade quilts.   
1252302856478171137,https://twitter.com/litbrit/status/1252302856478171137,Coffee wine sleep no sleep coffee again...it’s Monday right? #BringEverythingToAGrindingHalt #keepcalm #quarantinelife #stayhome #wearamask #notmeus,litbrit,2020-04-20 18:27:22+00:00,,,#BringEverythingToAGrindingHalt #keepcalm #quarantinelife #stayhome #stayhome #wearamask #notmeus,2,16,,pos,coffee wine sleep no sleep coffee again...it’s monday right? #bringeverythingtoagrindinghalt #keepcalm #quarantinelife #stayhome   #notmeus
1252298242093715460,https://twitter.com/julieerindesign/status/1252298242093715460,#SOLD from my @zazzle store! #flipflops #pattern #facemask https://buff.ly/2RTx9iz #zazzle #zazzlemade #facemasks #diymask #facemasks4all #wearamask ,julieerindesign,2020-04-20 18:09:02+00:00,,@zazzle,#SOLD #flipflops #flipflops #pattern #facemask #zazzle #zazzlemade #facemasks #diymask #facemasks4all #wearamask,2,12,,pos,#sold from my @zazzle store! #flipflops #pattern #facemask https://buff.ly/2rtx9iz #zazzle #zazzlemade #facemasks #diymask #facemasks4all   
1252295832679915520,https://twitter.com/President_Ruud/status/1252295832679915520,We must protect each other. Do your part like Putnam the Pioneer. And follow the great leadership and advice we are getting in Ohio from @GovMikeDeWine @JonHusted @DrAmyActon #WearAMask #COVID19 #WereInThisTogether #BringForthAPioneer,President_Ruud,2020-04-20 17:59:27+00:00,,@GovMikeDeWine @JonHusted @DrAmyActon,#WearAMask #COVID19 #WereInThisTogether #BringForthAPioneer,1,25,,pos,we must protect each other. do your part like putnam the pioneer. and follow the great leadership and advice we are getting in ohio from @govmikedewine @jonhusted @dramyacton   #covid19 #wereinthistogether #bringforthapioneer
1252286341095788544,https://twitter.com/B52Malmet/status/1252286341095788544,Words can spread the virus. All those unmasked anti-quarantine shouters are expressing their freedom to catch #coronavirus #WearAMask https://www.thedailybeast.com/can-you-spread-coronavirus-just-by-speaking?source=twitter&amp;via=desktop via @thedailybeast,B52Malmet,2020-04-20 17:21:44+00:00,,@thedailybeast,#coronavirus #WearAMask,40,70,,pos,words can spread the virus. all those unmasked anti-quarantine shouters are expressing their freedom to catch #coronavirus   https://www.thedailybeast.com/can-you-spread-coronavirus-just-by-speaking?source=twitter&amp;via=desktop via @thedailybeast
1252283639683047428,https://twitter.com/GetWisdomDude/status/1252283639683047428,Nurses Work 14Hours Straight Trying To Oxygenate People Gasping For Breath As #COVID19 Fills Their Lungs Knowing If You Would At Least #WearAMask #WashYourHands #KeepYourDistance More People Will Be Saved. #FrontLineHeroes Work To SAVE Your Life.,GetWisdomDude,2020-04-20 17:11:00+00:00,,,#COVID19 #WearAMask #WashYourHands #WashYourHands #KeepYourDistance #FrontLineHeroes,28,36,,pos,nurses work 14hours straight trying to oxygenate people gasping for breath as #covid19 fills their lungs knowing if you would at least   #washyourhands #keepyourdistance more people will be saved. #frontlineheroes work to save your life.
1252241610911281152,https://twitter.com/HoustonTX/status/1252241610911281152,This may be the only time #Batman tells us to #BeLikeBane! The CDC now recommends we all #WearAMask to combat #COVID19 &amp; #StopTheSpread. Find more information on how to #FlattenTheCurve of #CoronaVirus at http://houstonemergency.org/covid19 #LongLiveTheBat @Nick_Anderson_ @DCComics @DCBatman,HoustonTX,2020-04-20 14:24:00+00:00,,@Nick_Anderson_ @DCComics @DCBatman,#Batman #Batman #BeLikeBane #WearAMask #COVID19 #StopTheSpread #FlattenTheCurve #CoronaVirus #LongLiveTheBat,22,72,,pos,this may be the only time #batman tells us to #belikebane! the cdc now recommends we all   to combat #covid19 &amp; #stopthespread. find more information on how to #flattenthecurve of #coronavirus at http://houstonemergency.org/covid19 #longlivethebat @nick_anderson_ @dccomics @dcbatman
1252238250804219905,https://twitter.com/GarnetValleyFB/status/1252238250804219905,If you have to go out to an essential store #WearAMask . If you are an asymptomatic carrier without a mask on you put everyone at risk. If we all wear masks we minimize our chances of getting infected and infecting anyone else. We are all in this together! #StaySafe,GarnetValleyFB,2020-04-20 14:10:39+00:00,,,#WearAMask #StaySafe,6,24,,pos,if you have to go out to an essential store   . if you are an asymptomatic carrier without a mask on you put everyone at risk. if we all wear masks we minimize our chances of getting infected and infecting anyone else. we are all in this together! #staysafe
1252228128182685704,https://twitter.com/ADcpsouthdelhi/status/1252228128182685704,Schooling the violators Violators flouting #Lockdown2 were made to assist the personnel in ensuring enforcement of the rules #WearAMask #StayAwareStaySafe #StayHome #IndiaFightsCOVID19 @DCPSouthDelhi @DelhiPolice,ADcpsouthdelhi,2020-04-20 13:30:25+00:00,,@DCPSouthDelhi @DelhiPolice,#Lockdown2 #WearAMask #StayAwareStaySafe #StayHome #StayHome #IndiaFightsCOVID19,12,50,,pos,schooling the violators violators flouting #lockdown2 were made to assist the personnel in ensuring enforcement of the rules   #stayawarestaysafe #stayhome #indiafightscovid19 @dcpsouthdelhi @delhipolice
1252191199219388416,https://twitter.com/ImpeachmentHour/status/1252191199219388416,This. #wearamask #protectyourselvesandotherspeople,ImpeachmentHour,2020-04-20 11:03:41+00:00,,,#wearamask #protectyourselvesandotherspeople,12,11,,pos,this.   #protectyourselvesandotherspeople
1252170184187506688,https://twitter.com/GuardianSinga/status/1252170184187506688,I’m a #SingaporeSuperhero that wears a mask even though I don’t really need it but it protects me from dirt and debris (hate the taste ugh!) and you from me if I happen to be sick. You really don’t want to be catching germs from a lion. Really. #WearAMask ,GuardianSinga,2020-04-20 09:40:10+00:00,,,#SingaporeSuperhero #WearAMask,37,74,,pos,i’m a #singaporesuperhero that wears a mask even though i don’t really need it but it protects me from dirt and debris (hate the taste ugh!) and you from me if i happen to be sick. you really don’t want to be catching germs from a lion. really.   
1252154966669774848,https://twitter.com/Wamagaisa/status/1252154966669774848,I shared this elsewhere. Don’t be shy to wear a mask #Masks4All #WearAMask ,Wamagaisa,2020-04-20 08:39:42+00:00,,,#Masks4All #WearAMask,29,130,,pos,i shared this elsewhere. don’t be shy to wear a mask #masks4all   
1252136334052913152,https://twitter.com/DrKwokKaKi/status/1252136334052913152,This is very welcome news but we must remain vigilant! The #CCPVirus/#COVID19 pandemic is not over we must not let our efforts go to waste! Practice #SocialDistancing #WearAMask and avoid crowded places! ,DrKwokKaKi,2020-04-20 07:25:40+00:00,rthk_enews,,#CCPVirus #COVID19 #SocialDistancing #WearAMask,5,22,,pos,this is very welcome news but we must remain vigilant! the #ccpvirus/#covid19 pandemic is not over we must not let our efforts go to waste! practice #socialdistancing   and avoid crowded places! 
1252126187087900673,https://twitter.com/LPrivileged/status/1252126187087900673,My mask My mask protects me to some degree My mask protects you to some degree My mask reminds us these are not normal times It says let's keep our distance this bugger is airborne let's protect eachother as much as we can #WearAMask ,LPrivileged,2020-04-20 06:45:21+00:00,,,#WearAMask,8,19,,pos,my mask my mask protects me to some degree my mask protects you to some degree my mask reminds us these are not normal times it says let's keep our distance this bugger is airborne let's protect eachother as much as we can   
1252041960602374145,https://twitter.com/TallyPD/status/1252041960602374145,Officer Justin Hill is repping the home team while staying safe & keeping the community safe. He reminds you to do the #9PMRoutine &amp; #StayHome if you can. #lockyourdoors #stayhomestaysafesavelives #wearamask #FSU #seminoles #ihearttally #LivePDNation,TallyPD,2020-04-20 01:10:39+00:00,,,#9PMRoutine #StayHome #StayHome #lockyourdoors #stayhomestaysafesavelives #wearamask #FSU #seminoles #ihearttally #LivePDNation,18,309,,pos,officer justin hill is repping the home team while staying safe & keeping the community safe. he reminds you to do the #9pmroutine &amp; #stayhome if you can. #lockyourdoors #stayhomestaysafesavelives   #fsu #seminoles #ihearttally #livepdnation
1252371161100378112,https://twitter.com/daveaustinbooks/status/1252371161100378112,My wife and I looked like we were getting ready to rob the garden center @Walmart today. Not to worry we paid for everything even though we looked like a modern-day Bonnie &amp; Clyde! #WearAMask #SocialDistancing #yardwork #goodvibration @30secondsout @smithoptics,daveaustinbooks,2020-04-20 22:58:47+00:00,,@Walmart @30secondsout @smithoptics,#WearAMask #SocialDistancing #yardwork #goodvibration,0,7,,pos,my wife and i looked like we were getting ready to rob the garden center @walmart today. not to worry we paid for everything even though we looked like a modern-day bonnie &amp; clyde!   #socialdistancing #yardwork #goodvibration @30secondsout @smithoptics
1252366551644160005,https://twitter.com/ColeAllen_1/status/1252366551644160005,Last day as a 13yo. Getting photobombed by my cat. Thanks Charlie. #cats #WearAMask #StayHome,ColeAllen_1,2020-04-20 22:40:28+00:00,,,#cats #WearAMask #StayHome #StayHome,1,21,,pos,last day as a 13yo. getting photobombed by my cat. thanks charlie. #cats   #stayhome
1252339349963698177,https://twitter.com/larrypareigis/status/1252339349963698177,#COVID19 USA update: 786413 cases in total with 21777 new cases just today; 42048 deaths in total with 1473 deaths just today. 5.34% mortality rate. #NotTheFlu #StayHome #StaySafe #WearAMask ,larrypareigis,2020-04-20 20:52:23+00:00,,,#COVID19 #NotTheFlu #StayHome #StayHome #StaySafe #WearAMask,3,5,,pos,#covid19 usa update: 786413 cases in total with 21777 new cases just today; 42048 deaths in total with 1473 deaths just today. 5.34% mortality rate. #nottheflu #stayhome #staysafe   
1252324496041816068,https://twitter.com/CNkulikiyinka/status/1252324496041816068,.Update on/ Mise à Jour sur/ Amakuru Mashya kuri #COVID19 on 20.04.2020 in #Rwanda: 1299 samples tested No new case identified Total cases 147 from which 80 recoveries (4 new today) #GumaMuRugo #StayAtHome #WearAMask #WashYourHands,CNkulikiyinka,2020-04-20 19:53:21+00:00,,,#COVID19 #Rwanda #GumaMuRugo #StayAtHome #StayAtHome #WearAMask #WashYourHands #WashYourHands,1,4,,pos,.update on/ mise à jour sur/ amakuru mashya kuri #covid19 on 20.04.2020 in #rwanda: 1299 samples tested no new case identified total cases 147 from which 80 recoveries (4 new today) #gumamurugo #stayathome   #washyourhands
1252313506038218752,https://twitter.com/antoniorcorbo/status/1252313506038218752,I sure do miss days like this but we all must follow our state and city guidelines so that we can get back to the days we all miss so much. #InThisTogether #wearamask #staysafe #SaferAtHome See you Thursday night @CBS @broke,antoniorcorbo,2020-04-20 19:09:41+00:00,,@CBS @broke,#InThisTogether #wearamask #staysafe #SaferAtHome,0,24,,pos,i sure do miss days like this but we all must follow our state and city guidelines so that we can get back to the days we all miss so much. #inthistogether   #staysafe #saferathome see you thursday night @cbs @broke
1252307526772830208,https://twitter.com/ChouettePupuce/status/1252307526772830208,#ManCrushMonday This week my #MCM is this awesome mascot !!! #YouCanSaveLives #StayAtHome #StaySafe #WearaMask ,ChouettePupuce,2020-04-20 18:45:55+00:00,ClaytoonSquad,,#ManCrushMonday #MCM #YouCanSaveLives #StayAtHome #StayAtHome #StaySafe #WearaMask,0,13,,pos,#mancrushmonday this week my #mcm is this awesome mascot !!! #youcansavelives #stayathome #staysafe   
1252299164463108099,https://twitter.com/humphreyBCE/status/1252299164463108099,Picking up my dog meds #WearAMask #makelifefun #VirtualSpiritWeek #redwhiteandblue #oneBCE @BCEBobcat,humphreyBCE,2020-04-20 18:12:42+00:00,,@BCEBobcat,#WearAMask #makelifefun #VirtualSpiritWeek #redwhiteandblue #oneBCE,1,6,,pos,picking up my dog meds   #makelifefun #virtualspiritweek #redwhiteandblue #onebce @bcebobcat
1252297446778187777,https://twitter.com/GetWisdomDude/status/1252297446778187777,Nurses Work 14hrs Straight Trying To Oxygenate & Save People Gasping For Breath As #COVID19 Fills Their Lungs Knowing If You Would At Least #WearAMask #WashYourHands More People Will Be Saved. #FrontLineHeroes Work Hard But There's No Cure For Stupid,GetWisdomDude,2020-04-20 18:05:52+00:00,,,#COVID19 #WearAMask #WashYourHands #WashYourHands #FrontLineHeroes,8,8,,pos,nurses work 14hrs straight trying to oxygenate & save people gasping for breath as #covid19 fills their lungs knowing if you would at least   #washyourhands more people will be saved. #frontlineheroes work hard but there's no cure for stupid
1252276097682747394,https://twitter.com/PegMargoAnn/status/1252276097682747394,My grocery store working daughter wears a mask to protect you. Neither her store nor #FL requires shoppers to #WearAMask Please protect my daughter and #ProtectOthers and #MaskUp ,PegMargoAnn,2020-04-20 16:41:02+00:00,NYGovCuomo,,#FL #WearAMask #ProtectOthers #MaskUp,2,18,,pos,my grocery store working daughter wears a mask to protect you. neither her store nor #fl requires shoppers to   please protect my daughter and #protectothers and #maskup 
1252267631513649155,https://twitter.com/wearamasknow/status/1252267631513649155,I like the almost casual disinfection of hands and shopping cart handle. #WearAMask #Masks4All #MandatoryMasking in #Austria for 2 weeks now impressive reduction of new cases https://twitter.com/VKJudit/status/1252250829727371268,wearamasknow,2020-04-20 16:07:24+00:00,,,#WearAMask #Masks4All #MandatoryMasking #Austria,2,5,,pos,i like the almost casual disinfection of hands and shopping cart handle.   #masks4all #mandatorymasking in #austria for 2 weeks now impressive reduction of new cases https://twitter.com/vkjudit/status/1252250829727371268
1252262656762929156,https://twitter.com/colleengrott/status/1252262656762929156,The Governor just said we have to #WearAMask in public. Think I’d rather #StayHome! #SeniorDog.,colleengrott,2020-04-20 15:47:37+00:00,,,#WearAMask #StayHome #StayHome #SeniorDog,0,6,,pos,the governor just said we have to   in public. think i’d rather #stayhome! #seniordog.
1252254903713640450,https://twitter.com/wearamasknow/status/1252254903713640450,"German town #Jena has 2 additional restrictions vs. most of Germany: 1. Mandatory 2 week quarantine for anyone coming in from a ""risk area"". 2. #MandatoryMasking for everyone in public &amp; at work (3 weeks now) No new infections for 11 days! #UniversalMasking #Masks4All #WearAMask ",wearamasknow,2020-04-20 15:16:49+00:00,,,#Jena #MandatoryMasking #UniversalMasking #Masks4All #WearAMask,7,7,,pos,"german town #jena has 2 additional restrictions vs. most of germany: 1. mandatory 2 week quarantine for anyone coming in from a ""risk area"". 2. #mandatorymasking for everyone in public &amp; at work (3 weeks now) no new infections for 11 days! #universalmasking #masks4all   "
1252254688696848385,https://twitter.com/adgblog/status/1252254688696848385,Street art in Florence during Corona virus times... #Florence #florenz #wearamask #facemask #coronavirusitalIa #lockdown #coronavirus #coronavirusitalia #streetart #Firenze ,adgblog,2020-04-20 15:15:58+00:00,,,#Florence #florenz #wearamask #facemask #coronavirusitalIa #lockdown #coronavirus #coronavirusitalia #streetart #Firenze,6,13,,pos,street art in florence during corona virus times... #florence #florenz   #facemask #coronavirusitalia #lockdown #coronavirus #coronavirusitalia #streetart #firenze 
1252244619405987840,https://twitter.com/MrTinDC/status/1252244619405987840,This fatality rate is so high because many infected are asymptomatic. But if you do develop symptoms that warrant getting tested this is a frighteningly high death rate. Don't roll the dice DC #StayHome #StayAtHome #WearAMask ,MrTinDC,2020-04-20 14:35:57+00:00,DaveStroup,,#StayHome #StayHome #StayAtHome #StayAtHome #WearAMask,1,10,,pos,this fatality rate is so high because many infected are asymptomatic. but if you do develop symptoms that warrant getting tested this is a frighteningly high death rate. don't roll the dice dc #stayhome #stayathome   
1252236469491560458,https://twitter.com/CSquared_Africa/status/1252236469491560458,If we are all wearing a mask then we're all protecting each other! #WearAMask #COVID19 #protecteachother,CSquared_Africa,2020-04-20 14:03:34+00:00,,,#WearAMask #COVID19 #protecteachother,11,14,,pos,if we are all wearing a mask then we're all protecting each other!   #covid19 #protecteachother
1252225614737633280,https://twitter.com/harishmehta_/status/1252225614737633280,Masked & getting ready to clock 4000 steps for the day. Wearing mask for the safety of one's own self & for others. The only way #Covid19 can be defeated is by fighting together. @AUThackeray @OfficeofUT @mybmc #OneWorld #TogetherAtHome #IndiaFightsCorona #WearAMask #StaySafe,harishmehta_,2020-04-20 13:20:26+00:00,,@AUThackeray @OfficeofUT @mybmc,#Covid19 #OneWorld #TogetherAtHome #IndiaFightsCorona #WearAMask #StaySafe,0,7,,pos,masked & getting ready to clock 4000 steps for the day. wearing mask for the safety of one's own self & for others. the only way #covid19 can be defeated is by fighting together. @authackeray @officeofut @mybmc #oneworld #togetherathome #indiafightscorona   #staysafe
1252219347688439809,https://twitter.com/PantheonsStP/status/1252219347688439809,Whose No. 11 - She got caught up in all the queues at the supermarket so a few days behind schedule ;-) - but she's taking appropriate preventative action... #COVID19 #WearAMask #marble #sculpture #monument #artdetail @StPaulsLondon @ArtHistoryYork @StPaulsColls,PantheonsStP,2020-04-20 12:55:32+00:00,,@StPaulsLondon @ArtHistoryYork @StPaulsColls,#COVID19 #WearAMask #marble #sculpture #monument #artdetail,2,3,,pos,whose no. 11 - she got caught up in all the queues at the supermarket so a few days behind schedule ;-) - but she's taking appropriate preventative action... #covid19   #marble #sculpture #monument #artdetail @stpaulslondon @arthistoryyork @stpaulscolls
1252102760792616960,https://twitter.com/katewawa/status/1252102760792616960,This is my Grandpa Rudy. He’s 105 years old. Like the rest of us he wishes he was on vacation instead of quarantine. He misses having dinner with his friends and going to the gym too. #WearAMask #StayHome and who knows maybe you’ll live to see 105.,katewawa,2020-04-20 05:12:15+00:00,,,#WearAMask #StayHome #StayHome,2,6,,pos,this is my grandpa rudy. he’s 105 years old. like the rest of us he wishes he was on vacation instead of quarantine. he misses having dinner with his friends and going to the gym too.   #stayhome and who knows maybe you’ll live to see 105.
1252075609758543877,https://twitter.com/kbcenglish/status/1252075609758543877,Good morning! #StaySafe #StayIndoors #WearAMask if you've got to be outdoors and enjoy #Breakfast2020 with @juliawanjiku! Tell us where you are listening from! #BreakfastKBC #ItsMondayAndItsOK,kbcenglish,2020-04-20 03:24:22+00:00,,@juliawanjiku,#StaySafe #StayIndoors #WearAMask #Breakfast2020 #BreakfastKBC #ItsMondayAndItsOK,1,9,,pos,good morning! #staysafe #stayindoors   if you've got to be outdoors and enjoy #breakfast2020 with @juliawanjiku! tell us where you are listening from! #breakfastkbc #itsmondayanditsok
1252043118666559488,https://twitter.com/playkimie/status/1252043118666559488,Aloha means wear a mask when you leave the hale! I’ll be giving away some of these masks soon. #masks4all #aloha #wearamask @Ala Moana-Kakaako https://www.instagram.com/p/B_LxJrIHlH0/?igshid=16iomfdodwvwy,playkimie,2020-04-20 01:15:15+00:00,,,#masks4all #aloha #wearamask,2,12,,pos,aloha means wear a mask when you leave the hale! i’ll be giving away some of these masks soon. #masks4all #aloha   @ala moana-kakaako https://www.instagram.com/p/b_lxjrihlh0/?igshid=16iomfdodwvwy
1252043057668784128,https://twitter.com/AecNewsToday/status/1252043057668784128,Cambodia’s Leaders Line Up a #Coronavirus Scapegoat ” &amp; all the #Cambodia Morning #news you need to know on one page for April 20 2020 via @AecNewsToday #Independent #Asean #journalism based in #Cambodia #StayHome #isolate #prepare #WearAMask ,AecNewsToday,2020-04-20 01:15:01+00:00,,@AecNewsToday,#Coronavirus #Cambodia #news #Independent #Asean #journalism #Cambodia #StayHome #StayHome #isolate #prepare #WearAMask,2,1,,pos,cambodia’s leaders line up a #coronavirus scapegoat ” &amp; all the #cambodia morning #news you need to know on one page for april 20 2020 via @aecnewstoday #independent #asean #journalism based in #cambodia #stayhome #isolate #prepare   
1252042647553761281,https://twitter.com/ModellaireB/status/1252042647553761281,"New fabrics! ""I Am Covered"" Reusable Face Mask #shopmodellaire #stayhome #wearamask #staysafe @Modellaire Boutique https://www.instagram.com/p/B_Lw7-aHTdR/?igshid=ru3erguzj72p",ModellaireB,2020-04-20 01:13:23+00:00,,,#shopmodellaire #stayhome #stayhome #wearamask #staysafe,0,0,,pos,"new fabrics! ""i am covered"" reusable face mask #shopmodellaire #stayhome   #staysafe @modellaire boutique https://www.instagram.com/p/b_lw7-ahtdr/?igshid=ru3erguzj72p"
1252040700050489346,https://twitter.com/2ti_15/status/1252040700050489346,This isn't about you this is about those that are at higher risks of serious complications and preventable deaths. #StayHome unless it's for essential travel and #WearAMask at all times.,2ti_15,2020-04-20 01:05:39+00:00,,,#StayHome #StayHome #WearAMask,0,4,,pos,this isn't about you this is about those that are at higher risks of serious complications and preventable deaths. #stayhome unless it's for essential travel and   at all times.
1252038910294798336,https://twitter.com/aguacateontoast/status/1252038910294798336,One of the top Vibez curator @marcrebillet Providing another round of classic audio art On the Fuck Corona Virus stream #wearamask #dontbeaputo #quarantineandchill #sundayvibes #brunch #quaranstream pic.twitter.com/PQ7f2toDO3,aguacateontoast,2020-04-20 00:58:32+00:00,,@marcrebillet,#wearamask #dontbeaputo #quarantineandchill #sundayvibes #brunch #quaranstream,0,1,,pos,one of the top vibez curator @marcrebillet providing another round of classic audio art on the fuck corona virus stream   #dontbeaputo #quarantineandchill #sundayvibes #brunch #quaranstream pic.twitter.com/pq7f2todo3
