id,url,raw_text,username,datetime_tweet,to,mentions,hashtags,retweets,favorites,geo,label,clean_text
1283851629368872960,https://twitter.com/RepDianaDeGette/status/1283851629368872960,If you want to help stop the spread of this virus wear a mask. If you want to protect yourself and your community wear a mask. This isn’t political. It’s science. #WearAMask,RepDianaDeGette,2020-07-16 19:50:55+00:00,,,#WearAMask,34,117,,pos,if you want to help stop the spread of this virus wear a mask. if you want to protect yourself and your community wear a mask. this isn’t political. it’s science.  
1283848739724066817,https://twitter.com/Voiceoverlady1/status/1283848739724066817,Coronavirus in Arkansas: Governor Hutchinson announces statewide face covering mandate starting Monday ^^^^it’s about damn time!!!! #COVID19 #WearAMask,Voiceoverlady1,2020-07-16 19:39:26+00:00,,,#COVID19 #WearAMask,25,75,,pos,coronavirus in arkansas: governor hutchinson announces statewide face covering mandate starting monday ^^^^it’s about damn time!!!! #covid19  
1283848086620700672,https://twitter.com/alexjahangir/status/1283848086620700672,It is our civic duty to wear a mask. #WearAMask ,alexjahangir,2020-07-16 19:36:51+00:00,JohnCooper4Nash,,#WearAMask,23,143,,pos,it is our civic duty to wear a mask.   
1283847618578219016,https://twitter.com/WarEagle/status/1283847618578219016,My trainer is wearing his @AuburnU mask for all those at @AUMedClinic! Also remember to keep staying at least my wingspan (6.5 feet) away from others! #Aurea #WarEagle #Auburn #WearAMask ,WarEagle,2020-07-16 19:34:59+00:00,,@AuburnU @AUMedClinic,#Aurea #WarEagle #Auburn #WearAMask,21,209,,pos,my trainer is wearing his @auburnu mask for all those at @aumedclinic! also remember to keep staying at least my wingspan (6.5 feet) away from others! #aurea #wareagle #auburn   
1283847512449843202,https://twitter.com/HealthierColo/status/1283847512449843202,Breaking: Governor Polis has issued a statewide order requiring that people wear face coverings in indoor public spaces. Thank you for prioritizing the safety of all Coloradans and our economy. #WearAMask ,HealthierColo,2020-07-16 19:34:34+00:00,,,#WearAMask,62,267,,pos,breaking: governor polis has issued a statewide order requiring that people wear face coverings in indoor public spaces. thank you for prioritizing the safety of all coloradans and our economy.   
1283844467246718977,https://twitter.com/JP_ComplianceJD/status/1283844467246718977,Just gonna leave this here and generally @everyone who wants sports to return but refuses to wear a mask. #WearAMask ,JP_ComplianceJD,2020-07-16 19:22:28+00:00,,,#WearAMask,54,176,,pos,just gonna leave this here and generally @everyone who wants sports to return but refuses to wear a mask.   
1283843696820092928,https://twitter.com/LRossTV/status/1283843696820092928,IF Venus Williams can wear a mask before she competes we all can! #WearAMask ,LRossTV,2020-07-16 19:19:24+00:00,,,#WearAMask,78,518,,pos,if venus williams can wear a mask before she competes we all can!   
1283842061796544512,https://twitter.com/AACsports/status/1283842061796544512,Dear AAC student-athletes We miss you. Please #WearAMask so we can be reunited soon. Sincerely The Appalachian Athletic Conference ,AACsports,2020-07-16 19:12:54+00:00,,,#WearAMask,70,171,,pos,dear aac student-athletes we miss you. please   so we can be reunited soon. sincerely the appalachian athletic conference 
1283839583894077440,https://twitter.com/Mariners/status/1283839583894077440,Just your daily reminder... @KCPubHealth | #WearAMask ,Mariners,2020-07-16 19:03:04+00:00,,@KCPubHealth,#WearAMask,15,240,,pos,just your daily reminder... @kcpubhealth |   
1283835650983096321,https://twitter.com/Billyjensen/status/1283835650983096321,Say what you will about Disney World opening—but if everyone acted like they were under Disney World rules for 2 months we would take back control. Is that so hard? #WearAMask ,Billyjensen,2020-07-16 18:47:26+00:00,ABC7,,#WearAMask,21,252,,pos,say what you will about disney world opening—but if everyone acted like they were under disney world rules for 2 months we would take back control. is that so hard?   
1283832010948190208,https://twitter.com/biannagolodryga/status/1283832010948190208,More of these 2 sharp girls please. PSA #WearAMask ,biannagolodryga,2020-07-16 18:32:58+00:00,MammothWhale,,#WearAMask,180,676,,pos,more of these 2 sharp girls please. psa   
1283830119191080962,https://twitter.com/hollyrpeete/status/1283830119191080962,There should be NOTHING political about wearing masks to save lives. Other countries have political divisions as well but when it comes to #COVID19 they got on the same page! That’s what we need to do! Thank you @brikeilarcnn for having me on. #WearAMask RIP Porsha Livingston ,hollyrpeete,2020-07-16 18:25:27+00:00,,@brikeilarcnn,#COVID19 #WearAMask,81,639,,pos,there should be nothing political about wearing masks to save lives. other countries have political divisions as well but when it comes to #covid19 they got on the same page! that’s what we need to do! thank you @brikeilarcnn for having me on.   rip porsha livingston 
1283830003101241344,https://twitter.com/jimcallisMLB/status/1283830003101241344,3rd-rder Blaze Jordan has officially signed with @RedSox for $1.75 million (slot 89 value = $667900). Mississippi HS 3B maybe best raw power in @MLBDraft hit his first 500-ft HR at age 13. Mississippi State recruit. #WearAMask,jimcallisMLB,2020-07-16 18:24:59+00:00,,@RedSox @MLBDraft,#WearAMask,20,126,,pos,3rd-rder blaze jordan has officially signed with @redsox for $1.75 million (slot 89 value = $667900). mississippi hs 3b maybe best raw power in @mlbdraft hit his first 500-ft hr at age 13. mississippi state recruit.  
1283828265640030208,https://twitter.com/michaelrosenbum/status/1283828265640030208,Wow. Just wow. What else can be said here? Embarrassing. #WearAMask ,michaelrosenbum,2020-07-16 18:18:05+00:00,,,#WearAMask,28,218,,pos,wow. just wow. what else can be said here? embarrassing.   
1283828251266355200,https://twitter.com/PGHClothingCo/status/1283828251266355200,Dave Parker was willing to wear a mask and it helped himself & everyone around him. #WearAMask : http://pghclothing.com/masks,PGHClothingCo,2020-07-16 18:18:02+00:00,,,#WearAMask,13,70,,pos,dave parker was willing to wear a mask and it helped himself & everyone around him.   : http://pghclothing.com/masks
1283827327026122752,https://twitter.com/MoveOn/status/1283827327026122752,We believe in science and caring for one and other. Thanks @Georgia_NAACP for your leadership. #WearAMask #BeALeader,MoveOn,2020-07-16 18:14:21+00:00,Georgia_NAACP,@Georgia_NAACP,#WearAMask #BeALeader,45,108,,pos,we believe in science and caring for one and other. thanks @georgia_naacp for your leadership.   #bealeader
1283826303976837120,https://twitter.com/FLHouseDems/status/1283826303976837120,#FloridaHouseDems is asking you to #maskupflorida It’s about getting through this together &amp; it’s the right thing to do! Tell us why you #wearamask #maskupfl #florida #covid19 #coronavirus #maskup,FLHouseDems,2020-07-16 18:10:17+00:00,,,#FloridaHouseDems #maskupflorida #wearamask #maskupfl #florida #covid19 #coronavirus #maskup,66,136,,pos,#floridahousedems is asking you to #maskupflorida it’s about getting through this together &amp; it’s the right thing to do! tell us why you   #maskupfl #florida #covid19 #coronavirus #maskup
1283824647193210886,https://twitter.com/mini_bubbly/status/1283824647193210886,If you care about your friends and family please wear a mask. #WearAMask #SaveALife,mini_bubbly,2020-07-16 18:03:42+00:00,mmpadellan,,#WearAMask #SaveALife,31,80,,pos,if you care about your friends and family please wear a mask.   #savealife
1283821944115101696,https://twitter.com/sharonstone/status/1283821944115101696,Thank you to all of the stores businesses ride shares that are instituting the no mask no entry policy ! #WearAMask,sharonstone,2020-07-16 17:52:58+00:00,,,#WearAMask,60,558,,pos,thank you to all of the stores businesses ride shares that are instituting the no mask no entry policy !  
1283821189127794689,https://twitter.com/UWVirology/status/1283821189127794689,Our busiest testing day yet... 7096 #SARSCoV2 #COVID__19 #HCoV19 PCR tests run on 7/15 @UWVirology. 6.6% positive. #WearAMask ,UWVirology,2020-07-16 17:49:58+00:00,,@UWVirology,#SARSCoV2 #COVID__19 #HCoV19 #WearAMask,102,269,,pos,our busiest testing day yet... 7096 #sarscov2 #covid__19 #hcov19 pcr tests run on 7/15 @uwvirology. 6.6% positive.   
1283819953171251200,https://twitter.com/JoseCruzforOK/status/1283819953171251200,Obviously I’m wishing @GovStitt a quick recovery BUT I think he fails to realize that Oklahomans in #HD89 do not have the same access to VIP healthcare. I’m worried bc the Governor doesn’t seem to care about Oklahomans on the front lines of the service industry. #wearamask,JoseCruzforOK,2020-07-16 17:45:03+00:00,,@GovStitt,#HD89 #wearamask,24,282,,pos,obviously i’m wishing @govstitt a quick recovery but i think he fails to realize that oklahomans in #hd89 do not have the same access to vip healthcare. i’m worried bc the governor doesn’t seem to care about oklahomans on the front lines of the service industry.  
1283818041789362177,https://twitter.com/RepSwalwell/status/1283818041789362177,I want more #Ozark! #WearAMask ,RepSwalwell,2020-07-16 17:37:28+00:00,Kevin_L_Johnson,,#Ozark #WearAMask,708,5027,,pos,i want more #ozark!   
1283815648137637889,https://twitter.com/DignityHealth/status/1283815648137637889,We're proud to partner with the @SFGiants and @49ers on this public health initiative to help reduce the risk of transmission. #WearAMask ,DignityHealth,2020-07-16 17:27:57+00:00,,@SFGiants @49ers,#WearAMask,30,213,,pos,we're proud to partner with the @sfgiants and @49ers on this public health initiative to help reduce the risk of transmission.   
1283812222808911872,https://twitter.com/jdiannedotson/status/1283812222808911872,I don’t know who came up with this but I love it! #WearAMask ,jdiannedotson,2020-07-16 17:14:20+00:00,,,#WearAMask,16,43,,pos,i don’t know who came up with this but i love it!   
1283809039550304256,https://twitter.com/SFGiants/status/1283809039550304256,Mask up so we can play on #WearAMask | #BayAreaUnite,SFGiants,2020-07-16 17:01:41+00:00,,,#WearAMask #BayAreaUnite,165,1134,,pos,mask up so we can play on   | #bayareaunite
1283808937486110720,https://twitter.com/49ers/status/1283808937486110720,49ers fans @SFGiants fans Wearing a mask #WearAMask x #BayAreaUnite,49ers,2020-07-16 17:01:17+00:00,,@SFGiants,#WearAMask #BayAreaUnite,179,1215,,pos,49ers fans @sfgiants fans wearing a mask   x #bayareaunite
1283805637919506432,https://twitter.com/jimcallisMLB/status/1283805637919506432,3rd-rder Kyle Harrison officially signs with @SFGiants for $2.5 million (slot 85 value = $710700). California HS LHP best healthy prep LHP in @MLBDraft could have solid three-pitch repertoire &amp; command to match when full developed. UCLA recruit. #WearAMask,jimcallisMLB,2020-07-16 16:48:10+00:00,,@SFGiants @MLBDraft,#WearAMask,22,163,,pos,3rd-rder kyle harrison officially signs with @sfgiants for $2.5 million (slot 85 value = $710700). california hs lhp best healthy prep lhp in @mlbdraft could have solid three-pitch repertoire &amp; command to match when full developed. ucla recruit.  
1283801633399463937,https://twitter.com/morethanmySLE/status/1283801633399463937,Thank you Stacey Abrams. I encourage everyone to #WearAMask &amp; save lives. ,morethanmySLE,2020-07-16 16:32:15+00:00,MSNBC,,#WearAMask,37,72,,pos,thank you stacey abrams. i encourage everyone to   &amp; save lives. 
1283791921098428417,https://twitter.com/ElizabethRBess/status/1283791921098428417,I’m a retired RN in Canada with a background in public health and ICU. Your tweet is sadly misinformed and only serves to perpetuate the crisis in your country. The USA is in deep trouble. For God’s sake #WearAMask Maybe this will help you to understand the concept: ,ElizabethRBess,2020-07-16 15:53:40+00:00,ElectQuinn,,#WearAMask,24,210,,pos,i’m a retired rn in canada with a background in public health and icu. your tweet is sadly misinformed and only serves to perpetuate the crisis in your country. the usa is in deep trouble. for god’s sake   maybe this will help you to understand the concept: 
1283787711338479618,https://twitter.com/superjude81/status/1283787711338479618,It's dangerous to go alone #WearAMask pic.twitter.com/ASZAR5rVBd,superjude81,2020-07-16 15:36:56+00:00,,,#WearAMask,39,170,,pos,it's dangerous to go alone   pic.twitter.com/aszar5rvbd
1283786763937484801,https://twitter.com/thesportgene/status/1283786763937484801,BIG ANNOUNCEMENT After medical evaluations this morning for #BCMG Stream Team health officials determined: I am COVID-free!!! Praise the Lord and thank you to everyone for wishes/vibes/prayers/thoughts/offers!!!!! #thursdaymorning #COVID #coronavirus #WearAMask #isolate,thesportgene,2020-07-16 15:33:10+00:00,,,#BCMG #thursdaymorning #COVID #coronavirus #WearAMask #isolate,14,32,,pos,big announcement after medical evaluations this morning for #bcmg stream team health officials determined: i am covid-free!!! praise the lord and thank you to everyone for wishes/vibes/prayers/thoughts/offers!!!!! #thursdaymorning #covid #coronavirus   #isolate
1283784689900310528,https://twitter.com/NDLB2020/status/1283784689900310528,.@GovKemp @RonDeSantisFL @realDonaldTrump All three of these men need to be charged with murder They are working together to actively kill Americans! #WearAMask #VoteBlueToSaveAmerica2020 #NoDemLeftBehind,NDLB2020,2020-07-16 15:24:56+00:00,,@GovKemp @RonDeSantisFL @realDonaldTrump,#WearAMask #VoteBlueToSaveAmerica2020 #NoDemLeftBehind,18,30,,pos,.@govkemp @rondesantisfl @realdonaldtrump all three of these men need to be charged with murder they are working together to actively kill americans!   #votebluetosaveamerica2020 #nodemleftbehind
1283783210695106560,https://twitter.com/TimRyan/status/1283783210695106560,I #WearAMask to protect you you #WearAMask to protect me. Together we can keep everyone in our community safe and beat this virus. ,TimRyan,2020-07-16 15:19:03+00:00,,,#WearAMask #WearAMask,34,212,,pos,i   to protect you you   to protect me. together we can keep everyone in our community safe and beat this virus. 
1283780011867217922,https://twitter.com/RobLundquist/status/1283780011867217922,And the rescheduled dates get rescheduled. I cannot wait until we can go out and safely perform in front of our fans again. Thanks for rolling with the punches Home Fries. We miss you. #WearAMask #DoYourPart #Stay6FeetApart,RobLundquist,2020-07-16 15:06:20+00:00,HomeFreeGuys,,#WearAMask #DoYourPart #Stay6FeetApart,5,171,,pos,and the rescheduled dates get rescheduled. i cannot wait until we can go out and safely perform in front of our fans again. thanks for rolling with the punches home fries. we miss you.   #doyourpart #stay6feetapart
1283778427699572736,https://twitter.com/alabamapower/status/1283778427699572736,Let's join in together with our state and help keep safety first. Wash hands often practice social distancing and wear a face mask around others when in public. #WearAMask #TogetherAL,alabamapower,2020-07-16 15:00:03+00:00,,,#WearAMask #TogetherAL,17,59,,pos,let's join in together with our state and help keep safety first. wash hands often practice social distancing and wear a face mask around others when in public.   #togetheral
1283774776264339456,https://twitter.com/GwenLister1/status/1283774776264339456,I’m the biggest advocate of rights. All rights. But when it comes to a global pandemic that’s indiscriminate in who it targets I’m ok with forfeiting my ‘facial autonomy’ for the sake of protecting others & myself. Let’s stop the dumb excuses & arguments & #WearAMask.,GwenLister1,2020-07-16 14:45:32+00:00,,,#WearAMask,14,68,,pos,i’m the biggest advocate of rights. all rights. but when it comes to a global pandemic that’s indiscriminate in who it targets i’m ok with forfeiting my ‘facial autonomy’ for the sake of protecting others & myself. let’s stop the dumb excuses & arguments &  .
1283772020619194369,https://twitter.com/thevegansnuts/status/1283772020619194369,Hi lovelies my friend from New Jersey made me some amazing masks and I just had to share this one with you as it's so me. I love the sugar skulls and flowers mix #WearADamnMask #WearAMask UK peeps remember to bloody wear a mask it's not a choice..its a must!!! ,thevegansnuts,2020-07-16 14:34:35+00:00,,,#WearADamnMask #WearAMask,14,87,,pos,hi lovelies my friend from new jersey made me some amazing masks and i just had to share this one with you as it's so me. i love the sugar skulls and flowers mix #wearadamnmask   uk peeps remember to bloody wear a mask it's not a choice..its a must!!! 
1283770838324523008,https://twitter.com/JanZaxBee/status/1283770838324523008,Yesterday I wore a mask! I wear a mask everyday &amp; every time I go out to stores or other places I need to go in public. The only place I don’t wear a mask is in my home or in my vehicle while traveling to said places. The mask does not restrict my oxygen intake! #WearAMask ,JanZaxBee,2020-07-16 14:29:53+00:00,varindersingh24,,#WearAMask,11,47,,pos,yesterday i wore a mask! i wear a mask everyday &amp; every time i go out to stores or other places i need to go in public. the only place i don’t wear a mask is in my home or in my vehicle while traveling to said places. the mask does not restrict my oxygen intake!   
1283769287426084865,https://twitter.com/robertwolf32/status/1283769287426084865,Trump & his advisors keep spewing BS- #FactsMatter we’ve had 17 straight weeks of over 1 million #jobless claims w an aggregate of over 50 million with NO plan how to re-open for a real recovery PATHETIC (&amp; the #COVID19 surge continues) @mcuban @Scaramucci #WearAMask ,robertwolf32,2020-07-16 14:23:44+00:00,,@mcuban @Scaramucci,#FactsMatter #jobless #COVID19 #WearAMask,117,321,,pos,trump & his advisors keep spewing bs- #factsmatter we’ve had 17 straight weeks of over 1 million #jobless claims w an aggregate of over 50 million with no plan how to re-open for a real recovery pathetic (&amp; the #covid19 surge continues) @mcuban @scaramucci   
1283767658899333121,https://twitter.com/JeffBridges/status/1283767658899333121,Masks aren’t partisan and never should have become partisan. This is about public safety and and stopping a global pandemic. We’re not being asked to grow victory gardens or use rations to buy sugar. This is really easy folks. Do your part and #WearAMask. ,JeffBridges,2020-07-16 14:17:15+00:00,wtylersandberg,,#WearAMask,18,70,,pos,masks aren’t partisan and never should have become partisan. this is about public safety and and stopping a global pandemic. we’re not being asked to grow victory gardens or use rations to buy sugar. this is really easy folks. do your part and  . 
1283766880080207873,https://twitter.com/DynastyCurling/status/1283766880080207873,Any @TeamNiklasEdin fans out there? Support @NiklasEdin and his @svenskcurling teammates with a Viking-powered face mask! https://ca.dynastycurling.com/product-category/team-edin-collection/covid-19-masks-team-edin-collection/ #VikingPower #TheVikingWay #MaskUp #WearAMask #TeamDynasty,DynastyCurling,2020-07-16 14:14:10+00:00,,@TeamNiklasEdin @NiklasEdin @svenskcurling,#VikingPower #TheVikingWay #MaskUp #WearAMask #TeamDynasty,10,36,,pos,any @teamniklasedin fans out there? support @niklasedin and his @svenskcurling teammates with a viking-powered face mask! https://ca.dynastycurling.com/product-category/team-edin-collection/covid-19-masks-team-edin-collection/ #vikingpower #thevikingway #maskup   #teamdynasty
1283766305208795136,https://twitter.com/chilly_willy_jr/status/1283766305208795136,We've had public safety laws for eons: Wearing a seatbelt Don't drink and drive Don't smoke in restaurants We've gotten away from respecting each other so much that wearing a mask to reduce the spread of #COVID19 is divisive. People are willing to die for THAT? #WearAMask ,chilly_willy_jr,2020-07-16 14:11:53+00:00,,,#COVID19 #WearAMask,59,166,,pos,we've had public safety laws for eons: wearing a seatbelt don't drink and drive don't smoke in restaurants we've gotten away from respecting each other so much that wearing a mask to reduce the spread of #covid19 is divisive. people are willing to die for that?   
1283761636638027776,https://twitter.com/bennettrun/status/1283761636638027776,If there was not a global pandemic it would be really annoying. But there is a global pandemic. Regardless it’s safe. I pull the mask down when there is no one around. And I pull it up when there are people around. It’s very easy to do. #wearamask #everyrunhasapurpose,bennettrun,2020-07-16 13:53:19+00:00,AnitaSelvi,,#wearamask #everyrunhasapurpose,24,232,,pos,if there was not a global pandemic it would be really annoying. but there is a global pandemic. regardless it’s safe. i pull the mask down when there is no one around. and i pull it up when there are people around. it’s very easy to do.   #everyrunhasapurpose
1283760578406821894,https://twitter.com/HarryPotterMAGE/status/1283760578406821894,America needs to recognize that freedom isn’t simply maximal individual self-assertion. It’s also a collective capacity to coordinate act in concert and be considerate in how we act. Putting on masks voluntarily is one crucial example of this. #WearAMask ,HarryPotterMAGE,2020-07-16 13:49:07+00:00,,,#WearAMask,95,148,,pos,america needs to recognize that freedom isn’t simply maximal individual self-assertion. it’s also a collective capacity to coordinate act in concert and be considerate in how we act. putting on masks voluntarily is one crucial example of this.   
1283748633607901184,https://twitter.com/The100S7/status/1283748633607901184,marieavgeropoulos: “BTS on #the100 when Octavia wore a mask . Marie does too ! Mask up and protect yourselves and others my friends. Yup just referred to myself in the third person . #wearamask #masks #duh”,The100S7,2020-07-16 13:01:39+00:00,,,#the100 #wearamask #masks #duh,28,438,,pos,marieavgeropoulos: “bts on #the100 when octavia wore a mask . marie does too ! mask up and protect yourselves and others my friends. yup just referred to myself in the third person .   #masks #duh”
1283746959740882944,https://twitter.com/JohnLukeNYC/status/1283746959740882944,Good Morning To All On This 72 Degrees PartlySunny Going Up Only To 76 Later Thursday. It's Beautiful Before TheWeekend #HeatWave Have A Safe &amp; Healthy Day!Stay Positive &amp; Keep Smiling-) #ThisTooShallPass #BeSafe #WearAMask #SocialDistancing #WashYourHands #StayHealthy #GodBless,JohnLukeNYC,2020-07-16 12:55:00+00:00,,,#HeatWave #ThisTooShallPass #BeSafe #WearAMask #SocialDistancing #WashYourHands #WashYourHands #StayHealthy #GodBless,21,106,,pos,good morning to all on this 72 degrees partlysunny going up only to 76 later thursday. it's beautiful before theweekend #heatwave have a safe &amp; healthy day!stay positive &amp; keep smiling-) #thistooshallpass #besafe   #socialdistancing #washyourhands #stayhealthy #godbless
1283746723391770627,https://twitter.com/PatriotsGirlUSA/status/1283746723391770627,Ty.@AllanMargolin Love it!! #WearAMask https://twitter.com/AllanMargolin/status/1283731953745879042,PatriotsGirlUSA,2020-07-16 12:54:04+00:00,,@AllanMargolin,#WearAMask,115,356,,pos,ty.@allanmargolin love it!!   https://twitter.com/allanmargolin/status/1283731953745879042
1283744694774697984,https://twitter.com/dom4uatx/status/1283744694774697984,Soldiers carry upwards of 35lbs around on patrols to protect citizens. Firefighters equipment can weight upwards of 20lbs to protect citizens. But these morons can't wear a weightless mask?? #WearAMask,dom4uatx,2020-07-16 12:46:00+00:00,itsJeffTiedrich,,#WearAMask,38,228,,pos,soldiers carry upwards of 35lbs around on patrols to protect citizens. firefighters equipment can weight upwards of 20lbs to protect citizens. but these morons can't wear a weightless mask??  
1283744673899646979,https://twitter.com/johnpavlovitz/status/1283744673899646979,'YES PEOPLE WHO WEAR MASKS ARE AFRAID. (We Wish You Were Afraid Too.)' https://www.youtube.com/watch?v=XaYdNMpns6w&amp;t=111s 'A Mask Is a Stupid Hill to Die on America' https://johnpavlovitz.com/2020/06/17/a-mask-is-a-stupid-hill-to-die-on-america/ #WearAMask #WearADamnMask,johnpavlovitz,2020-07-16 12:45:55+00:00,,,#WearAMask #WearADamnMask,26,65,,pos,'yes people who wear masks are afraid. (we wish you were afraid too.)' https://www.youtube.com/watch?v=xaydnmpns6w&amp;t=111s 'a mask is a stupid hill to die on america' https://johnpavlovitz.com/2020/06/17/a-mask-is-a-stupid-hill-to-die-on-america/   #wearadamnmask
1283739725258465283,https://twitter.com/nigeljflanagan/status/1283739725258465283,Through the last 14covid weeks I wear 3 different masks to suit the call which I’m attending. On 24th July you are going to be asked to wear just one please Protect yourself &amp; perfect others &amp; wear a masks! #Paramedic #facemask #NHS #WearAMask #PertectOthers #TeamLAS ,nigeljflanagan,2020-07-16 12:26:15+00:00,,,#Paramedic #facemask #NHS #WearAMask #PertectOthers #TeamLAS,9,43,,pos,through the last 14covid weeks i wear 3 different masks to suit the call which i’m attending. on 24th july you are going to be asked to wear just one please protect yourself &amp; perfect others &amp; wear a masks! #paramedic #facemask #nhs   #pertectothers #teamlas 
