id,url,raw_text,username,datetime_tweet,to,mentions,hashtags,retweets,favorites,geo,label,clean_text
1271618701431898113,https://twitter.com/2HeartsWellness/status/1271618701431898113,It's not that tough to to do the right thing. #LoveThyNeighbor #BeFabulous #WearAMask ,2HeartsWellness,2020-06-13 01:41:38+00:00,JamesPMorrison,,#LoveThyNeighbor #BeFabulous #WearAMask,4,11,,pos,it's not that tough to to do the right thing. #lovethyneighbor #befabulous   
1271618504916008960,https://twitter.com/julietresists/status/1271618504916008960,We may be done with the virus but #ItsNotDoneWithUs #WearAMask #WashYourHands #StayHomeStaySafe,julietresists,2020-06-13 01:40:51+00:00,,,#ItsNotDoneWithUs #WearAMask #WashYourHands #WashYourHands #StayHomeStaySafe,13,23,,pos,we may be done with the virus but #itsnotdonewithus   #washyourhands #stayhomestaysafe
1271613544291844097,https://twitter.com/MarvinGardens55/status/1271613544291844097,Wear. A. Mask. #WearAMask Good lord just wear it already! ,MarvinGardens55,2020-06-13 01:21:09+00:00,AbraarKaran,,#WearAMask,6,15,,pos,wear. a. mask.   good lord just wear it already! 
1271610333023612928,https://twitter.com/PlumptyTrumpty/status/1271610333023612928,One more time...we're not finished people. #WearAMask ,PlumptyTrumpty,2020-06-13 01:08:23+00:00,,,#WearAMask,71,129,,pos,one more time...we're not finished people.   
1271605639094001664,https://twitter.com/Perednia/status/1271605639094001664,167 new cases two days ago 112 new cases today in my county. That we know about. #WearAMask #inners,Perednia,2020-06-13 00:49:44+00:00,,,#WearAMask #inners,3,5,,pos,167 new cases two days ago 112 new cases today in my county. that we know about.   #inners
1271601789876527111,https://twitter.com/citrabpm/status/1271601789876527111,Of course; have the common courtesy and prevent the spread. It saddens me to see families out and about without masks. I always think to myself poor little kids are risking it all because of bad parents. #WearAMask #Quarantine,citrabpm,2020-06-13 00:34:26+00:00,fox8news,,#WearAMask #Quarantine,0,23,,pos,of course; have the common courtesy and prevent the spread. it saddens me to see families out and about without masks. i always think to myself poor little kids are risking it all because of bad parents.   #quarantine
1271601008783822851,https://twitter.com/Siobhan99/status/1271601008783822851,We need a national database of any physician or clinic that would deny such care. So not only trans people can avoid them but the rest of us too. Maybe @TransEquality could facilitate it? #WearAMask and #WashYourHands,Siobhan99,2020-06-13 00:31:20+00:00,WFKARS,@TransEquality,#WearAMask #WashYourHands #WashYourHands,5,29,,pos,we need a national database of any physician or clinic that would deny such care. so not only trans people can avoid them but the rest of us too. maybe @transequality could facilitate it?   and #washyourhands
1271599544204177408,https://twitter.com/WatchYourRepsSC/status/1271599544204177408,Live or work in Cayce/West Columbia? @NikkiSetzler and others have requested free #COVID19 testing June 16 2020 at Brookland Baptist Church 1066 Sunset Blvd W Columbia. Get the test. It's easy! #WearAMask #WashYourHands #STAYHOME #DemCastSC,WatchYourRepsSC,2020-06-13 00:25:31+00:00,NikkiSetzler,@NikkiSetzler,#COVID19 #WearAMask #WashYourHands #WashYourHands #STAYHOME #STAYHOME #DemCastSC,8,3,,pos,live or work in cayce/west columbia? @nikkisetzler and others have requested free #covid19 testing june 16 2020 at brookland baptist church 1066 sunset blvd w columbia. get the test. it's easy!   #washyourhands #stayhome #demcastsc
1271597865052155904,https://twitter.com/QueenCori/status/1271597865052155904,#WearAMask Everything is opening up but you still need MASKS! #Coronavirus numbers are high because people aren't wearing masks! Please don't be confused!,QueenCori,2020-06-13 00:18:50+00:00,CNN,,#WearAMask #Coronavirus,1,14,,pos,  everything is opening up but you still need masks! #coronavirus numbers are high because people aren't wearing masks! please don't be confused!
1271596208717541376,https://twitter.com/NYCanegirl/status/1271596208717541376,More evidence why you should #WearAMask: 100% face mask use could crush second third COVID-19 wave https://www.sfgate.com/news/editorspicks/article/Study-100-face-mask-use-could-crush-second-15333170.php?utm_campaign=CMS%20Sharing%20Tools%20(Mobile)&amp;utm_source=t.co&amp;utm_medium=referral via @SFGate,NYCanegirl,2020-06-13 00:12:15+00:00,,@SFGate,#WearAMask,5,7,,pos,more evidence why you should  : 100% face mask use could crush second third covid-19 wave https://www.sfgate.com/news/editorspicks/article/study-100-face-mask-use-could-crush-second-15333170.php?utm_campaign=cms%20sharing%20tools%20(mobile)&amp;utm_source=t.co&amp;utm_medium=referral via @sfgate
1271594371129827328,https://twitter.com/kincaid323/status/1271594371129827328,Yep it's going to be epic alright. An epic #COVID19 transmission event. You all are making the rallygoers sign a waiver holding Trump campaign harmless if/when they get infected but refuse to recommend they wear masks. #TrumpDeathToll115K #WearAMask ,kincaid323,2020-06-13 00:04:57+00:00,parscale,,#COVID19 #TrumpDeathToll115K #WearAMask,4,12,,pos,yep it's going to be epic alright. an epic #covid19 transmission event. you all are making the rallygoers sign a waiver holding trump campaign harmless if/when they get infected but refuse to recommend they wear masks. #trumpdeathtoll115k   
1271593258062356482,https://twitter.com/FreelandCO5/status/1271593258062356482,Recent reports show that #COVID19 cases are increasing across the country. This virus is very serious &amp; dangerous. Please wear a mask wash your hands and practice social distancing. We're all in this together. http://JillianFreeland.com #COpolitics #WearAMask Mask: @TinaDuryea,FreelandCO5,2020-06-13 00:00:32+00:00,,@TinaDuryea,#COVID19 #COpolitics #WearAMask,13,28,,pos,recent reports show that #covid19 cases are increasing across the country. this virus is very serious &amp; dangerous. please wear a mask wash your hands and practice social distancing. we're all in this together. http://jillianfreeland.com #copolitics   mask: @tinaduryea
1271593215242768384,https://twitter.com/StephieLovezBsB/status/1271593215242768384,Pleaseee stop being ignorant wear a mask save a life and the economy. #WearAMask #COVID19,StephieLovezBsB,2020-06-13 00:00:22+00:00,Gayfetus,,#WearAMask #COVID19,0,0,,pos,pleaseee stop being ignorant wear a mask save a life and the economy.   #covid19
