id,url,raw_text,username,datetime_tweet,to,mentions,hashtags,retweets,favorites,geo,label,clean_text
1255651836037603328,https://twitter.com/rebeccazenefski/status/1255651836037603328,My sister-in-law told me about this stuff. Get it. It’s delicious. Consider yourself influenced. #Costco - #wearamask #orelse,rebeccazenefski,2020-04-30 00:15:01+00:00,,,#Costco #wearamask #orelse,0,4,,pos,my sister-in-law told me about this stuff. get it. it’s delicious. consider yourself influenced. #costco -   #orelse
1255651039530717184,https://twitter.com/HBAEagles/status/1255651039530717184,Good afternoon from Mrs. Wrobel's 8th Grade Homeroom! We are such fashionista's with our face masks. #covid19 #coronavirus #stayathome #wearamask #onlinelearning #distancelearning #hbalearns #ourlearningcontinues,HBAEagles,2020-04-30 00:11:51+00:00,,,#covid19 #coronavirus #stayathome #stayathome #wearamask #onlinelearning #distancelearning #hbalearns #ourlearningcontinues,0,0,,pos,good afternoon from mrs. wrobel's 8th grade homeroom! we are such fashionista's with our face masks. #covid19 #coronavirus #stayathome   #onlinelearning #distancelearning #hbalearns #ourlearningcontinues
1255650958425587712,https://twitter.com/cliterarybuff/status/1255650958425587712,Why you should wear facemasks...simplified. #WearAMask #COVID19,cliterarybuff,2020-04-30 00:11:32+00:00,,,#WearAMask #COVID19,0,0,,pos,why you should wear facemasks...simplified.   #covid19
1255650075436605440,https://twitter.com/EllenTift/status/1255650075436605440,A helpful illustration. #wearmasks #wearmasksavelives #wearamask https://www.instagram.com/p/B_lZZ1HhoZHyPBmlSRhYFTxsMjgLKGyq7nW3xo0/?igshid=jsms9a1qob3l,EllenTift,2020-04-30 00:08:01+00:00,,,#wearmasks #wearmasksavelives #wearamask,0,0,,pos,a helpful illustration. #wearmasks #wearmasksavelives   https://www.instagram.com/p/b_lzz1hhozhypbmlsrhyftxsmjglkgyq7nw3xo0/?igshid=jsms9a1qob3l
1255649632484499456,https://twitter.com/Artists4Chaos/status/1255649632484499456,Absolutely in fact it is encouraged. You are more apt to get the authorities called on you for not wearing a mask. #WearAMask #WashYourHands #StayHome,Artists4Chaos,2020-04-30 00:06:15+00:00,ChadLindberg,,#WearAMask #WashYourHands #WashYourHands #StayHome #StayHome,0,0,,pos,absolutely in fact it is encouraged. you are more apt to get the authorities called on you for not wearing a mask.   #washyourhands #stayhome
1255649018601811968,https://twitter.com/robertssister1/status/1255649018601811968,Here you go @VP @Mike_Pence. Hope this helps. #COVID19 #caregiving #wearamask ,robertssister1,2020-04-30 00:03:49+00:00,gingerbouvier1,@VP @Mike_Pence,#COVID19 #caregiving #wearamask,0,2,,pos,here you go @vp @mike_pence. hope this helps. #covid19 #caregiving   
1255648270543663104,https://twitter.com/MegMckeown13/status/1255648270543663104,Ignore the trolls. You have sense and it's refreshing. Tested or not this thing has an incubation period of 2 weeks. #WEARAMASK @kirstiealley ,MegMckeown13,2020-04-30 00:00:51+00:00,kirstiealley,@kirstiealley,#WEARAMASK,0,0,,pos,ignore the trolls. you have sense and it's refreshing. tested or not this thing has an incubation period of 2 weeks.   @kirstiealley 
