id,url,raw_text,username,datetime_tweet,to,mentions,hashtags,retweets,favorites,geo,label,clean_text
1282757918828507139,https://twitter.com/yokoboji/status/1282757918828507139, MONDAY Party Follow Back Resistance Party. Follow all who: LIKE RETWEET COMMENT Drop your favorite meme or gif. Vet as you go. Have Fun. #Resist #FBRParty #DogsOfTwitter #MondayMood #WearAMask #VOTE #Biden2020,yokoboji,2020-07-13 19:24:54+00:00,,,#Resist #FBRParty #DogsOfTwitter #MondayMood #WearAMask #VOTE #Biden2020,691,2008,,pos, monday party follow back resistance party. follow all who: like retweet comment drop your favorite meme or gif. vet as you go. have fun. #resist #fbrparty #dogsoftwitter #mondaymood   #vote #biden2020
1282757350747758593,https://twitter.com/morethanmySLE/status/1282757350747758593,My daily reminder for you to #WearAMask We must prevent #Covid_19 and listen to Dr. Fauci!,morethanmySLE,2020-07-13 19:22:39+00:00,,,#WearAMask #Covid_19,38,150,,pos,my daily reminder for you to   we must prevent #covid_19 and listen to dr. fauci!
1282757048749391873,https://twitter.com/TimmyDaly/status/1282757048749391873,HUMANS!!! Here’s some information from the CDC on why when where and how to #WearAMask: ,TimmyDaly,2020-07-13 19:21:27+00:00,,,#WearAMask,23,185,,pos,humans!!! here’s some information from the cdc on why when where and how to  : 
1282752742646321152,https://twitter.com/DSNYNewscast/status/1282752742646321152,"If you remove your mask for an ""on-ride"" photo that photo will not be retrievable. #WearAMask #StayMasked Annoying that some guests can steal a memory for others through ignorance. But also it's an all-or-nothing rule removing the incentive to mess with masks on-rides.",DSNYNewscast,2020-07-13 19:04:20+00:00,ParkHoppersShow,,#WearAMask #StayMasked,24,160,,pos,"if you remove your mask for an ""on-ride"" photo that photo will not be retrievable.   #staymasked annoying that some guests can steal a memory for others through ignorance. but also it's an all-or-nothing rule removing the incentive to mess with masks on-rides."
1282747120638984198,https://twitter.com/ElRaynerista/status/1282747120638984198,To ensure clear guidance on face masks... Boris Johnson will be saying one Michael Gove another WHO and British specialists something different again. #Covid_19 #WearAMask ,ElRaynerista,2020-07-13 18:42:00+00:00,,,#Covid_19 #WearAMask,34,45,,pos,to ensure clear guidance on face masks... boris johnson will be saying one michael gove another who and british specialists something different again. #covid_19   
1282742512508116992,https://twitter.com/aunumwolf42/status/1282742512508116992,Just got in a new batch of wolf skull face masks! And we had just sold out of the other ones what great timing! Find them available here! https://tinyurl.com/y8talnvm #facemasks #WearAMask #MaskUp,aunumwolf42,2020-07-13 18:23:41+00:00,,,#facemasks #WearAMask #MaskUp,21,123,,pos,just got in a new batch of wolf skull face masks! and we had just sold out of the other ones what great timing! find them available here! https://tinyurl.com/y8talnvm #facemasks   #maskup
1282741670560305152,https://twitter.com/MargieDemocracy/status/1282741670560305152,Florida official who opposed local mask mandate in ‘critical condition’ with COVID-19 The Incompetence coming from these elected officials are killing Americans everyday. #WearAMask #Demforce #Demcast,MargieDemocracy,2020-07-13 18:20:21+00:00,,,#WearAMask #Demforce #Demcast,89,116,,pos,florida official who opposed local mask mandate in ‘critical condition’ with covid-19 the incompetence coming from these elected officials are killing americans everyday.   #demforce #demcast
1282740798505857024,https://twitter.com/JohnRMoffitt/status/1282740798505857024,#TedCruz shown here today on a commercial flight ... refusing to #WearAMask ... illustrating that he has ZERO RESPECT for other people. #VoteBlueNoMatterWho #Biden2020 #Fam46,JohnRMoffitt,2020-07-13 18:16:53+00:00,hossehenad,,#TedCruz #WearAMask #VoteBlueNoMatterWho #Biden2020 #Fam46,34,52,,pos,#tedcruz shown here today on a commercial flight ... refusing to   ... illustrating that he has zero respect for other people. #votebluenomatterwho #biden2020 #fam46
1282739398954475520,https://twitter.com/drgigiosler/status/1282739398954475520,No new #COVID19 cases in #Manitoba for 13 straight days. Be like Manitoba. #PhysicalDistancing. #StayAtHome if sick. #WearAMask if you cannot stay 2 metres apart. ,drgigiosler,2020-07-13 18:11:19+00:00,MBGov,,#COVID19 #Manitoba #PhysicalDistancing #StayAtHome #StayAtHome #WearAMask,18,76,,pos,no new #covid19 cases in #manitoba for 13 straight days. be like manitoba. #physicaldistancing. #stayathome if sick.   if you cannot stay 2 metres apart. 
1282738030500098048,https://twitter.com/GDubCub/status/1282738030500098048,Contreras says he feels safe when at ballpark because Cubs handling COVID-19 precautions well and trusts teammates. “Where I don’t feel safe is on the street. When I’m walking on the street that’s the one place I don’t feel safe.” #WearAMask,GDubCub,2020-07-13 18:05:53+00:00,,,#WearAMask,14,138,,pos,contreras says he feels safe when at ballpark because cubs handling covid-19 precautions well and trusts teammates. “where i don’t feel safe is on the street. when i’m walking on the street that’s the one place i don’t feel safe.”  
1282737188820717573,https://twitter.com/balleralert/status/1282737188820717573,This lady drove to another state to not wear a mask. Wearing a mask in a global pandemic reduces the spread of Covid-19. We are in a health crisis. #wearamask ,balleralert,2020-07-13 18:02:32+00:00,,,#wearamask,86,270,,pos,this lady drove to another state to not wear a mask. wearing a mask in a global pandemic reduces the spread of covid-19. we are in a health crisis.   
1282737111704178689,https://twitter.com/ICHawkeye/status/1282737111704178689,I need everyones help in spreading the word. #wearamask #GoHawks #FightForIowa #Hawkeyes #Tailgate,ICHawkeye,2020-07-13 18:02:14+00:00,,,#wearamask #GoHawks #FightForIowa #Hawkeyes #Tailgate,62,150,,pos,i need everyones help in spreading the word.   #gohawks #fightforiowa #hawkeyes #tailgate
1282721603957055488,https://twitter.com/DaisyFuentes/status/1282721603957055488,#antimaskers maybe this will explain it. #WearAMask ,DaisyFuentes,2020-07-13 17:00:36+00:00,,,#antimaskers #WearAMask,221,923,,pos,#antimaskers maybe this will explain it.   
1282717800654667776,https://twitter.com/LouisaClein/status/1282717800654667776,I'm off out tonight and it is extraordinary how many people are wearing their masks on their chins necks foreheads or mouths. I know it's hot and not that pleasant but really????? #WearAMask ,LouisaClein,2020-07-13 16:45:30+00:00,,,#WearAMask,5,186,,pos,i'm off out tonight and it is extraordinary how many people are wearing their masks on their chins necks foreheads or mouths. i know it's hot and not that pleasant but really?????   
1282717132388569089,https://twitter.com/MeredthSalenger/status/1282717132388569089,Yikes!!!! Imagine feeling all those things AND being intubated! That would really suck. Just the panic having Covid - like if you die in two weeks do you get to say goodbye to your family? That would cause a panic attack for me. #WearAMask #EndThePandemic,MeredthSalenger,2020-07-13 16:42:50+00:00,SuzanneEvans1,,#WearAMask #EndThePandemic,64,727,,pos,yikes!!!! imagine feeling all those things and being intubated! that would really suck. just the panic having covid - like if you die in two weeks do you get to say goodbye to your family? that would cause a panic attack for me.   #endthepandemic
1282716710806659072,https://twitter.com/JustinCaouette/status/1282716710806659072,If your curious what some prominent ethical theories say about wearing a mask here is the #venndiagram for you. #ethics #Covid_19 #WearAMask ,JustinCaouette,2020-07-13 16:41:10+00:00,,,#venndiagram #ethics #Covid_19 #WearAMask,54,146,,pos,if your curious what some prominent ethical theories say about wearing a mask here is the #venndiagram for you. #ethics #covid_19   
1282713734520221696,https://twitter.com/MarkLevineNYC/status/1282713734520221696,Now it's happening in NYC too. Rate of new cases is rising for people in their 20s. We need young people to take this seriously. People of *any age* can die from covid. Young people can and will spread it to the elderly. #WearAMask #WashYourHands #Keep6feetApart,MarkLevineNYC,2020-07-13 16:29:20+00:00,,,#WearAMask #WashYourHands #WashYourHands #Keep6feetApart,152,252,,pos,now it's happening in nyc too. rate of new cases is rising for people in their 20s. we need young people to take this seriously. people of *any age* can die from covid. young people can and will spread it to the elderly.   #washyourhands #keep6feetapart
1282712091590262785,https://twitter.com/AnyMoreSports/status/1282712091590262785,Milestone! As of today I’ve sewn and given away 2000 masks. I want to keep going focusing on communities in need or organizations helping those in need. Please send any recommendations my way! (Including a list of organizations I’ve worked with to avoid duplicates) #WearAMask ,AnyMoreSports,2020-07-13 16:22:48+00:00,,,#WearAMask,9,127,,pos,milestone! as of today i’ve sewn and given away 2000 masks. i want to keep going focusing on communities in need or organizations helping those in need. please send any recommendations my way! (including a list of organizations i’ve worked with to avoid duplicates)   
1282710651727683584,https://twitter.com/sindivanzyl/status/1282710651727683584,Fellow South Africans Thank you @therichmnisi #COVID19 #WearAMask ,sindivanzyl,2020-07-13 16:17:05+00:00,,@therichmnisi,#COVID19 #WearAMask,30,667,,pos,fellow south africans thank you @therichmnisi #covid19   
1282707352941207552,https://twitter.com/catwomyn31/status/1282707352941207552,Dear @AmericanAir I am not comfortable flying on your airline knowing that people like @tedcruz are allowed to sit at the gate and during the flight without a mask. Can you clarify your stance on masks especially since Texas has a spike in Covid cases? Thanks! #WearAMask ,catwomyn31,2020-07-13 16:03:59+00:00,,@AmericanAir @tedcruz,#WearAMask,26,57,,pos,dear @americanair i am not comfortable flying on your airline knowing that people like @tedcruz are allowed to sit at the gate and during the flight without a mask. can you clarify your stance on masks especially since texas has a spike in covid cases? thanks!   
1282702407370186753,https://twitter.com/mgacramer/status/1282702407370186753,Dear @BorisJohnson.Public health measures need to be draconian.Enforce the rules based on the lowest common denominator i.e. the idiots.They're the ones who let everyone else down.If you think idiots are the minority think again look at how many people voted for YOU #WearAMask,mgacramer,2020-07-13 15:44:20+00:00,,@BorisJohnson,#WearAMask,22,59,,pos,dear @borisjohnson.public health measures need to be draconian.enforce the rules based on the lowest common denominator i.e. the idiots.they're the ones who let everyone else down.if you think idiots are the minority think again look at how many people voted for you  
1282702198259032064,https://twitter.com/irishrygirl/status/1282702198259032064,Perfection. #WearAMask ,irishrygirl,2020-07-13 15:43:30+00:00,,,#WearAMask,140,353,,pos,perfection.   
1282700220577570816,https://twitter.com/RepWilson/status/1282700220577570816,Florida must drastically reduce the daily number of new #coronavirus infections before we can reopen our schools. #WearAMask,RepWilson,2020-07-13 15:35:38+00:00,,,#coronavirus #WearAMask,22,85,,pos,florida must drastically reduce the daily number of new #coronavirus infections before we can reopen our schools.  
1282695865321369600,https://twitter.com/Astro_Mike/status/1282695865321369600,I loved wearing a mask while flying in a NASA T-38 and I am getting to like my current mask collection as well. Please #WearAMask to keep us all healthy! ,Astro_Mike,2020-07-13 15:18:20+00:00,,,#WearAMask,133,1086,,pos,i loved wearing a mask while flying in a nasa t-38 and i am getting to like my current mask collection as well. please   to keep us all healthy! 
1282694541213130758,https://twitter.com/Mets/status/1282694541213130758,Skip safely tossing BP. #WearAMask #LGM,Mets,2020-07-13 15:13:04+00:00,,,#WearAMask #LGM #LGM,58,916,,pos,skip safely tossing bp.   #lgm
1282693401805295618,https://twitter.com/HooverPresLib/status/1282693401805295618,"Herbert Hoover would ask everyone to wear a mask: ""No governmental action no economic doctrine no economic plan or project can replace that God imposed responsibility of the individual man and woman to their neighbors."" #wearamask #savelives #socialdistance #stopthespread",HooverPresLib,2020-07-13 15:08:32+00:00,,,#wearamask #savelives #socialdistance #stopthespread,23,89,,pos,"herbert hoover would ask everyone to wear a mask: ""no governmental action no economic doctrine no economic plan or project can replace that god imposed responsibility of the individual man and woman to their neighbors.""   #savelives #socialdistance #stopthespread"
1282693082048151554,https://twitter.com/ant_pruitt/status/1282693082048151554,Please and thank you. #WearAMask ,ant_pruitt,2020-07-13 15:07:16+00:00,,,#WearAMask,15,83,,pos,please and thank you.   
1282689976363253762,https://twitter.com/RepMarciaFudge/status/1282689976363253762,#WearAMask. Do it to slow the spread. Do it to keep those around you safe. Do it to protect yourself and your loved ones.,RepMarciaFudge,2020-07-13 14:54:56+00:00,,,#WearAMask,36,114,,pos, . do it to slow the spread. do it to keep those around you safe. do it to protect yourself and your loved ones.
1282689748788752386,https://twitter.com/BriansNewHeart/status/1282689748788752386,Dear @AmericanAir As a vulnerable citizen I am directly affected by actions of careless &amp; reckless behavior like this blatant disregard &amp; refusal to #WearAMask @tedcruz is no one special! He should be banned by your airline &amp; @delta @SouthwestAir @united @senatemajldr?,BriansNewHeart,2020-07-13 14:54:01+00:00,hossehenad,@AmericanAir @tedcruz @Delta @SouthwestAir @united @senatemajldr,#WearAMask,48,115,,pos,dear @americanair as a vulnerable citizen i am directly affected by actions of careless &amp; reckless behavior like this blatant disregard &amp; refusal to   @tedcruz is no one special! he should be banned by your airline &amp; @delta @southwestair @united @senatemajldr?
1282684708610965511,https://twitter.com/LEAD_Coalition/status/1282684708610965511,Your mask feels uncomfortable? Get over it. As a surgeon I know how vital they are. https://www.washingtonpost.com/health/your-mask-feels-uncomfortable-get-over-it-as-a-surgeon-i-know-how-vital-they-are/2020/07/10/17fb8e40-ba36-11ea-bdaf-a129f921026f_story.html #WearAMask #COVID19 #coronavirus @ShowoffByDesign @JohnNosta @drronstrand @SherryInk @UCLASemelFriend @TheTwinPowers @vegix @Arriadna @ladyhawkerfinds @DrIanWeissman,LEAD_Coalition,2020-07-13 14:34:00+00:00,,@ShowoffByDesign @JohnNosta @drronstrand @SherryInk @UCLASemelFriend @TheTwinPowers @vegix @Arriadna @ladyhawkerfinds @DrIanWeissman,#WearAMask #COVID19 #coronavirus,29,52,,pos,your mask feels uncomfortable? get over it. as a surgeon i know how vital they are. https://www.washingtonpost.com/health/your-mask-feels-uncomfortable-get-over-it-as-a-surgeon-i-know-how-vital-they-are/2020/07/10/17fb8e40-ba36-11ea-bdaf-a129f921026f_story.html   #covid19 #coronavirus @showoffbydesign @johnnosta @drronstrand @sherryink @uclasemelfriend @thetwinpowers @vegix @arriadna @ladyhawkerfinds @drianweissman
1282682463144288257,https://twitter.com/NDHockey/status/1282682463144288257,"""I wear a mask to protect my family friends community and loved ones."" - @colin_theisen13. @stjoemed • #WearAMask • #GoIrish ",NDHockey,2020-07-13 14:25:04+00:00,,@colin_theisen13 @stjoemed,#WearAMask #GoIrish,13,101,,pos,"""i wear a mask to protect my family friends community and loved ones."" - @colin_theisen13. @stjoemed •   • #goirish "
1282676353058451457,https://twitter.com/hfxtransit/status/1282676353058451457,Nice to see you this morning #Halifax! If we missed you we’ll be at Sackville Terminal this afternoon from 4-6 pm and Woodside Ferry Terminal tomorrow morning 6:30-8 am handing out free masks. See you there! #WearAMask ,hfxtransit,2020-07-13 14:00:48+00:00,,,#Halifax #WearAMask,19,63,,pos,nice to see you this morning #halifax! if we missed you we’ll be at sackville terminal this afternoon from 4-6 pm and woodside ferry terminal tomorrow morning 6:30-8 am handing out free masks. see you there!   
1282676279616180226,https://twitter.com/Samford_Sports/status/1282676279616180226,Bulldogs protect each other! #WearAMask #AllForSAMford,Samford_Sports,2020-07-13 14:00:30+00:00,,,#WearAMask #AllForSAMford,42,159,,pos,bulldogs protect each other!   #allforsamford
1282672781314994178,https://twitter.com/markpoloncarz/status/1282672781314994178,Our hospitalizations still remain low but the age of those hospitalized is getting younger. On 7/11 those aged 20-44 made up 17% of all Covid-19 patients with 5 more patients since 7/5 and 48% of all were 64 and under. Both age categories are up from June and May. #WearAMask ,markpoloncarz,2020-07-13 13:46:36+00:00,,,#WearAMask,24,42,,pos,our hospitalizations still remain low but the age of those hospitalized is getting younger. on 7/11 those aged 20-44 made up 17% of all covid-19 patients with 5 more patients since 7/5 and 48% of all were 64 and under. both age categories are up from june and may.   
1282672291483201538,https://twitter.com/MarisaWard57/status/1282672291483201538,This is perfect. Stop complaining. #WearAMask ,MarisaWard57,2020-07-13 13:44:39+00:00,RexChapman,,#WearAMask,23,42,,pos,this is perfect. stop complaining.   
1282667168434466816,https://twitter.com/Crashola/status/1282667168434466816,My favourite part of wearing a mask in public is the people not wearing a mask who look at you like YOU’RE doing something dumb. #WearAMask,Crashola,2020-07-13 13:24:18+00:00,,,#WearAMask,14,104,,pos,my favourite part of wearing a mask in public is the people not wearing a mask who look at you like you’re doing something dumb.  
1282666007119532034,https://twitter.com/DrJCoftheDC/status/1282666007119532034,I #WearAMask for my grandmother—96 years of love and soul. Who do you wear a mask for? ,DrJCoftheDC,2020-07-13 13:19:41+00:00,,,#WearAMask,7,211,,pos,i   for my grandmother—96 years of love and soul. who do you wear a mask for? 
1282661118561996802,https://twitter.com/colleenkraftmd/status/1282661118561996802,It’s hard on the front lines to watch the choices of the population affect our most medically vulnerable. Please #WearAMask,colleenkraftmd,2020-07-13 13:00:16+00:00,,,#WearAMask,35,146,,pos,it’s hard on the front lines to watch the choices of the population affect our most medically vulnerable. please  
1282659379632910339,https://twitter.com/UnivMSProvost/status/1282659379632910339,As you head out the door today here is your Monday morning reminder to #WearAMask and follow guidance to protect others and yourself — today and every day. #MaskUpMississippi #MaskUp #MaskOn #SocialDistance #WashYourHands ,UnivMSProvost,2020-07-13 12:53:21+00:00,,,#WearAMask #MaskUpMississippi #MaskUp #MaskOn #SocialDistance #WashYourHands #WashYourHands,24,62,,pos,as you head out the door today here is your monday morning reminder to   and follow guidance to protect others and yourself — today and every day. #maskupmississippi #maskup #maskon #socialdistance #washyourhands 
1282659270295719938,https://twitter.com/RepWilson/status/1282659270295719938,How many more people need to get sick or worse--die--from #COVID19 before everyone gets on board recognizes what a serious problem we have in Florida and takes the right precautions? #WearAMask and whenever possible #StayHomeSaveLives!,RepWilson,2020-07-13 12:52:55+00:00,,,#COVID19 #WearAMask #StayHomeSaveLives,12,37,,pos,how many more people need to get sick or worse--die--from #covid19 before everyone gets on board recognizes what a serious problem we have in florida and takes the right precautions?   and whenever possible #stayhomesavelives!
1282652790842589184,https://twitter.com/JohnLukeNYC/status/1282652790842589184,Good Morning To All On This 79 Degrees Mostly Sunny Going Up To 84 Later Monday.Have A Safe & Healthy Day & Week Ahead! Stay Positive & Keep Smiling-) #ThisTooShallPass #StayHealthy #StaySafe #WashYourHands #WearAMask #SocialDistancing #GodBless,JohnLukeNYC,2020-07-13 12:27:10+00:00,,,#ThisTooShallPass #StayHealthy #StaySafe #WashYourHands #WashYourHands #WearAMask #SocialDistancing #GodBless,11,100,,pos,good morning to all on this 79 degrees mostly sunny going up to 84 later monday.have a safe & healthy day & week ahead! stay positive & keep smiling-) #thistooshallpass #stayhealthy #staysafe #washyourhands   #socialdistancing #godbless
1282650547733041153,https://twitter.com/RogMull/status/1282650547733041153,Unlike some odd characters on Twitter I welcome the fact that for five days in a row we have not had any #Covid19 deaths identified through testing in Scotland. There are still new cases arising and much care needed by everyone. #WashYourHands #SocialDistancing #WearAMask,RogMull,2020-07-13 12:18:15+00:00,,,#Covid19 #WashYourHands #WashYourHands #SocialDistancing #WearAMask,34,123,,pos,unlike some odd characters on twitter i welcome the fact that for five days in a row we have not had any #covid19 deaths identified through testing in scotland. there are still new cases arising and much care needed by everyone. #washyourhands #socialdistancing  
1282648422781194241,https://twitter.com/AsemWORLD/status/1282648422781194241,Boost immune system with a 30 minute run in the morning to kick off your week. You’re guaranteed to burn between 200-500 calories and improves sleep disorder #MondayMotivation #Asem #Exercise #Health #AsemFitnessguide #AsemHealthguide #AsemNutritionguide #WearAMask ASEM ,AsemWORLD,2020-07-13 12:09:49+00:00,,,#MondayMotivation #Asem #Exercise #Health #AsemFitnessguide #AsemHealthguide #AsemNutritionguide #WearAMask,13,156,,pos,boost immune system with a 30 minute run in the morning to kick off your week. you’re guaranteed to burn between 200-500 calories and improves sleep disorder #mondaymotivation #asem #exercise #health #asemfitnessguide #asemhealthguide #asemnutritionguide   asem 
1282646112977874949,https://twitter.com/janehunter01/status/1282646112977874949,Amazing Professor Raina McIntyre @TheDohertyInst #qanda says: “endgame is a vaccine”. No punches pulled - she has been a steady &amp; intelligent voice throughout this pandemic - “potentially worse than 1918 Spanish Flu” #wearamask @QandA,janehunter01,2020-07-13 12:00:38+00:00,,@TheDohertyInst @QandA,#qanda #wearamask,8,35,,pos,amazing professor raina mcintyre @thedohertyinst #qanda says: “endgame is a vaccine”. no punches pulled - she has been a steady &amp; intelligent voice throughout this pandemic - “potentially worse than 1918 spanish flu”   @qanda
1282644233673773057,https://twitter.com/rachel_maria65/status/1282644233673773057,Trying to but the anti mask people keep dashing that hope. #WearAMask ,rachel_maria65,2020-07-13 11:53:10+00:00,karenkho,,#WearAMask,47,229,,pos,trying to but the anti mask people keep dashing that hope.   
1282637068812812288,https://twitter.com/ConnieSchultz/status/1282637068812812288,Be the leader your country needs. Stay home if you can. If you have to leave stay six feet apart from others. #WearAMask ,ConnieSchultz,2020-07-13 11:24:42+00:00,,,#WearAMask,578,6142,,pos,be the leader your country needs. stay home if you can. if you have to leave stay six feet apart from others.   
1282636165795868672,https://twitter.com/Junaid_Mattu/status/1282636165795868672,With my party colleague brother and friend Irfan Mattoo Sahab. Discussed various important matters related to Srinagar. @IrfanMattoo7 #WearAMask! #StaySafe!,Junaid_Mattu,2020-07-13 11:21:06+00:00,,@IrfanMattoo7,#WearAMask #StaySafe,9,147,,pos,with my party colleague brother and friend irfan mattoo sahab. discussed various important matters related to srinagar. @irfanmattoo7  ! #staysafe!
1282631368288149505,https://twitter.com/LeoRautins/status/1282631368288149505,Good Morning!! Coffee and a plan. Have a safe & amazing week!! #coffeetime #lifetips #WearAMask ,LeoRautins,2020-07-13 11:02:02+00:00,,,#coffeetime #lifetips #WearAMask,10,151,,pos,good morning!! coffee and a plan. have a safe & amazing week!! #coffeetime #lifetips   
1282604999898533888,https://twitter.com/NeddlePeddle/status/1282604999898533888,Morning!! It's Monday - again......well we painted the garden furniture on the weekend now I am having a think about what to do next.....have a super day pals! #WashYourHands #WearAMask #KeepYourDistance #TakeYourLitterHome,NeddlePeddle,2020-07-13 09:17:16+00:00,,,#WashYourHands #WashYourHands #WearAMask #KeepYourDistance #TakeYourLitterHome,5,158,,pos,morning!! it's monday - again......well we painted the garden furniture on the weekend now i am having a think about what to do next.....have a super day pals! #washyourhands   #keepyourdistance #takeyourlitterhome
1282601083425226752,https://twitter.com/hfxtransit/status/1282601083425226752,In support of public health recommendations we strongly encourage our riders to please #wearamask when possible. To help we’ll be handing out free masks at terminals around Halifax. Today we'll be at Bridge Terminal from 6:30 - 8:00 a.m. and Sackville Terminal from 4 - 6 p.m. ,hfxtransit,2020-07-13 09:01:42+00:00,,,#wearamask,13,28,,pos,in support of public health recommendations we strongly encourage our riders to please   when possible. to help we’ll be handing out free masks at terminals around halifax. today we'll be at bridge terminal from 6:30 - 8:00 a.m. and sackville terminal from 4 - 6 p.m. 
