id,url,raw_text,username,datetime_tweet,to,mentions,hashtags,retweets,favorites,geo,label,clean_text
1296651282166566914,https://twitter.com/MarkAMathes/status/1296651282166566914,10000+ deaths in #FloridaCovidEpicenter. A large town lost in 6 months of mismanagement by @GovRonDeSantis. In any other profession he’d be fired. Make masks mandatory like 34 other states that follow science and save lives. #WearAMask ,MarkAMathes,2020-08-21 03:32:10+00:00,DWUhlfelderLaw,@GovRonDeSantis,#FloridaCovidEpicenter #WearAMask,0,0,,pos,10000+ deaths in #floridacovidepicenter. a large town lost in 6 months of mismanagement by @govrondesantis. in any other profession he’d be fired. make masks mandatory like 34 other states that follow science and save lives.   
1296647931693600768,https://twitter.com/Andy_Beebe/status/1296647931693600768,The first thing Joe Biden would do if elected President... #DNC2020 #WearAMask #COVID19,Andy_Beebe,2020-08-21 03:18:52+00:00,CBSNews,,#DNC2020 #WearAMask #COVID19,0,0,,pos,the first thing joe biden would do if elected president... #dnc2020   #covid19
1296639198670315520,https://twitter.com/veggieterrain/status/1296639198670315520,"""In practice if Americans are going to mask up public-health officials will have to cajole not compel"" @JuliaLMarcus writes. #coronavirus #WearAMask ",veggieterrain,2020-08-21 02:44:10+00:00,,@JuliaLMarcus,#coronavirus #WearAMask,1,1,,pos,"""in practice if americans are going to mask up public-health officials will have to cajole not compel"" @julialmarcus writes. #coronavirus   "
1296633652340838401,https://twitter.com/oldwisefool/status/1296633652340838401,And it’s not just my worry. #COVIDー19 #WearAMask ,oldwisefool,2020-08-21 02:22:07+00:00,,,#COVID #WearAMask,0,0,,pos,and it’s not just my worry. #covidー19   
1296617437492924417,https://twitter.com/Elizabethhell/status/1296617437492924417,Love it when people like this follow me like the intelligence is just overwhelming lol #WearAMask #NotTheFlu,Elizabethhell,2020-08-21 01:17:41+00:00,,,#WearAMask #NotTheFlu,0,1,,pos,love it when people like this follow me like the intelligence is just overwhelming lol   #nottheflu
1296615542841913344,https://twitter.com/lauraKT13/status/1296615542841913344,It’s not clear how Yolanda was infected but if you can look at her sons and not #WearAMask - without a genuine reason - you lack humanity. #COVID19 #ethics,lauraKT13,2020-08-21 01:10:10+00:00,CTZebra,,#WearAMask #COVID19 #ethics,0,0,,pos,it’s not clear how yolanda was infected but if you can look at her sons and not   - without a genuine reason - you lack humanity. #covid19 #ethics
1296613598706298881,https://twitter.com/criteria681/status/1296613598706298881,My familyI used to wish for my children to be successful in their endeavors now that is secondary ... my strongest wish is for everyone’s health to be strong and survive this mess...material gains and career advances will not stop the COVID #WearAMask #DISTANCE helps more,criteria681,2020-08-21 01:02:26+00:00,SomewherAbove,,#WearAMask #DISTANCE,0,1,,pos,my familyi used to wish for my children to be successful in their endeavors now that is secondary ... my strongest wish is for everyone’s health to be strong and survive this mess...material gains and career advances will not stop the covid   #distance helps more
1296612907061374977,https://twitter.com/hitRECordJoe/status/1296612907061374977,The other week I asked you all to share photos of yourselves wearing masks. Here's what the @hitrecord community created with them. Bravo to all the contributors! #WearAMask ,hitRECordJoe,2020-08-21 00:59:41+00:00,,@HITRECORD,#WearAMask,43,336,,pos,the other week i asked you all to share photos of yourselves wearing masks. here's what the @hitrecord community created with them. bravo to all the contributors!   
1296609498103189504,https://twitter.com/Built2Sleep/status/1296609498103189504,#CovidHotspots #WearAMask Brandon families businesses hunker down again as COVID-19 outbreak grips city | CBC News ,Built2Sleep,2020-08-21 00:46:08+00:00,,,#CovidHotspots #WearAMask,0,0,,pos,#covidhotspots   brandon families businesses hunker down again as covid-19 outbreak grips city | cbc news 
1296602774382080000,https://twitter.com/vhalhen123/status/1296602774382080000,#WearAMask to help prevent the spread of #COVID19,vhalhen123,2020-08-21 00:19:25+00:00,UN,,#WearAMask #COVID19,0,0,,pos,  to help prevent the spread of #covid19
1296601848338579457,https://twitter.com/CamEleanorWV/status/1296601848338579457,At tonight’s council meeting #WearAMask ,CamEleanorWV,2020-08-21 00:15:44+00:00,claymarsh,,#WearAMask,0,7,,pos,at tonight’s council meeting   
1296600395079458816,https://twitter.com/gordwright/status/1296600395079458816,"""Let's go get a drink. I don't want you to waste your air."" LOVE IT! #refdad #wearamask ",gordwright,2020-08-21 00:09:58+00:00,GoTeamStripes,,#refdad #wearamask,0,1,,pos,"""let's go get a drink. i don't want you to waste your air."" love it! #refdad   "
1296599996213723136,https://twitter.com/yanksbeatsox/status/1296599996213723136,@Delta nothing like getting bumped to first to have this guy spewing for the whole flight and no mask! #WearAMask ,yanksbeatsox,2020-08-21 00:08:23+00:00,,@Delta,#WearAMask,0,0,,pos,@delta nothing like getting bumped to first to have this guy spewing for the whole flight and no mask!   
1296598150485020685,https://twitter.com/ditvose/status/1296598150485020685,#RememberTheDead 170k+ dead from #Covid19USA #WearAMask ,ditvose,2020-08-21 00:01:03+00:00,,,#RememberTheDead #Covid19USA #WearAMask,0,0,,pos,#rememberthedead 170k+ dead from #covid19usa   
1296622748777754631,https://twitter.com/MarieBoutet1/status/1296622748777754631,About a possible #COVID19 reinfection very informative study was done by group. conclusion: «Little is known on how to manage these patients &amp; how this will impact the evolution of #pandemic in the future» 2be clear #WearAMask ⁦@sciencedirect⁩,MarieBoutet1,2020-08-21 01:38:48+00:00,,@sciencedirect,#COVID19 #pandemic #WearAMask,0,0,,pos,about a possible #covid19 reinfection very informative study was done by group. conclusion: «little is known on how to manage these patients &amp; how this will impact the evolution of #pandemic in the future» 2be clear   ⁦@sciencedirect⁩
1296622009292447746,https://twitter.com/actuallyreal33/status/1296622009292447746,#Howto get young kids to #wearamask: Wear a mask together Put a face covering on a stuffed animal Decorate it Draw one on a favorite book character Make a fun game out of it Encourage the child to name the mask &amp; care for it themselves #pandemicparenting,actuallyreal33,2020-08-21 01:35:51+00:00,,,#Howto #wearamask #pandemicparenting,0,0,,pos,#howto get young kids to  : wear a mask together put a face covering on a stuffed animal decorate it draw one on a favorite book character make a fun game out of it encourage the child to name the mask &amp; care for it themselves #pandemicparenting
1296619185800458240,https://twitter.com/beccamoorecw/status/1296619185800458240,#TBT to walking with our senior across the field on Friday Night...this year we have another senior and I’m hoping we get this moment with him...it’s important...#WearAMask #wewantaseason #TIG #FridayNightLights,beccamoorecw,2020-08-21 01:24:38+00:00,,,#TBT #WearAMask #wewantaseason #TIG #FridayNightLights,1,20,,pos,#tbt to walking with our senior across the field on friday night...this year we have another senior and i’m hoping we get this moment with him...it’s important...  #wewantaseason #tig #fridaynightlights
1296618667497709569,https://twitter.com/MaryRedden1/status/1296618667497709569,Yes please #WearAMask let’s stop the spread of #COVID19,MaryRedden1,2020-08-21 01:22:34+00:00,PattyArquette,,#WearAMask #COVID19,0,3,,pos,yes please   let’s stop the spread of #covid19
1296614520744546307,https://twitter.com/TimboDWhite/status/1296614520744546307,I can understand why Florida has had so many issues with #COVID19. #WearAMask,TimboDWhite,2020-08-21 01:06:06+00:00,,,#COVID19 #WearAMask,1,1,,pos,i can understand why florida has had so many issues with #covid19.  
1296613081309741056,https://twitter.com/WestsideRescue/status/1296613081309741056,SERIOUSLY. It's hot and smoky outside. Do your best to stay in with your pets to protect your health. #staysafe #wearamask ,WestsideRescue,2020-08-21 01:00:23+00:00,,,#staysafe #wearamask,0,1,,pos,seriously. it's hot and smoky outside. do your best to stay in with your pets to protect your health. #staysafe   
1296612361558622213,https://twitter.com/aspecialsonia/status/1296612361558622213,you guys have the most fantastic taste today's most popular choice!! I still have some left! lmk if you're interested #SFGiants #BeatLA #WearAMask ,aspecialsonia,2020-08-21 00:57:31+00:00,,,#SFGiants #SFGiants #BeatLA #WearAMask,0,8,,pos,you guys have the most fantastic taste today's most popular choice!! i still have some left! lmk if you're interested #sfgiants #beatla   
1296609868187672577,https://twitter.com/HRApostos/status/1296609868187672577,Saturday Night Silliness -- Random Musings of a Writer Lady and Her Cat.: Not Another Christmas Romance PT 15 https://hrapostos.blogspot.com/2018/03/not-another-christmas-romance-pt-15.html?spref=tw REWIND...That first kiss. #thursdayvibes #WearAMask ,HRApostos,2020-08-21 00:47:37+00:00,,,#thursdayvibes #WearAMask,0,0,,pos,saturday night silliness -- random musings of a writer lady and her cat.: not another christmas romance pt 15 https://hrapostos.blogspot.com/2018/03/not-another-christmas-romance-pt-15.html?spref=tw rewind...that first kiss. #thursdayvibes   
1296609365487648772,https://twitter.com/en_la_bici/status/1296609365487648772,Keep it up DMVere!! #StayTheFuckHome #wearamask,en_la_bici,2020-08-21 00:45:37+00:00,nbcwashington,,#StayTheFuckHome #wearamask,0,2,,pos,keep it up dmvere!! #staythefuckhome  
1296606511305764864,https://twitter.com/WHSREDSHIELD/status/1296606511305764864, Posted up at the @WestsideSB2020 season opener #ROLLSIDE #WearAMask ,WHSREDSHIELD,2020-08-21 00:34:16+00:00,,@WestsideSB2020,#ROLLSIDE #WearAMask,0,70,,pos, posted up at the @westsidesb2020 season opener #rollside   
1296604697248309249,https://twitter.com/FreemanStation/status/1296604697248309249,Freeman Station reminding everyone to wear your mask . #BurlON #WearAMask #Covid_19,FreemanStation,2020-08-21 00:27:04+00:00,,,#BurlON #WearAMask #Covid_19,4,12,,pos,freeman station reminding everyone to wear your mask . #burlon   #covid_19
1296602228573245445,https://twitter.com/CockHonest/status/1296602228573245445,Hey @ColumbiaPDSC how about putting on a damn mask? #WearAMask pic.twitter.com/YaIvXbhvDG,CockHonest,2020-08-21 00:17:15+00:00,,@ColumbiaPDSC,#WearAMask,2,21,,pos,hey @columbiapdsc how about putting on a damn mask?   pic.twitter.com/yaivxbhvdg
1296598150690545664,https://twitter.com/andrewrog/status/1296598150690545664,Wash your hands wear a mask stay at home. We can get through this. #fightcorona #wearamask #socialdistance,andrewrog,2020-08-21 00:01:03+00:00,,,#fightcorona #wearamask #socialdistance,0,0,,pos,wash your hands wear a mask stay at home. we can get through this. #fightcorona   #socialdistance
1296598100388114432,https://twitter.com/okungtothe/status/1296598100388114432,Lol chilll my guy. All I said was ban him quieter so you don’t have to deal with unnecessary backlash. Also you look as crazy as the MAGA supporters you hate when you jump to conclusions and name call on the internet Crazy how we cant have normal convos anymore #wearamask,okungtothe,2020-08-21 00:00:51+00:00,drlawsoniii,,#wearamask,0,0,,pos,lol chilll my guy. all i said was ban him quieter so you don’t have to deal with unnecessary backlash. also you look as crazy as the maga supporters you hate when you jump to conclusions and name call on the internet crazy how we cant have normal convos anymore  
1296608733053804544,https://twitter.com/TheBigCheese613/status/1296608733053804544,Thank you! Finally some sane perspective on this constant cleaning facade. #COVID19 #WearAMask #cantcleancovid,TheBigCheese613,2020-08-21 00:43:06+00:00,,,#COVID19 #WearAMask #cantcleancovid,0,0,,pos,thank you! finally some sane perspective on this constant cleaning facade. #covid19   #cantcleancovid
1296605755907493891,https://twitter.com/AGameWithChums/status/1296605755907493891,Hey friends #WearAMask And Check out our channel https://youtube.com/agamewithchums Where we drink beer and play video games,AGameWithChums,2020-08-21 00:31:16+00:00,SmallStreamersC,,#WearAMask,0,3,,pos,hey friends   and check out our channel https://youtube.com/agamewithchums where we drink beer and play video games
1296605244462432256,https://twitter.com/JeeneHobbs/status/1296605244462432256,The work that needs to be done. The current guy isn't doing it! #StayHome #StaySafe #WearAMask #Vote2020 #ElectionsHaveConsequenes,JeeneHobbs,2020-08-21 00:29:14+00:00,threadreaderapp,,#StayHome #StayHome #StaySafe #WearAMask #Vote2020 #ElectionsHaveConsequenes,0,0,,pos,the work that needs to be done. the current guy isn't doing it! #stayhome #staysafe   #vote2020 #electionshaveconsequenes
1296604310097321985,https://twitter.com/court_chappy/status/1296604310097321985,New hair same old mask #wearamask @Mount Lebanon Pennsylvania https://www.instagram.com/p/CEIZPGeAQ4_/?igshid=2gppjiyn9m5x,court_chappy,2020-08-21 00:25:31+00:00,,,#wearamask,0,0,,pos,new hair same old mask   @mount lebanon pennsylvania https://www.instagram.com/p/ceizpgeaq4_/?igshid=2gppjiyn9m5x
1296603892457725952,https://twitter.com/CrystaleBarrett/status/1296603892457725952,"This is not ""just the flu."" #COVID19 has already taken nearly 3 times as many lives as the flu does on a annual basis and the year isn't over yet. Caring isn't always convenient or comfortable and in this case the alternative could cause you grief beyond imagining. #WearAMask",CrystaleBarrett,2020-08-21 00:23:52+00:00,,,#COVID19 #WearAMask,0,0,,pos,"this is not ""just the flu."" #covid19 has already taken nearly 3 times as many lives as the flu does on a annual basis and the year isn't over yet. caring isn't always convenient or comfortable and in this case the alternative could cause you grief beyond imagining.  "
1296603527536672768,https://twitter.com/AmyLaurenSomers/status/1296603527536672768,Now this jerk is crying about being banned from @Delta for flagrantly violating their rules about mask wearing on flights. What a #COVIDIOT #WearAMask ,AmyLaurenSomers,2020-08-21 00:22:25+00:00,HalpernAlex,@Delta,#COVIDIOT #WearAMask,0,0,,pos,now this jerk is crying about being banned from @delta for flagrantly violating their rules about mask wearing on flights. what a #covidiot   
1296603422096011266,https://twitter.com/FightingIrish/status/1296603422096011266,#WearAMask @NDWomensTennis’ Julia Andreach is doing her part to protect our community. #GoIrish,FightingIrish,2020-08-21 00:22:00+00:00,,@NDWomensTennis,#WearAMask #GoIrish,3,37,,pos,  @ndwomenstennis’ julia andreach is doing her part to protect our community. #goirish
1296603295079964672,https://twitter.com/LisaevLisa/status/1296603295079964672,“I’d rather be bored than dead” -my 92 year old former GS leader patient. #wearamask #belikeGracie,LisaevLisa,2020-08-21 00:21:29+00:00,,,#wearamask #belikeGracie,0,0,,pos,“i’d rather be bored than dead” -my 92 year old former gs leader patient.   #belikegracie
1296602948760461312,https://twitter.com/USD305/status/1296602948760461312,RT @KansasEmergency: Make sure you are wearing your mask properly and that it covers both your nose and your mouth. @KDHE | #COVID19 | #WearAMask ,USD305,2020-08-21 00:20:07+00:00,,@KansasEmergency @KDHE,#COVID19 #WearAMask,2,9,,pos,rt @kansasemergency: make sure you are wearing your mask properly and that it covers both your nose and your mouth. @kdhe | #covid19 |   
1296602480516636673,https://twitter.com/stuartvision/status/1296602480516636673,#wearamask #covid19aintover #ilove #anthonyfauci #vote @New York New York https://www.instagram.com/p/CEIYZt4l0__/?igshid=1p0nsb23tfmjj,stuartvision,2020-08-21 00:18:15+00:00,,,#wearamask #covid19aintover #ilove #anthonyfauci #vote,0,0,,pos,  #covid19aintover #ilove #anthonyfauci #vote @new york new york https://www.instagram.com/p/ceiyzt4l0__/?igshid=1p0nsb23tfmjj
1296602468802068487,https://twitter.com/Robeeone/status/1296602468802068487,See? It’s not enough to just stop them. 1. Repair or replace all sorters. 2. Return taken mailboxes. 3. Unlock all mailboxes. 4. Authorize overtime to sort this mess out and get the undelivered mail delivered. 5. Arrest DeJoy for delaying mail. Remember #WearAMask Thank You. ,Robeeone,2020-08-21 00:18:12+00:00,brianschatz,,#WearAMask,0,0,,pos,see? it’s not enough to just stop them. 1. repair or replace all sorters. 2. return taken mailboxes. 3. unlock all mailboxes. 4. authorize overtime to sort this mess out and get the undelivered mail delivered. 5. arrest dejoy for delaying mail. remember   thank you. 
1296601925136220160,https://twitter.com/FabulousLVNV/status/1296601925136220160,THANK YOU @Delta FOR KEEPING US SAFE! #WearAMask ,FabulousLVNV,2020-08-21 00:16:03+00:00,mchooyah,@Delta,#WearAMask,0,3,,pos,thank you @delta for keeping us safe!   
1296601562710601728,https://twitter.com/nategardner/status/1296601562710601728,Good. #wearamask ,nategardner,2020-08-21 00:14:36+00:00,mchooyah,,#wearamask,0,0,,pos,good.   
1296601157230632961,https://twitter.com/sellmymilesnow/status/1296601157230632961,Covering your nose and mouth with a #mask ensures germs stay put. #SellMyMiles advice you to #wearamask at all times when necessary. #SellMyMiles #socialdistancing #stayhome #staysafe #stayhealthy #covid #coronavirus #pandemic #flattenthecurve #washyourhands,sellmymilesnow,2020-08-21 00:13:00+00:00,,,#mask #SellMyMiles #wearamask #SellMyMiles #socialdistancing #stayhome #stayhome #staysafe #stayhealthy #covid #coronavirus #pandemic #flattenthecurve #washyourhands #washyourhands,0,0,,pos,covering your nose and mouth with a #mask ensures germs stay put. #sellmymiles advice you to   at all times when necessary. #sellmymiles #socialdistancing #stayhome #staysafe #stayhealthy #covid #coronavirus #pandemic #flattenthecurve #washyourhands
1296600499978940416,https://twitter.com/marie5483/status/1296600499978940416,We recently flew on @Delta &amp; they require masks period. It doesn't matter who you are it's their rule. If you don't like it don't fly Delta!! #WearAMask #MasksOn,marie5483,2020-08-21 00:10:23+00:00,businessinsider,@Delta,#WearAMask #MasksOn,3,47,,pos,we recently flew on @delta &amp; they require masks period. it doesn't matter who you are it's their rule. if you don't like it don't fly delta!!   #maskson
1296600291836432384,https://twitter.com/Ragcha/status/1296600291836432384,Tomorrow LA will hit 5500 #COVID deaths - that's in five months. In two weeks we will have confirmed 250000 infections. Excess deaths &amp; unconfirmed infections are much higher.#WearAMask #StayHome,Ragcha,2020-08-21 00:09:33+00:00,,,#COVID #WearAMask #StayHome #StayHome,0,0,,pos,tomorrow la will hit 5500 #covid deaths - that's in five months. in two weeks we will have confirmed 250000 infections. excess deaths &amp; unconfirmed infections are much higher.  #stayhome
1296599425759010818,https://twitter.com/Fix_It_Pls/status/1296599425759010818,Because for most of us our brains have intellectually evolved to be able to create and wear mask during a pandemic unlikely idiots like you who’s brain got stuck at the stage of an ape. Process of natural selection will wipe you out soon. What a disgrace to mankind! #WearAMask ,Fix_It_Pls,2020-08-21 00:06:07+00:00,NeilClark66,,#WearAMask,0,0,,pos,because for most of us our brains have intellectually evolved to be able to create and wear mask during a pandemic unlikely idiots like you who’s brain got stuck at the stage of an ape. process of natural selection will wipe you out soon. what a disgrace to mankind!   
1296599098238414853,https://twitter.com/bfbowers/status/1296599098238414853,Thanks for putting this out there @AuburnU and Dr. Kam! #WearAMask #AhealthierU,bfbowers,2020-08-21 00:04:49+00:00,AuburnU,@AuburnU,#WearAMask #AhealthierU,0,1,,pos,thanks for putting this out there @auburnu and dr. kam!   #ahealthieru
1296599074909675521,https://twitter.com/notanothermomma/status/1296599074909675521,Completed day one of year 23 of teaching today. Longest day of my teaching career & I taught on 9-11 & the day after Trump was elected. This mask wearing is No Joke. Be kind to your teacher friends. #teachersareheros #WearAMask #bekind,notanothermomma,2020-08-21 00:04:43+00:00,,,#teachersareheros #WearAMask #bekind,0,1,,pos,completed day one of year 23 of teaching today. longest day of my teaching career & i taught on 9-11 & the day after trump was elected. this mask wearing is no joke. be kind to your teacher friends. #teachersareheros   #bekind
1296598021656977409,https://twitter.com/WroughtonMatt/status/1296598021656977409,Time for some #Softball. Let's keep my undefeated year going. #StrangerSwings #RealtorLife #StLouis #StLouisSoftball #SlowpitchSoftball #Hustle #BeActive #StaySafe #WearAMask #CallMatt,WroughtonMatt,2020-08-21 00:00:32+00:00,,,#Softball #StrangerSwings #RealtorLife #StLouis #StLouisSoftball #SlowpitchSoftball #Hustle #BeActive #StaySafe #WearAMask #CallMatt,0,0,,pos,time for some #softball. let's keep my undefeated year going. #strangerswings #realtorlife #stlouis #stlouissoftball #slowpitchsoftball #hustle #beactive #staysafe   #callmatt
1296602933547667457,https://twitter.com/tweet_andres/status/1296602933547667457,https://www.youtube.com/watch?v=SZpsUQLhiCI&amp;feature=youtu.be @BarackObama @MichelleObama Can I get an AMEN for so so so many souls that have perished in 2020....I just can not stop crying...... #coronavirus #WearAMask #JesusHelpUs #Vote #JoeBiden #JoeBidenKamalaHarris2020,tweet_andres,2020-08-21 00:20:03+00:00,,@BarackObama @MichelleObama,#coronavirus #WearAMask #JesusHelpUs #Vote #JoeBiden #JoeBidenKamalaHarris2020,0,0,,pos,https://www.youtube.com/watch?v=szpsuqlhici&amp;feature=youtu.be @barackobama @michelleobama can i get an amen for so so so many souls that have perished in 2020....i just can not stop crying...... #coronavirus   #jesushelpus #vote #joebiden #joebidenkamalaharris2020
1296602456936218624,https://twitter.com/Jasper_cat44/status/1296602456936218624,"Too often the #MAGA folk have the mindset of ""if I don't see it it isn't real."". Only when they see their friends family and coworkers hurt by #COVID then they'll believe. Then they'll wear masks and stay at home. By then more people will have died needlessly. #WearAMask",Jasper_cat44,2020-08-21 00:18:10+00:00,MusicalOh,,#MAGA #COVID #WearAMask,1,0,,pos,"too often the #maga folk have the mindset of ""if i don't see it it isn't real."". only when they see their friends family and coworkers hurt by #covid then they'll believe. then they'll wear masks and stay at home. by then more people will have died needlessly.  "
1296602382877560832,https://twitter.com/JDNewEngland/status/1296602382877560832,He’s a Freshman. Young and athletic and he now has a heart condition. I hope it’s not permanent. #WearAMask #ListenToTheScientists,JDNewEngland,2020-08-21 00:17:52+00:00,wingoz,,#WearAMask #ListenToTheScientists,7,6,,pos,he’s a freshman. young and athletic and he now has a heart condition. i hope it’s not permanent.   #listentothescientists
1296602044023873536,https://twitter.com/EqualEntrance/status/1296602044023873536,A quick guide on wearing masks: Instead of bringing it down to your chin put you mask in our resealable bags (provided with each mask) after every use. Order here: http://www.equalentrance.com #WearAMaskSaveALife #wearamask ,EqualEntrance,2020-08-21 00:16:31+00:00,,,#WearAMaskSaveALife #wearamask,2,8,,pos,a quick guide on wearing masks: instead of bringing it down to your chin put you mask in our resealable bags (provided with each mask) after every use. order here: http://www.equalentrance.com  savealife   
1296601971701485572,https://twitter.com/CamFowler29/status/1296601971701485572,This is not @UNCGMensSoccer this is normal students. We are taking extreme measures to protect ourselves and others from this virus. Thanks for the concern! #WearAMask,CamFowler29,2020-08-21 00:16:14+00:00,fruitloopsbirb,@UNCGMensSoccer,#WearAMask,1,14,,pos,this is not @uncgmenssoccer this is normal students. we are taking extreme measures to protect ourselves and others from this virus. thanks for the concern!  
1296601580599476224,https://twitter.com/blatant_my/status/1296601580599476224,Because the religious on top aren't religious they're business people. The lower ones are too closed minded to see reality because they were taught never to question. Ironically these are the same people who won't be told how to live or to #WearAMask,blatant_my,2020-08-21 00:14:41+00:00,GeorgeTakei,,#WearAMask,0,7,,pos,because the religious on top aren't religious they're business people. the lower ones are too closed minded to see reality because they were taught never to question. ironically these are the same people who won't be told how to live or to  
1296601576744910848,https://twitter.com/PingTech/status/1296601576744910848,It is what it is cupcake. #WearAMask #COVIDiots,PingTech,2020-08-21 00:14:40+00:00,mchooyah,,#WearAMask #COVIDiots,0,4,,pos,it is what it is cupcake.   #covidiots
1296601358771064837,https://twitter.com/willireallyam1/status/1296601358771064837,No that hasn’t been proven at all. What about those who are asymptomatic? You can’t test those people so your theory is flawed! #WearAMask #SaveALife,willireallyam1,2020-08-21 00:13:48+00:00,TJ_Ingram_II,,#WearAMask #SaveALife,0,0,,pos,no that hasn’t been proven at all. what about those who are asymptomatic? you can’t test those people so your theory is flawed!   #savealife
