id,url,raw_text,username,datetime_tweet,to,mentions,hashtags,retweets,favorites,geo,label,clean_text
1283552318424784896,https://twitter.com/HabsHappy/status/1283552318424784896,Found this art attempting to explain if a #Mask can protect us while we combat this #Covid19 #Pandemic. #MaskUpCanada #WearAMask #WearADamnMask #MaskUp,HabsHappy,2020-07-16 00:01:34+00:00,,,#Mask #Covid19 #Pandemic #MaskUpCanada #WearAMask #WearADamnMask #MaskUp,0,5,,pos,found this art attempting to explain if a #mask can protect us while we combat this #covid19 #pandemic. #maskupcanada   #wearadamnmask #maskup
1283552256751738881,https://twitter.com/metrohealthCLE/status/1283552256751738881,It can’t be tweeted enough. #WearAMask ,metrohealthCLE,2020-07-16 00:01:19+00:00,GovMikeDeWine,,#WearAMask,7,22,,pos,it can’t be tweeted enough.   
1283552214053576704,https://twitter.com/Kulinski_crat_1/status/1283552214053576704,#WearAMask 'Covid Party' To Expose 'Hoax' Turns Deadly: Watch: https://youtu.be/IG2P7dmpzNk @KyleKulinski #NotMeUs,Kulinski_crat_1,2020-07-16 00:01:09+00:00,,@KyleKulinski,#WearAMask #NotMeUs,3,2,,pos,  'covid party' to expose 'hoax' turns deadly: watch: https://youtu.be/ig2p7dmpznk @kylekulinski #notmeus
1283552182508412929,https://twitter.com/derekdob/status/1283552182508412929,Literally Thousands of Doctors and Scientists Have Come Out Against Fauci’s Lockdowns Including a Nobel Prize-Winning Biophysicist. The Media Just Doesn’t Want You to Know - #DemocratsAreCorrupt #DemExit #COVID19 #WearAMask #DrFauciIsAHero #Coronavirus,derekdob,2020-07-16 00:01:02+00:00,,,#DemocratsAreCorrupt #DemExit #COVID19 #WearAMask #DrFauciIsAHero #Coronavirus,1,1,,pos,literally thousands of doctors and scientists have come out against fauci’s lockdowns including a nobel prize-winning biophysicist. the media just doesn’t want you to know - #democratsarecorrupt #demexit #covid19   #drfauciisahero #coronavirus
1283552172224008198,https://twitter.com/EBbirdbath/status/1283552172224008198,So you are telling me that the country where this kind of shit is considered ok is having a tough time convincing people to mask up? #WearAMask pic.twitter.com/k5l2vRyWNS,EBbirdbath,2020-07-16 00:00:59+00:00,,,#WearAMask,0,0,,pos,so you are telling me that the country where this kind of shit is considered ok is having a tough time convincing people to mask up?   pic.twitter.com/k5l2vrywns
1283552157145288705,https://twitter.com/LeilaKincaid/status/1283552157145288705,Pest control guy comes to my door not wearing a mask... really? I didn't answer it. Door to door pesticide salesman in a pandemic? Fuck off. #WearAMask,LeilaKincaid,2020-07-16 00:00:56+00:00,,,#WearAMask,0,0,,pos,pest control guy comes to my door not wearing a mask... really? i didn't answer it. door to door pesticide salesman in a pandemic? fuck off.  
1283552131203686401,https://twitter.com/DrDeeTrue/status/1283552131203686401,MYTH: I feel fine. I don’t need a mask. FACT: The CDC reports that more than 40% of virus transmissions happen before people feel sick. A pre-symptomatic person can spread the virus for up to 48 hours before symptoms arise. #wearamask #MCCampaign #stopcovid19,DrDeeTrue,2020-07-16 00:00:49+00:00,,,#wearamask #MCCampaign #stopcovid19,0,0,,pos,myth: i feel fine. i don’t need a mask. fact: the cdc reports that more than 40% of virus transmissions happen before people feel sick. a pre-symptomatic person can spread the virus for up to 48 hours before symptoms arise.   #mccampaign #stopcovid19
1283552100119490560,https://twitter.com/carpediemer52/status/1283552100119490560,I am so sorry for your terrible loss. It is unthinkable what you are going through. My most sincere condolences. #WearAMask,carpediemer52,2020-07-16 00:00:42+00:00,ldog562,,#WearAMask,0,0,,pos,i am so sorry for your terrible loss. it is unthinkable what you are going through. my most sincere condolences.  
1283552089680097282,https://twitter.com/CABnDFW/status/1283552089680097282,I’m so sick of the jackasses who refuse to wear masks. Are you? #WearAMask #GrowUp,CABnDFW,2020-07-16 00:00:40+00:00,,,#WearAMask #GrowUp,0,1,,pos,i’m so sick of the jackasses who refuse to wear masks. are you?   #growup
1283552071568916480,https://twitter.com/ArtByPemPhoto/status/1283552071568916480,Keeping Pace with the New Normal https://www.zazzle.com/collections/i_cant_place_the_face_but_the_mask_rings_a_bell-119710624791331226 #mask #Masks #Covid_19 #COVIDー19 #publichealth #WearTheDamnMask #WearAMask,ArtByPemPhoto,2020-07-16 00:00:35+00:00,,,#mask #Masks #Covid_19 #COVID #publichealth #WearTheDamnMask #WearAMask,0,0,,pos,keeping pace with the new normal https://www.zazzle.com/collections/i_cant_place_the_face_but_the_mask_rings_a_bell-119710624791331226 #mask #masks #covid_19 #covidー19 #publichealth #wearthedamnmask  
1283552041634234370,https://twitter.com/Stormy_Faye/status/1283552041634234370,Stormy Faye The Christian Runaway Exhibit some common sense and humanity towards one another. Let's flatten this pandemic curve. Wear Your Facial Mask Properly! #MaskItOrCasket #DontBeFoolish #WearAMask… https://www.instagram.com/p/CCrpwHFJURY/?igshid=1p3fiolz4zdd2,Stormy_Faye,2020-07-16 00:00:28+00:00,,,#MaskItOrCasket #DontBeFoolish #WearAMask,0,0,,pos,stormy faye the christian runaway exhibit some common sense and humanity towards one another. let's flatten this pandemic curve. wear your facial mask properly! #maskitorcasket #dontbefoolish  … https://www.instagram.com/p/ccrpwhfjury/?igshid=1p3fiolz4zdd2
1283552003591942144,https://twitter.com/AdralesG/status/1283552003591942144,Math and common sense. #WearAMask ,AdralesG,2020-07-16 00:00:19+00:00,,,#WearAMask,0,1,,pos,math and common sense.   
1283551950244585472,https://twitter.com/DorothyBeach/status/1283551950244585472,Everyone has the ability to do this. But without enforcement it will not achieve the 80% needed to flatten the curve and keep kids in school. .@GovMikeDeWine has decided not to mandate #WearAMask. Ohio will continue to increase #COVID19 cases and deaths despite a simple solution.,DorothyBeach,2020-07-16 00:00:06+00:00,rachael_morocco,@GovMikeDeWine,#WearAMask #COVID19,0,0,,pos,everyone has the ability to do this. but without enforcement it will not achieve the 80% needed to flatten the curve and keep kids in school. .@govmikedewine has decided not to mandate  . ohio will continue to increase #covid19 cases and deaths despite a simple solution.
