id,url,raw_text,username,datetime_tweet,to,mentions,hashtags,retweets,favorites,geo,label,clean_text
1276303139336007691,https://twitter.com/knecessary/status/1276303139336007691,Wearing masks should be mandatory. They save lives. This shouldn't be a politicized issue. #COVID19 cases are spiking in #Ohio. #WearADamnMask #WearAMask #MasksSaveLives,knecessary,2020-06-25 23:55:55+00:00,,,#COVID19 #Ohio #WearADamnMask #WearAMask #MasksSaveLives,16,90,,pos,wearing masks should be mandatory. they save lives. this shouldn't be a politicized issue. #covid19 cases are spiking in #ohio. #wearadamnmask   #maskssavelives
1276291410296287233,https://twitter.com/RJSzczerba/status/1276291410296287233,Do you know what else is really uncomfortable? Pants. But I still wear them in public not for me but for others! #WearAMask,RJSzczerba,2020-06-25 23:09:19+00:00,,,#WearAMask,89,344,,pos,do you know what else is really uncomfortable? pants. but i still wear them in public not for me but for others!  
1276291325680185344,https://twitter.com/mattycoyotestv/status/1276291325680185344,My dad passed away 18 months ago. Would've turned 96 today. What I'd give to watch one more game with the old tailgunner. To those who are fortunate to still have parents and grandparents in their lives please be considerate of them. #WearAMask,mattycoyotestv,2020-06-25 23:08:59+00:00,,,#WearAMask,12,206,,pos,my dad passed away 18 months ago. would've turned 96 today. what i'd give to watch one more game with the old tailgunner. to those who are fortunate to still have parents and grandparents in their lives please be considerate of them.  
1276288963897147392,https://twitter.com/mommamia1217/status/1276288963897147392,It’s tragic that there are people who walk among us that are more concerned about proving their allegiance to trump instead of defending the well-being and health of themselves and those they love. It’s nonsense. Trust science. #StayHome #WearAMask #COVID19 #Coronavirus,mommamia1217,2020-06-25 22:59:35+00:00,,,#StayHome #StayHome #WearAMask #COVID19 #Coronavirus,118,195,,pos,it’s tragic that there are people who walk among us that are more concerned about proving their allegiance to trump instead of defending the well-being and health of themselves and those they love. it’s nonsense. trust science. #stayhome   #covid19 #coronavirus
1276287891002601473,https://twitter.com/JoeCunninghamSC/status/1276287891002601473,Great work Councilman. Thanks to you and your colleagues for your leadership. This ordinance will help keep our businesses open get our kids back in school in the fall and most importantly slow the spread and keep people safe! #WearAMask ,JoeCunninghamSC,2020-06-25 22:55:20+00:00,RossAppel,,#WearAMask,23,207,,pos,great work councilman. thanks to you and your colleagues for your leadership. this ordinance will help keep our businesses open get our kids back in school in the fall and most importantly slow the spread and keep people safe!   
1276273970317148162,https://twitter.com/pimaarizona/status/1276273970317148162,Don't beat up the messenger! We're not the only ones asking ppl to wear face masks. Yes there was some back and forth initially but a vast majority of health experts now agree that wearing a face mask staying 6ft from others is our best weapon against #Covid19 #WearAMask ,pimaarizona,2020-06-25 22:00:01+00:00,,,#Covid19 #WearAMask,36,159,,pos,don't beat up the messenger! we're not the only ones asking ppl to wear face masks. yes there was some back and forth initially but a vast majority of health experts now agree that wearing a face mask staying 6ft from others is our best weapon against #covid19   
1276265958882127873,https://twitter.com/rob0349/status/1276265958882127873,#WearAMask This should NOT be political this should NOT even be up for debate! This is common sense this is consideration for your fellow citizens. This is in EVERYONE'S best interest #Covid19 #TrumpVirus #TrumpLiesPeopleDie #FreshTopics,rob0349,2020-06-25 21:28:11+00:00,,,#WearAMask #Covid19 #TrumpVirus #TrumpLiesPeopleDie #FreshTopics,48,65,,pos,  this should not be political this should not even be up for debate! this is common sense this is consideration for your fellow citizens. this is in everyone's best interest #covid19 #trumpvirus #trumpliespeopledie #freshtopics
1276263653109641217,https://twitter.com/BCFootball/status/1276263653109641217,We all have to do our part if we want a football season #wearamask ,BCFootball,2020-06-25 21:19:01+00:00,,,#wearamask,48,289,,pos,we all have to do our part if we want a football season   
1276260043571298307,https://twitter.com/JudgeClayJ/status/1276260043571298307,Avoid unnecessary crowds maintain six foot distancing wear a mask when outside your home and around others and use good hand hygiene. The best way to reverse the trend and #FlattenTheCurve is to #WearAMask and #StayHomeSaveLives.,JudgeClayJ,2020-06-25 21:04:40+00:00,,,#FlattenTheCurve #WearAMask #StayHomeSaveLives,34,187,,pos,avoid unnecessary crowds maintain six foot distancing wear a mask when outside your home and around others and use good hand hygiene. the best way to reverse the trend and #flattenthecurve is to   and #stayhomesavelives.
1276257826256519168,https://twitter.com/WilliamShatner/status/1276257826256519168,Don’t you just love #COVIDIOTS BTW Sporto a ventilator is worse than wearing a mask and the ou have to wear that 24 hours or else . #wearamask #dontbeaburden #dontbeacovidiot,WilliamShatner,2020-06-25 20:55:52+00:00,magnyton,,#COVIDIOTS #wearamask #dontbeaburden #dontbeacovidiot,65,556,,pos,don’t you just love #covidiots btw sporto a ventilator is worse than wearing a mask and the ou have to wear that 24 hours or else .   #dontbeaburden #dontbeacovidiot
1276256473555689472,https://twitter.com/olivier_patti/status/1276256473555689472,"OMG...HOW GREAT IS THIS QUOTE..!! ...this great guy said.... Republicans...get ready for it.... @SenMcSallyAZ ""We need to listen to SCIENCE""....!!!! #ScienceMatters #SocialDistancing #WearAMask #AnyQuestions",olivier_patti,2020-06-25 20:50:29+00:00,CaptMarkKelly,@SenMcSallyAZ,#ScienceMatters #SocialDistancing #WearAMask #AnyQuestions,82,125,,pos,"omg...how great is this quote..!! ...this great guy said.... republicans...get ready for it.... @senmcsallyaz ""we need to listen to science""....!!!! #sciencematters #socialdistancing   #anyquestions"
1276250619561598976,https://twitter.com/AlexisWileyNews/status/1276250619561598976,Here’s an eye opening stat: Black Michiganders make up 65% of COVID-19 deaths under the age of 60. #wearamask @CityofDetroit,AlexisWileyNews,2020-06-25 20:27:13+00:00,,@CityofDetroit,#wearamask,20,30,,pos,here’s an eye opening stat: black michiganders make up 65% of covid-19 deaths under the age of 60.   @cityofdetroit
1276241849485864961,https://twitter.com/LtGovStratton/status/1276241849485864961,“Illinois is being touted across the country for getting it right!”—Dr. Ngozi Ezike Director @IDPH Thank you to Illinoisans across the state who followed the “3 Ws”: #WashYourHands #WearAMask #WatchYourDistance But keep going...#COVID19 is still here! #RestoreIllinois,LtGovStratton,2020-06-25 19:52:23+00:00,,@IDPH,#WashYourHands #WashYourHands #WearAMask #WatchYourDistance #COVID19 #RestoreIllinois,40,163,,pos,“illinois is being touted across the country for getting it right!”—dr. ngozi ezike director @idph thank you to illinoisans across the state who followed the “3 ws”: #washyourhands   #watchyourdistance but keep going...#covid19 is still here! #restoreillinois
1276238574632030210,https://twitter.com/DrDenaGrayson/status/1276238574632030210,This is spectacular. #COVIDIOTS #coronavirus #COVID19 #WearAMask #StayHome,DrDenaGrayson,2020-06-25 19:39:22+00:00,RexChapman,,#COVIDIOTS #coronavirus #COVID19 #WearAMask #StayHome #StayHome,127,450,,pos,this is spectacular. #covidiots #coronavirus #covid19   #stayhome
1276236746091454464,https://twitter.com/heatherdunlap/status/1276236746091454464,Absolutely f*cking brilliant #WearAMask ,heatherdunlap,2020-06-25 19:32:06+00:00,RexChapman,,#WearAMask,48,185,,pos,absolutely f*cking brilliant   
1276234950879129602,https://twitter.com/FireGoddessB/status/1276234950879129602,#WearAMask THANK YOU @fenrir_71 @haysjr9 @american2084 @CunningSq16 @Drew_Yall @ReSista_Barb @RexThomresist45 @WilliamFPeters2 @FollowsCourage @og_dbl_lo_g @Doh_Doh_Burrd @spiritmoon7 @Eathbound420 @kodiak149 @GrammyGC5 @doxie53 @GhostOfLuv3 @BeastieLil @joelytrumpshate @lad1768,FireGoddessB,2020-06-25 19:24:58+00:00,,@fenrir_71 @haysjr9 @american2084 @CunningSq16 @Drew_Yall @ReSista_Barb @RexThomresist45 @WilliamFPeters2 @FollowsCourage @og_dbl_lo_g @Doh_Doh_Burrd @spiritmoon7 @Eathbound420 @kodiak149 @GrammyGC5 @doxie53 @GhostOfLuv3 @BeastieLil @joelytrumpshate @lad1768,#WearAMask,22,52,,pos,  thank you @fenrir_71 @haysjr9 @american2084 @cunningsq16 @drew_yall @resista_barb @rexthomresist45 @williamfpeters2 @followscourage @og_dbl_lo_g @doh_doh_burrd @spiritmoon7 @eathbound420 @kodiak149 @grammygc5 @doxie53 @ghostofluv3 @beastielil @joelytrumpshate @lad1768
1276234940577964032,https://twitter.com/FireGoddessB/status/1276234940577964032,#WearAMask THANK YOU @BlueR00n @sergeivote @Orion83D @PPersnickety @lmakowski3 @RENEEWEATHERS2 @lunaticopresid1 @Mayo4Mz @AnisPainter @polarsprite @garym27 @RuleChicago @tizzywoman @AngryandAsian @BobA1959 @jerrysaiyan @SDDNP @wesing4blue @electroboyusa @zen4ever2us @Jhogan552,FireGoddessB,2020-06-25 19:24:55+00:00,,@BlueR00n @sergeivote @PPersnickety @lmakowski3 @RENEEWEATHERS2 @lunaticopresid1 @Mayo4Mz @AnisPainter @polarsprite @garym27 @RuleChicago @tizzywoman @AngryandAsian @BobA1959 @jerrysaiyan @SDDNP @wesing4blue @electroboyusa @zen4ever2us @Jhogan552,#WearAMask,28,48,,pos,  thank you @bluer00n @sergeivote @orion83d @ppersnickety @lmakowski3 @reneeweathers2 @lunaticopresid1 @mayo4mz @anispainter @polarsprite @garym27 @rulechicago @tizzywoman @angryandasian @boba1959 @jerrysaiyan @sddnp @wesing4blue @electroboyusa @zen4ever2us @jhogan552
1276234932633952260,https://twitter.com/FireGoddessB/status/1276234932633952260,I'm so far behind on everything so why not make a thank you list to all of my fam that have it coming #WearAMask THANK YOU @AussieDebPeace @doxie53 @TalkToMeForReal @Texy_Liz @vegix @LRPow79 @Gr3Te4rights @gr8fulchik @IamMultiversal @ConnieG1025 @BlueMark55 @xtraferocity,FireGoddessB,2020-06-25 19:24:53+00:00,,@AussieDebPeace @doxie53 @TalkToMeForReal @Texy_Liz @vegix @LRPow79 @Gr3Te4rights @gr8fulchik @IamMultiversal @ConnieG1025 @BlueMark55 @xtraferocity,#WearAMask,40,109,,pos,i'm so far behind on everything so why not make a thank you list to all of my fam that have it coming   thank you @aussiedebpeace @doxie53 @talktomeforreal @texy_liz @vegix @lrpow79 @gr3te4rights @gr8fulchik @iammultiversal @connieg1025 @bluemark55 @xtraferocity
1276230881640878082,https://twitter.com/Ostdrossel/status/1276230881640878082,My own masks have finally arrived! They are comfy and pretty. And they help a good cause. I am donating all profits from the masks to Feeding America. If you would like one go to my website http://ostdrossel.com and check them out. #bird #covid19relief #wearamask #Ostdrossel,Ostdrossel,2020-06-25 19:08:48+00:00,,,#bird #covid19relief #wearamask #Ostdrossel,11,83,,pos,my own masks have finally arrived! they are comfy and pretty. and they help a good cause. i am donating all profits from the masks to feeding america. if you would like one go to my website http://ostdrossel.com and check them out. #bird #covid19relief   #ostdrossel
1276210674151165952,https://twitter.com/kristynwongtam/status/1276210674151165952,I know you're heading out because it's Stage 2 and the patios are open. Please remember the pandemic is not over. Take care keep a safe distance be kind and #WearAMask. ,kristynwongtam,2020-06-25 17:48:30+00:00,,,#WearAMask,18,109,,pos,i know you're heading out because it's stage 2 and the patios are open. please remember the pandemic is not over. take care keep a safe distance be kind and  . 
1276303170927579136,https://twitter.com/mommamia1217/status/1276303170927579136,Thanks J… I have a few friends to bring to the party… @LRPow79 @electroboyusa @Jay_V_F_45 @dad_darius @ShelbyKStewart @Drew_Yall @DrDinD @NatHale1776 @EarlOfEnough @jimbobo401 #WearAMask #StayHome #AloneTogether #WeGotThis,mommamia1217,2020-06-25 23:56:03+00:00,lad1768,@LRPow79 @electroboyusa @dad_darius @ShelbyKStewart @Drew_Yall @DrDinD @NatHale1776 @EarlOfEnough @jimbobo401,#WearAMask #StayHome #StayHome #AloneTogether #WeGotThis,6,23,,pos,thanks j… i have a few friends to bring to the party… @lrpow79 @electroboyusa @jay_v_f_45 @dad_darius @shelbykstewart @drew_yall @drdind @nathale1776 @earlofenough @jimbobo401   #stayhome #alonetogether #wegotthis
1276298960102195201,https://twitter.com/CSojourner/status/1276298960102195201,#MAGA #Maskholes did you know #CoronaVirus harms your body if if you are asymptomatic? Even if you never feel sick at all you may get #Covid19 and sustain permanent #LungDamage or later have #Strokes #BloodClottingDisorders #OrganFailure! #WearAMask ,CSojourner,2020-06-25 23:39:19+00:00,,,#MAGA #Maskholes #CoronaVirus #Covid19 #LungDamage #Strokes #BloodClottingDisorders #OrganFailure #WearAMask,21,28,,pos,#maga #maskholes did you know #coronavirus harms your body if if you are asymptomatic? even if you never feel sick at all you may get #covid19 and sustain permanent #lungdamage or later have #strokes #bloodclottingdisorders #organfailure!   
1276291601384583170,https://twitter.com/SFStateLCA/status/1276291601384583170,We love our campus fog but miss all our #SFSU Gators! Photos by @SreangHok June 25 2020 #YourActionsSaveLives #WearAMask ,SFStateLCA,2020-06-25 23:10:04+00:00,,@sreanghok,#SFSU #YourActionsSaveLives #WearAMask,3,23,,pos,we love our campus fog but miss all our #sfsu gators! photos by @sreanghok june 25 2020 #youractionssavelives   
1276286757236080641,https://twitter.com/Bollywoodcowgrl/status/1276286757236080641,Day after day we hit new record highs. Day after day Texans still refuse to #WearAMask. They are more scared it may brand them as liberals than they are of spreading or catching a deadly disease. Republican rhetoric about masks is killing Texans. Thanks guys. #DemCastTX https://twitter.com/TexasTribune/status/1276278399548502016,Bollywoodcowgrl,2020-06-25 22:50:49+00:00,,,#WearAMask #DemCastTX,34,36,,pos,day after day we hit new record highs. day after day texans still refuse to  . they are more scared it may brand them as liberals than they are of spreading or catching a deadly disease. republican rhetoric about masks is killing texans. thanks guys. #demcasttx https://twitter.com/texastribune/status/1276278399548502016
1276285655933423616,https://twitter.com/SupremePianos/status/1276285655933423616,If strangers are coming to your home- like say they’re moving a piano for eg- please wear a mask! Also maybe not a great time to get up close & chatty. Wear a mask! #WearAMask #StaySafe #SocialDistance,SupremePianos,2020-06-25 22:46:27+00:00,,,#WearAMask #StaySafe #SocialDistance,5,20,,pos,if strangers are coming to your home- like say they’re moving a piano for eg- please wear a mask! also maybe not a great time to get up close & chatty. wear a mask!   #staysafe #socialdistance
1276280219175751680,https://twitter.com/DrAmyParish/status/1276280219175751680,"""When it comes to #COVID19 a college campus is like a cruise ship a cinema multiplex and a restaurant all rolled into one Some students faculty and staff will likely have permanent damage. Some will probably die"" #StayHome #SocialDistancing #WearAMask ",DrAmyParish,2020-06-25 22:24:51+00:00,,,#COVID19 #StayHome #StayHome #SocialDistancing #WearAMask,10,16,,pos,"""when it comes to #covid19 a college campus is like a cruise ship a cinema multiplex and a restaurant all rolled into one some students faculty and staff will likely have permanent damage. some will probably die"" #stayhome #socialdistancing   "
1276273259030274048,https://twitter.com/julietresists/status/1276273259030274048,This horror show isn’t over. #COVID19 is rampant. Even if states don’t require people wear masks -stores should make it mandatory for staff and customers-no exceptions. #WearAMask,julietresists,2020-06-25 21:57:11+00:00,,,#COVID19 #WearAMask,22,57,,pos,this horror show isn’t over. #covid19 is rampant. even if states don’t require people wear masks -stores should make it mandatory for staff and customers-no exceptions.  
1276271800687656962,https://twitter.com/hondajet/status/1276271800687656962,Just landed in Raleigh for the #USAircraftExpo this weekend! We look forward to seeing you tomorrow at the Raleigh Executive Jetport! #SocialDistancing #WearAMask ,hondajet,2020-06-25 21:51:23+00:00,,,#USAircraftExpo #SocialDistancing #WearAMask,6,80,,pos,just landed in raleigh for the #usaircraftexpo this weekend! we look forward to seeing you tomorrow at the raleigh executive jetport! #socialdistancing   
1276263819266994177,https://twitter.com/rthabiger/status/1276263819266994177,Do me a favor. Do you a favor. #WearAMask #WearAMaskSaveALife #NewProfilePic #StarTrek,rthabiger,2020-06-25 21:19:41+00:00,,,#WearAMask #WearAMaskSaveALife #NewProfilePic #StarTrek #StarTrek,4,110,,pos,do me a favor. do you a favor.    savealife #newprofilepic #startrek
1276263414248046592,https://twitter.com/WhoaShitsCrazyO/status/1276263414248046592,If you don't wear a mask in public... Honestly... Fuck all the way off you stupid selfish dumb fucking fucker. Yes you! #WearAMask,WhoaShitsCrazyO,2020-06-25 21:18:04+00:00,,,#WearAMask,5,57,,pos,if you don't wear a mask in public... honestly... fuck all the way off you stupid selfish dumb fucking fucker. yes you!  
1276257325938925570,https://twitter.com/artist4ever/status/1276257325938925570,I live in Maryland (a very red part) and masks are mandatory in stores. Everybody wears one. No one seems to be an a-hole about it. Our COVID numbers have gone way down and our Governor is a Republican. Why is this so hard for some states? #WearAMask,artist4ever,2020-06-25 20:53:52+00:00,,,#WearAMask,5,31,,pos,i live in maryland (a very red part) and masks are mandatory in stores. everybody wears one. no one seems to be an a-hole about it. our covid numbers have gone way down and our governor is a republican. why is this so hard for some states?  
1276256084685094915,https://twitter.com/WaltonforWI/status/1276256084685094915,Challenge accepted #WearAMask https://twitter.com/SenKamalaHarris/status/1276201861343838212,WaltonforWI,2020-06-25 20:48:56+00:00,,,#WearAMask,9,23,,pos,challenge accepted   https://twitter.com/senkamalaharris/status/1276201861343838212
1276255998077022213,https://twitter.com/kdreich/status/1276255998077022213,Here's what it was like to live in NYC this spring. Ambulance sirens day & night. My husband my son & dear friends got sick. 2 friends lost parents. Why did other states not learn from our mistakes? None of this had to happen & look it's already happening again. #WearAMask,kdreich,2020-06-25 20:48:36+00:00,,,#WearAMask,9,29,,pos,here's what it was like to live in nyc this spring. ambulance sirens day & night. my husband my son & dear friends got sick. 2 friends lost parents. why did other states not learn from our mistakes? none of this had to happen & look it's already happening again.  
1276250336429084672,https://twitter.com/BleedingMarine/status/1276250336429084672,“If you don’t like wearing a mask you won’t like wearing a ventilator.” -Dr. Wearafuckinmask YaDumbass #WearADamnMask #WearAMask #COVID19 #coronavirus,BleedingMarine,2020-06-25 20:26:06+00:00,,,#WearADamnMask #WearAMask #COVID19 #coronavirus,18,53,,pos,“if you don’t like wearing a mask you won’t like wearing a ventilator.” -dr. wearafuckinmask yadumbass #wearadamnmask   #covid19 #coronavirus
1276244672352882688,https://twitter.com/balleralert/status/1276244672352882688,A Facebook group dubbed the Freedom to Breathe Agency or #FTBA is promoting fake face mask exemption cards. Images of the cards began circling social media on Wednesday and have been deemed fraudulent by the DOJ. #trumptards #wearamask ,balleralert,2020-06-25 20:03:36+00:00,,,#FTBA #trumptards #wearamask,23,28,,pos,a facebook group dubbed the freedom to breathe agency or #ftba is promoting fake face mask exemption cards. images of the cards began circling social media on wednesday and have been deemed fraudulent by the doj. #trumptards   
1276244198635732994,https://twitter.com/LtGovStratton/status/1276244198635732994,In Illinois we followed the data and the science and made the health and safety of Illinoisans our top priority! #COVID19 deaths are down 65% from a peak 6 weeks ago and cases are down 76% from a peak 7 weeks ago. #WearAMask and maintain #PhysicalDistancing. On to Phase 4!,LtGovStratton,2020-06-25 20:01:43+00:00,,,#COVID19 #WearAMask #PhysicalDistancing,22,50,,pos,in illinois we followed the data and the science and made the health and safety of illinoisans our top priority! #covid19 deaths are down 65% from a peak 6 weeks ago and cases are down 76% from a peak 7 weeks ago.   and maintain #physicaldistancing. on to phase 4!
1276238514045231104,https://twitter.com/ChildersRadio/status/1276238514045231104,Don’t be a Mike Leach. Wear your mask properly. Stop the spread! #WearAMask ,ChildersRadio,2020-06-25 19:39:07+00:00,,,#WearAMask,8,48,,pos,don’t be a mike leach. wear your mask properly. stop the spread!   
1276230551406546944,https://twitter.com/toreydanae/status/1276230551406546944,I don’t know who needs to hear this but not wearing a mask isn’t anymore more of a political statement than not wearing a seatbelt #WearAMask,toreydanae,2020-06-25 19:07:29+00:00,,,#WearAMask,5,49,,pos,i don’t know who needs to hear this but not wearing a mask isn’t anymore more of a political statement than not wearing a seatbelt  
1276226058019311616,https://twitter.com/mlramsdale_law/status/1276226058019311616,Sad to say that @henrymcmaster’s sticker plan is not working. 16.9 percent positive test rate. #whereishenry? #WearAMask ,mlramsdale_law,2020-06-25 18:49:38+00:00,scdhec,@henrymcmaster,#whereishenry #WearAMask,8,43,,pos,sad to say that @henrymcmaster’s sticker plan is not working. 16.9 percent positive test rate. #whereishenry?   
1276219290299981824,https://twitter.com/booksanescape/status/1276219290299981824,I wore one for years. It's not hard you're just selfish & petty! Sure not great but better than a ventilator! #WearAMask #MaskItOrCasket ,booksanescape,2020-06-25 18:22:44+00:00,AngrierWHStaff,,#WearAMask #MaskItOrCasket,13,48,,pos,i wore one for years. it's not hard you're just selfish & petty! sure not great but better than a ventilator!   #maskitorcasket 
1276214022656995328,https://twitter.com/NikkiFriedFL/status/1276214022656995328,With 31299 new cases this week alone Florida is a new #COVID19 hotspot. Today I'm calling on @GovRonDeSantis to issue a statewide order requiring masks in public. This is common sense violates no liberties and 18 other states have done so. We must act together. #WearAMask,NikkiFriedFL,2020-06-25 18:01:48+00:00,,@GovRonDeSantis,#COVID19 #WearAMask,150,345,,pos,with 31299 new cases this week alone florida is a new #covid19 hotspot. today i'm calling on @govrondesantis to issue a statewide order requiring masks in public. this is common sense violates no liberties and 18 other states have done so. we must act together.  
1276210013904801798,https://twitter.com/rob0349/status/1276210013904801798,Ending funding for testing Pushing for states to reopen Not following #WearAMask &amp; #SocialDistancing guidelines Trump is more concerned about protecting statues of DEAD Americans then he is about protecting the health of LIVE Americans #COVID19 #FreshTopics #GoJoe,rob0349,2020-06-25 17:45:52+00:00,,,#WearAMask #SocialDistancing #COVID19 #FreshTopics #GoJoe,69,100,,pos,ending funding for testing pushing for states to reopen not following   &amp; #socialdistancing guidelines trump is more concerned about protecting statues of dead americans then he is about protecting the health of live americans #covid19 #freshtopics #gojoe
1276203563279056897,https://twitter.com/juliettekayyem/status/1276203563279056897,We are in the risk reduction phase. We have no strong social distancing no treatment no vaccine. And so masking is an essential and simple tool still available to us to protect ourselves. It's not hard to grasp. Trump undermines it everyday. @cnn @newday #wearamask ,juliettekayyem,2020-06-25 17:20:14+00:00,,@CNN @NewDay,#wearamask,91,324,,pos,we are in the risk reduction phase. we have no strong social distancing no treatment no vaccine. and so masking is an essential and simple tool still available to us to protect ourselves. it's not hard to grasp. trump undermines it everyday. @cnn @newday   
1276196699548114946,https://twitter.com/JosephSakran/status/1276196699548114946,As a doc and public health practioner grateful most people don’t think this way. #ThankfulThursday #WearAMask “And you Doctor are going to be arrested for crimes against humanity” ,JosephSakran,2020-06-25 16:52:58+00:00,,,#ThankfulThursday #WearAMask,12,34,,pos,as a doc and public health practioner grateful most people don’t think this way. #thankfulthursday   “and you doctor are going to be arrested for crimes against humanity” 
1276193019889217538,https://twitter.com/WasatchSnow/status/1276193019889217538,If you think this can't happen to the upcoming season I promise you it can. #WearAMask ,WasatchSnow,2020-06-25 16:38:21+00:00,KSL5TV,,#WearAMask,12,125,,pos,if you think this can't happen to the upcoming season i promise you it can.   
