id,url,raw_text,username,datetime_tweet,to,mentions,hashtags,retweets,favorites,geo,label,clean_text
1282597035783462913,https://twitter.com/AfricaCDC/status/1282597035783462913,#COVID19 update for Africa 13 July 2020 @9am Eastern Africa Time: 54 @_AfricanUnion Member States reporting data below.. Cases... 594841 Deaths... 13238 &amp; Recoveries...297480 More information at http://www.african.org #WearAMask #StayAtHome #AfricaResponds #FactsNotFear,AfricaCDC,2020-07-13 08:45:37+00:00,,@_AfricanUnion,#COVID19 #WearAMask #StayAtHome #StayAtHome #AfricaResponds #FactsNotFear,47,34,,pos,#covid19 update for africa 13 july 2020 @9am eastern africa time: 54 @_africanunion member states reporting data below.. cases... 594841 deaths... 13238 &amp; recoveries...297480 more information at http://www.african.org   #stayathome #africaresponds #factsnotfear
1282595908413251585,https://twitter.com/carriemarx/status/1282595908413251585,Let’s kickstart the week with positive intentions! Coronavirus can damage your brain. As someone who has had a haemorrhagic stroke and lives with the lasting effects of brain injury I can report that it is nowhere near as fun as it sounds. So #WearAMask Kthanksbyeeeee! Xxx,carriemarx,2020-07-13 08:41:08+00:00,,,#WearAMask,8,28,,pos,let’s kickstart the week with positive intentions! coronavirus can damage your brain. as someone who has had a haemorrhagic stroke and lives with the lasting effects of brain injury i can report that it is nowhere near as fun as it sounds. so   kthanksbyeeeee! xxx
1282592590077009920,https://twitter.com/changed_gear/status/1282592590077009920,If you've looked at the evidence and decided not wear a mask in an enclosed public space and potentially save the lives of others you have be absolutely certain you've done the right thing. Otherwise you are taking chances with other people's lives. #WearAMask,changed_gear,2020-07-13 08:27:57+00:00,,,#WearAMask,12,54,,pos,if you've looked at the evidence and decided not wear a mask in an enclosed public space and potentially save the lives of others you have be absolutely certain you've done the right thing. otherwise you are taking chances with other people's lives.  
1282591025765253133,https://twitter.com/carolJhedges/status/1282591025765253133,"I wear a mask because: I'm educated enough to know that I could be asymptomatic and still give you the virus. No I don't ""live in fear"" of the virus; I just want to be part of the solution not the problem. I respect the #NHS &amp; don't want to add to their work #WearAMask ",carolJhedges,2020-07-13 08:21:44+00:00,,,#NHS #WearAMask,305,753,,pos,"i wear a mask because: i'm educated enough to know that i could be asymptomatic and still give you the virus. no i don't ""live in fear"" of the virus; i just want to be part of the solution not the problem. i respect the #nhs &amp; don't want to add to their work   "
1282579538820714500,https://twitter.com/StanDogbe/status/1282579538820714500,#StanNews Have a great start to the working week. And remember to #StaySafe #WearAMask and protect your family. #JohnMahama2020,StanDogbe,2020-07-13 07:36:05+00:00,,,#StanNews #StaySafe #WearAMask #JohnMahama2020,18,173,,pos,#stannews have a great start to the working week. and remember to #staysafe   and protect your family. #johnmahama2020
1282572637215100929,https://twitter.com/changed_gear/status/1282572637215100929,It's very sporting of the Covid virus to agree to limit it's attacks on us to public transport and leave us alone in shops. #WearAMask,changed_gear,2020-07-13 07:08:40+00:00,,,#WearAMask,74,328,,pos,it's very sporting of the covid virus to agree to limit it's attacks on us to public transport and leave us alone in shops.  
1282563331249901568,https://twitter.com/PeterInDevon/status/1282563331249901568,"""even the youngest and mildest infected are at risk of their lives being changed forever and it could take years to become apparent"" #WearAMask",PeterInDevon,2020-07-13 06:31:41+00:00,SkyNews,,#WearAMask,30,118,,pos,"""even the youngest and mildest infected are at risk of their lives being changed forever and it could take years to become apparent""  "
1282550985232007169,https://twitter.com/SkeptiScientist/status/1282550985232007169,• I'm a field biologist • I'm a scientist • I'm a pursuer of knowledge • I'm an American • I'm an empathetic human being • I stand with Dr. Fauci #StandWithFauci #WearAMask #WearADamnMask,SkeptiScientist,2020-07-13 05:42:38+00:00,,,#StandWithFauci #WearAMask #WearADamnMask,32,149,,pos,• i'm a field biologist • i'm a scientist • i'm a pursuer of knowledge • i'm an american • i'm an empathetic human being • i stand with dr. fauci #standwithfauci   #wearadamnmask
1282531150703935488,https://twitter.com/Kellimaroney/status/1282531150703935488,“Please scream inside your heart”. Well Japan nailed it. Raise your hand if you are NOT already screaming in your heart a little bit. I know I am! #Covid_19 #WearAMask #YourActionsSaveLives #SlowTheSpread,Kellimaroney,2020-07-13 04:23:49+00:00,,,#Covid_19 #WearAMask #YourActionsSaveLives #SlowTheSpread,17,80,,pos,“please scream inside your heart”. well japan nailed it. raise your hand if you are not already screaming in your heart a little bit. i know i am! #covid_19   #youractionssavelives #slowthespread
1282520924357627904,https://twitter.com/sunfIowercoffee/status/1282520924357627904,be like House and #WearAMask ,sunfIowercoffee,2020-07-13 03:43:11+00:00,,,#WearAMask,32,95,,pos,be like house and   
1282504557180997636,https://twitter.com/OhNoAZomBee/status/1282504557180997636,Well it's here. #WearAMask ,OhNoAZomBee,2020-07-13 02:38:08+00:00,,,#WearAMask,39,142,,pos,well it's here.   
1282498987300290560,https://twitter.com/MurseWordsworth/status/1282498987300290560,I received plenty of requests to repeat my vid disproving the idea that masks = Oxygen levels but either w/ N95 or while exerting myself. How about both? -wearing a (fit tested) N95 -DEFINITLY increasing O2 demand -maintaining my O2 level #WearAMask #TrustANurse #COVID19,MurseWordsworth,2020-07-13 02:16:00+00:00,,,#WearAMask #TrustANurse #COVID19,94,288,,pos,i received plenty of requests to repeat my vid disproving the idea that masks = oxygen levels but either w/ n95 or while exerting myself. how about both? -wearing a (fit tested) n95 -definitly increasing o2 demand -maintaining my o2 level   #trustanurse #covid19
1282497816506429440,https://twitter.com/theErinCahill/status/1282497816506429440,Happy Sunday! Crumpet and I want to remind you to do your part and #WearAMask! Be kind to one another. We all have to be in this together. Sending love to each of you! ,theErinCahill,2020-07-13 02:11:21+00:00,,,#WearAMask,9,101,,pos,happy sunday! crumpet and i want to remind you to do your part and  ! be kind to one another. we all have to be in this together. sending love to each of you! 
1282496243160305664,https://twitter.com/morethanmySLE/status/1282496243160305664,"Trump said he was ""sarcastic"" in his remarks of injecting disinfectant. Trump politicized whether or not to #WearAMask Trump pushed ineffective drugs. Dr. Fauci has been WARNING us for months &amp; now he's being made a scapegoat. Dr. Fauci is a hero! ",morethanmySLE,2020-07-13 02:05:06+00:00,,,#WearAMask,71,123,,pos,"trump said he was ""sarcastic"" in his remarks of injecting disinfectant. trump politicized whether or not to   trump pushed ineffective drugs. dr. fauci has been warning us for months &amp; now he's being made a scapegoat. dr. fauci is a hero! "
1282493945390534657,https://twitter.com/smallpencilclub/status/1282493945390534657,All the fucked up things in this video: 1. the cop that shoved the Black protester just keeps walking 2. the white shirt (LT) NYPD does fucking NOTHING to defuse the situation & isn't wearing his mask 3. If you don't know how to #WearAMask you shouldn't be given a taser or gun,smallpencilclub,2020-07-13 01:55:58+00:00,RexChapman,,#WearAMask,24,365,,pos,all the fucked up things in this video: 1. the cop that shoved the black protester just keeps walking 2. the white shirt (lt) nypd does fucking nothing to defuse the situation & isn't wearing his mask 3. if you don't know how to   you shouldn't be given a taser or gun
1282484847588585474,https://twitter.com/MikeConnollyMA/status/1282484847588585474,I’ve been a critic of the reopening from the start and tonight is no exception. The latest R-naught value is 1.07 at http://rt.live/us/MA meaning there’s a risk of rapid #coronavirus spread — and we’re in the orange category on the latest national maps. #StayHome #WearAMask ,MikeConnollyMA,2020-07-13 01:19:49+00:00,,,#coronavirus #StayHome #StayHome #WearAMask,62,142,,pos,i’ve been a critic of the reopening from the start and tonight is no exception. the latest r-naught value is 1.07 at http://rt.live/us/ma meaning there’s a risk of rapid #coronavirus spread — and we’re in the orange category on the latest national maps. #stayhome   
1282484821621604353,https://twitter.com/morethanmySLE/status/1282484821621604353,Trump & the White House trying to discredit Dr. Fauci is another effort of the gas-lighting by this nightmare administration. We have EVERYTHING on record. Dr. Fauci: #WearAMask Trump: Reopen the economy at ALL costs don't wear a mask liberate states. We know the TRUTH! ,morethanmySLE,2020-07-13 01:19:43+00:00,,,#WearAMask,155,369,,pos,trump & the white house trying to discredit dr. fauci is another effort of the gas-lighting by this nightmare administration. we have everything on record. dr. fauci:   trump: reopen the economy at all costs don't wear a mask liberate states. we know the truth! 
1282482724209647617,https://twitter.com/JustJoeyJoeyJo/status/1282482724209647617,"I'm guessing those who won't #WearAMask because: ""FACE MASKS ARE A BREEDING GROUND FOR BACTERIA!"" are forgetting (ignoring) that disposal masks are 1 time use only and that reusable masks just need to be washed regularly. Stop making excuses and just #WearADamnMask.",JustJoeyJoeyJo,2020-07-13 01:11:23+00:00,,,#WearAMask #WearADamnMask,14,48,,pos,"i'm guessing those who won't   because: ""face masks are a breeding ground for bacteria!"" are forgetting (ignoring) that disposal masks are 1 time use only and that reusable masks just need to be washed regularly. stop making excuses and just #wearadamnmask."
1282474758605438982,https://twitter.com/MurseWordsworth/status/1282474758605438982,After wearing a mask x 12 hrs then wearing an N95 DURING exercise... No breathing issues and oxygen saturation at 99% It's not the mask. It's probably just you. (... Especially that cold sore part) #WearAMask #TrustANurse #covid19,MurseWordsworth,2020-07-13 00:39:44+00:00,SuzanneEvans1,,#WearAMask #TrustANurse #covid19,10,126,,pos,after wearing a mask x 12 hrs then wearing an n95 during exercise... no breathing issues and oxygen saturation at 99% it's not the mask. it's probably just you. (... especially that cold sore part)   #trustanurse #covid19
1282470886512238601,https://twitter.com/heidisteinberg/status/1282470886512238601,Tears of joy! From 800 deaths a day for more than a week in April to 0 deaths in July. Bravi to all New Yorkers. We did it. Let’s maintain it. Thank you to @NYGovCuomo @melissadderosa and the rest of your leadership team. #WearAMask #Facts #Data #newyorktough #Covid,heidisteinberg,2020-07-13 00:24:21+00:00,Wolfe321,@NYGovCuomo @melissadderosa,#WearAMask #Facts #Data #newyorktough #Covid,18,66,,pos,tears of joy! from 800 deaths a day for more than a week in april to 0 deaths in july. bravi to all new yorkers. we did it. let’s maintain it. thank you to @nygovcuomo @melissadderosa and the rest of your leadership team.   #facts #data #newyorktough #covid
1282469671556591617,https://twitter.com/jentaub/status/1282469671556591617,Here for the ratio Senator. #WearAMask,jentaub,2020-07-13 00:19:31+00:00,JohnCornyn,,#WearAMask,27,559,,pos,here for the ratio senator.  
1282468525810962433,https://twitter.com/StLukesAnita/status/1282468525810962433,“We’re not in #Boise. We don’t have to #wearamask here.” Literally what employee told me in Garden City. Ya because #COVID19 knows not to cross the city line?? THIS is why we need a statewide mask order NOW. We’re running out of time to stop this #Idaho! https://vm.tiktok.com/JLHgnCx/,StLukesAnita,2020-07-13 00:14:58+00:00,,,#Boise #wearamask #COVID19 #Idaho,78,222,,pos,“we’re not in #boise. we don’t have to   here.” literally what employee told me in garden city. ya because #covid19 knows not to cross the city line?? this is why we need a statewide mask order now. we’re running out of time to stop this #idaho! https://vm.tiktok.com/jlhgncx/
1282467968518152195,https://twitter.com/David_Bordewyk/status/1282467968518152195,Weekend begins with @realDonaldTrump giving get out of jail free card to felon and pol pal Roger Stone and it ends with White House working to discredit the nation’s top pandemic fighter Anthony Fauci. That is all. #WearAMask,David_Bordewyk,2020-07-13 00:12:45+00:00,,@realDonaldTrump,#WearAMask,1,4,,pos,weekend begins with @realdonaldtrump giving get out of jail free card to felon and pol pal roger stone and it ends with white house working to discredit the nation’s top pandemic fighter anthony fauci. that is all.  
1282467801740058624,https://twitter.com/kellyanhcampbel/status/1282467801740058624,"""No matter the circumstance."" What?!? Public health stopping the spread and death of Kentuckian's is exactly the circumstance we need action by @GovAndyBeshear Prevent the spread and the rest doesn't happen!! So you can go to live safely. #WearAMask #StopTheSpreadOfCOVID19",kellyanhcampbel,2020-07-13 00:12:05+00:00,SavannahLMaddox,@GovAndyBeshear,#WearAMask #StopTheSpreadOfCOVID19,0,18,,pos,"""no matter the circumstance."" what?!? public health stopping the spread and death of kentuckian's is exactly the circumstance we need action by @govandybeshear prevent the spread and the rest doesn't happen!! so you can go to live safely.   #stopthespreadofcovid19"
1282467774477078529,https://twitter.com/MrRyanHigbea/status/1282467774477078529,"When I read the line in @kimbbbradley's #TheWarThatSavedMyLife ""Those simple-minded women prefer their present comfort to the long-term safety of their children"" I couldn't help but think that is the BEST way to describe why people refuse to wear a mask. #WearAMask #MaskUpMN",MrRyanHigbea,2020-07-13 00:11:59+00:00,,@kimbbbradley,#TheWarThatSavedMyLife #WearAMask #MaskUpMN,1,11,,pos,"when i read the line in @kimbbbradley's #thewarthatsavedmylife ""those simple-minded women prefer their present comfort to the long-term safety of their children"" i couldn't help but think that is the best way to describe why people refuse to wear a mask.   #maskupmn"
1282467706537730048,https://twitter.com/JDaleMD/status/1282467706537730048,I hope everyone in Chicago got outside today. Beautiful run through the park with a happy dog on the deck. #WearAMask ,JDaleMD,2020-07-13 00:11:42+00:00,,,#WearAMask,1,19,,pos,i hope everyone in chicago got outside today. beautiful run through the park with a happy dog on the deck.   
1282467640779378688,https://twitter.com/Tiedes59/status/1282467640779378688,Assholes like these people should be charged with reckless endangerment and manslaughter for every person they infect. Contact tracing needs to lead to criminal prosecution. #WearAMask #WearADamnMask,Tiedes59,2020-07-13 00:11:27+00:00,Reuters,,#WearAMask #WearADamnMask,1,3,,pos,assholes like these people should be charged with reckless endangerment and manslaughter for every person they infect. contact tracing needs to lead to criminal prosecution.   #wearadamnmask
1282467506590973952,https://twitter.com/chris_kubica/status/1282467506590973952,I hear Disney World has a new attraction called Mickey’s Over-Capacity Hospital ICU Gurney Ride #death #madness #wearamask #stayhome #abandonhope #allyewhoenter #here,chris_kubica,2020-07-13 00:10:55+00:00,,,#death #madness #wearamask #stayhome #stayhome #abandonhope #allyewhoenter #here,0,3,,pos,i hear disney world has a new attraction called mickey’s over-capacity hospital icu gurney ride #death #madness   #stayhome #abandonhope #allyewhoenter #here
1282467285391867905,https://twitter.com/AecNewsToday/status/1282467285391867905,Indonesia morning news for July 13 via @aecnewstoday #Independent #Asean #journalism based in #Cambodia #WearAMask #WashYourHands https://aecnewstoday.com/2020/indonesia-morning-news-for-july-13-3,AecNewsToday,2020-07-13 00:10:02+00:00,,@AecNewsToday,#Independent #Asean #journalism #Cambodia #WearAMask #WashYourHands #WashYourHands,5,0,,pos,indonesia morning news for july 13 via @aecnewstoday #independent #asean #journalism based in #cambodia   #washyourhands https://aecnewstoday.com/2020/indonesia-morning-news-for-july-13-3
1282466739410935810,https://twitter.com/fitmslax/status/1282466739410935810,Mounting evidence has suggested that in crowded indoor spaces the virus can stay aloft for hours and infect others and may even seed so-called superspreader events. #WearAMask #Covid_19,fitmslax,2020-07-13 00:07:52+00:00,,,#WearAMask #Covid_19,2,5,,pos,mounting evidence has suggested that in crowded indoor spaces the virus can stay aloft for hours and infect others and may even seed so-called superspreader events.   #covid_19
1282466514139074562,https://twitter.com/CoachCat10/status/1282466514139074562,If I can wear a mask for a 5.5 mile bike ride you can wear one walking around in public. We are in this together #WearAMask Also shoutout to @LChamberlain44 for making awesome t-shirts and donating the profits to a great cause #BlackLivesStillMatter,CoachCat10,2020-07-13 00:06:58+00:00,,@LChamberlain44,#WearAMask #BlackLivesStillMatter,0,33,,pos,if i can wear a mask for a 5.5 mile bike ride you can wear one walking around in public. we are in this together   also shoutout to @lchamberlain44 for making awesome t-shirts and donating the profits to a great cause #blacklivesstillmatter
1282466512134168577,https://twitter.com/AllAboutJMo/status/1282466512134168577, ”Shades of Grey #masked walk” @jenmorrisonlive’s Instagram story #JenniferMorrison #WearAMask #AMaskADay #WeNotMe,AllAboutJMo,2020-07-13 00:06:58+00:00,,@jenmorrisonlive,#masked #JenniferMorrison #WearAMask #AMaskADay #WeNotMe,14,62,,pos, ”shades of grey #masked walk” @jenmorrisonlive’s instagram story #jennifermorrison   #amaskaday #wenotme
1282466140938055680,https://twitter.com/fionashirley76/status/1282466140938055680,C’mon Melbourne .... if you need to go out for essential items please do the right thing! #wearamask #staysafe #stayhome #IStandWithDan @Melbourne @DanielAndrewsMP,fionashirley76,2020-07-13 00:05:29+00:00,,@Melbourne @DanielAndrewsMP,#wearamask #staysafe #stayhome #stayhome #IStandWithDan,0,7,,pos,c’mon melbourne .... if you need to go out for essential items please do the right thing!   #staysafe #stayhome #istandwithdan @melbourne @danielandrewsmp
1282465809093148677,https://twitter.com/MetalRanga/status/1282465809093148677,Ok I've just had my second #COVID__19 test. Yeah it's not fun but it's not terrible. So basically harden up and take the tests if they're offered. Also #WearAMask FFS. Nobody is taking away your freedom. It's not about you it's about keeping others safe. #StopBeingStupid,MetalRanga,2020-07-13 00:04:10+00:00,,,#COVID__19 #WearAMask #StopBeingStupid,2,19,,pos,ok i've just had my second #covid__19 test. yeah it's not fun but it's not terrible. so basically harden up and take the tests if they're offered. also   ffs. nobody is taking away your freedom. it's not about you it's about keeping others safe. #stopbeingstupid
1282465589232111616,https://twitter.com/AAFoxy1/status/1282465589232111616,C'mon NJ. We can do it too. #WearAMask @GovMurphy,AAFoxy1,2020-07-13 00:03:18+00:00,Wolfe321,@GovMurphy,#WearAMask,1,3,,pos,c'mon nj. we can do it too.   @govmurphy
1282465400412934146,https://twitter.com/DianeLeo/status/1282465400412934146,Vaccines are poison and this one wil be the worst. #wayfairchildtrafficking #Fauci #wecantbreathe DON’T #WearAMask #pizzagate #pizzagateisreal #BillClinton #BillGatesBioTerrorist #BillGatesIsEvil #SaveTheChildrenWorldWide #savethebabies,DianeLeo,2020-07-13 00:02:33+00:00,WSJ,,#wayfairchildtrafficking #Fauci #wecantbreathe #WearAMask #pizzagate #pizzagateisreal #BillClinton #BillGatesBioTerrorist #BillGatesIsEvil #SaveTheChildrenWorldWide #savethebabies,2,4,,pos,vaccines are poison and this one wil be the worst. #wayfairchildtrafficking #fauci #wecantbreathe don’t   #pizzagate #pizzagateisreal #billclinton #billgatesbioterrorist #billgatesisevil #savethechildrenworldwide #savethebabies
1282465072057593858,https://twitter.com/indie_tx/status/1282465072057593858,“The rights of people to make their own medical decisions “ if only that applied to women! #WearAMask,indie_tx,2020-07-13 00:01:14+00:00,Reuters,,#WearAMask,3,81,,pos,“the rights of people to make their own medical decisions “ if only that applied to women!  
1282465010732630018,https://twitter.com/FightingIrish/status/1282465010732630018,#WearAMask @NDwbb’s Nicole Benz wears a mask to help keep her community safe. @stjoemed | #GoIrish,FightingIrish,2020-07-13 00:01:00+00:00,,@ndwbb @stjoemed,#WearAMask #GoIrish,4,67,,pos,  @ndwbb’s nicole benz wears a mask to help keep her community safe. @stjoemed | #goirish
1282464991904272384,https://twitter.com/ScientistMel/status/1282464991904272384,#ThisWeekInBS #PragerU and #DrBarke Misuse of #Science #WearAMask ,ScientistMel,2020-07-13 00:00:55+00:00,,,#ThisWeekInBS #PragerU #DrBarke #Science #WearAMask,1,3,,pos,#thisweekinbs #prageru and #drbarke misuse of #science   
1282464765722460161,https://twitter.com/GavinAyling/status/1282464765722460161,It seems like Becksted cannot read. The #science is clear #WearAMask: ,GavinAyling,2020-07-13 00:00:01+00:00,WMUR9,,#science #WearAMask,0,4,,pos,it seems like becksted cannot read. the #science is clear  : 
1282464760039006208,https://twitter.com/CTZebra/status/1282464760039006208,Imelda Tangonan 53yo RN at Blythedale Childrens Valhalla NY died of #covid19 on 4/24. As a child she would wrap her clothes around Dove soap so they would “smell like America”. She was a dedicated American nurse for 30 yrs. #healthcareheroes #WearAMask https://www.mcmahonfuneralhome.com/memorials/imelda-tangonan/4196106/,CTZebra,2020-07-13 00:00:00+00:00,,,#covid19 #healthcareheroes #WearAMask,32,62,,pos,imelda tangonan 53yo rn at blythedale childrens valhalla ny died of #covid19 on 4/24. as a child she would wrap her clothes around dove soap so they would “smell like america”. she was a dedicated american nurse for 30 yrs. #healthcareheroes   https://www.mcmahonfuneralhome.com/memorials/imelda-tangonan/4196106/
