id,url,raw_text,username,datetime_tweet,to,mentions,hashtags,retweets,favorites,geo,label,clean_text
1252038285205086208,https://twitter.com/RapeIsNoJoke/status/1252038285205086208,Trump is dangerous like Hitler Contemporary social high-bar paradigms based on class wealth & personal appearance are isolating masses of people into socially dysfunctional classes of havenots. #protest #Trump #WearAMask #COVID19 #Government #Whitmer https://rinj.press/fpmag/april-2020/trump-liberty-protests-may-parcel-covid-19-fail-with-society-collapse-analysis/,RapeIsNoJoke,2020-04-20 00:56:03+00:00,SteveRustad1,,#protest #Trump #WearAMask #COVID19 #Government #Whitmer,0,2,,pos,trump is dangerous like hitler contemporary social high-bar paradigms based on class wealth & personal appearance are isolating masses of people into socially dysfunctional classes of havenots. #protest #trump   #covid19 #government #whitmer https://rinj.press/fpmag/april-2020/trump-liberty-protests-may-parcel-covid-19-fail-with-society-collapse-analysis/
1252037600011059201,https://twitter.com/SusanYoung13/status/1252037600011059201,Get the message? #wearamask https://www.instagram.com/p/B_LupJ5gqpn/?igshid=yeok3jsybgva,SusanYoung13,2020-04-20 00:53:20+00:00,,,#wearamask,0,0,,pos,get the message?   https://www.instagram.com/p/b_lupj5gqpn/?igshid=yeok3jsybgva
1252037569677852674,https://twitter.com/AdrienneRoyer/status/1252037569677852674,Retired @UTKnoxville professor helping out with #WearAMask! ,AdrienneRoyer,2020-04-20 00:53:13+00:00,NPR,@UTKnoxville,#WearAMask,1,1,,pos,retired @utknoxville professor helping out with  ! 
1252037432272252928,https://twitter.com/OriginofABCs/status/1252037432272252928,So they can infect others? #WearAMask,OriginofABCs,2020-04-20 00:52:40+00:00,,,#WearAMask,0,1,,pos,so they can infect others?  
1252034922132340739,https://twitter.com/KeebsTheKeeblah/status/1252034922132340739,Waynes World Quarentine. #wearamask #Quarantine #PartyOnAtHome,KeebsTheKeeblah,2020-04-20 00:42:41+00:00,,,#wearamask #Quarantine #PartyOnAtHome,1,2,,pos,waynes world quarentine.   #quarantine #partyonathome
1252031739461095425,https://twitter.com/chickandbananas/status/1252031739461095425,Be safe and fashionable at the same time - your carbon filter reusable cotton mask includes two filters with each order - Baby Shark #protectyourself #stayhome #wearamask #mask BUY YOURS NOW: https://buff.ly/3ckxZNg,chickandbananas,2020-04-20 00:30:02+00:00,,,#protectyourself #stayhome #stayhome #wearamask #mask,0,0,,pos,be safe and fashionable at the same time - your carbon filter reusable cotton mask includes two filters with each order - baby shark #protectyourself #stayhome   #mask buy yours now: https://buff.ly/3ckxzng
1252031463370997760,https://twitter.com/MNToure/status/1252031463370997760,I am responsible for the sustainability of my own #freedom; so are you! #Lockdown lifted; time to be R E S P O N S I B L E! #Covid19Ghana #SpreadCalmNotFear #StayHomeStaySafe #WearAMask ,MNToure,2020-04-20 00:28:57+00:00,,,#freedom #Lockdown #Covid19Ghana #SpreadCalmNotFear #StayHomeStaySafe #WearAMask,0,1,,pos,i am responsible for the sustainability of my own #freedom; so are you! #lockdown lifted; time to be r e s p o n s i b l e! #covid19ghana #spreadcalmnotfear #stayhomestaysafe   
1252029645249220610,https://twitter.com/IslanderNews/status/1252029645249220610,318 new statewide cases. Dade adds 188. Gimenez likely to open parks first. No new cases on the island. DeSantis to hold first Re-Open Florida Task Force meeting. https://1l.ink/C3JFJ7V #islandernews #keybiscayne #coronavirus #covid9 #wearamask #maskforchange,IslanderNews,2020-04-20 00:21:43+00:00,,,#islandernews #keybiscayne #coronavirus #covid9 #wearamask #maskforchange,0,1,,pos,318 new statewide cases. dade adds 188. gimenez likely to open parks first. no new cases on the island. desantis to hold first re-open florida task force meeting. https://1l.ink/c3jfj7v #islandernews #keybiscayne #coronavirus #covid9   #maskforchange
1252027424654544896,https://twitter.com/OriginofABCs/status/1252027424654544896,This is so damn true. Goddess forbid he take a knee but they can infect everyone. #WearAMask,OriginofABCs,2020-04-20 00:12:54+00:00,sdmikeh,,#WearAMask,0,0,,pos,this is so damn true. goddess forbid he take a knee but they can infect everyone.  
1252026833123540992,https://twitter.com/mjflatow/status/1252026833123540992,They Look like Marvel SuperHeroes. This is awesome! #wearamask #FlattenTheCurve,mjflatow,2020-04-20 00:10:33+00:00,shafieikeyvan,,#wearamask #FlattenTheCurve,0,2,,pos,they look like marvel superheroes. this is awesome!   #flattenthecurve
1252026488699990019,https://twitter.com/mjflatow/status/1252026488699990019,I was watching Love Boat on @metv and they preempted with this #asshole . #TrumpLiesAmericansDie #WearAMask pic.twitter.com/TJv63k0TsY,mjflatow,2020-04-20 00:09:11+00:00,,@MeTV,#asshole #TrumpLiesAmericansDie #WearAMask,0,2,,pos,i was watching love boat on @metv and they preempted with this #asshole . #trumpliesamericansdie   pic.twitter.com/tjv63k0tsy
1252026315735216128,https://twitter.com/pamfdaniels/status/1252026315735216128,Silent transmission is why we all need to stay home and #WearAMask when out. Of the people onboard the Diamond Princess cruise ship 634 people were found to be infected-- 52% had no symptoms at the time of testing including 18% who never developed symptoms. #allinittogether,pamfdaniels,2020-04-20 00:08:29+00:00,,,#WearAMask #allinittogether,1,3,,pos,silent transmission is why we all need to stay home and   when out. of the people onboard the diamond princess cruise ship 634 people were found to be infected-- 52% had no symptoms at the time of testing including 18% who never developed symptoms. #allinittogether
1252025981793193984,https://twitter.com/edmitten/status/1252025981793193984,Stay the Blazes Home! #staytheblazeshome #beethoven #wearamask #virusisreal #hazeldean #edmonton #alberta #canada #isolationseries #rogerofedmonton #nikond5300 #nikonphotography #yeg #yegneighbourhoods… https://www.instagram.com/p/B_LpW0ghlYi/?igshid=31hx6x366xxu,edmitten,2020-04-20 00:07:10+00:00,,,#staytheblazeshome #beethoven #wearamask #virusisreal #hazeldean #edmonton #alberta #canada #isolationseries #rogerofedmonton #nikond5300 #nikonphotography #yeg #yegneighbourhoods,0,0,,pos,stay the blazes home! #staytheblazeshome #beethoven   #virusisreal #hazeldean #edmonton #alberta #canada #isolationseries #rogerofedmonton #nikond5300 #nikonphotography #yeg #yegneighbourhoods… https://www.instagram.com/p/b_lpw0ghlyi/?igshid=31hx6x366xxu
1252025955826184194,https://twitter.com/reemnouh/status/1252025955826184194,#WearAMask and save lives. Don’t let anything change your smile! ,reemnouh,2020-04-20 00:07:04+00:00,,,#WearAMask,0,1,,pos,  and save lives. don’t let anything change your smile! 
1252025193503109130,https://twitter.com/AecNewsToday/status/1252025193503109130,Philippines morning news for April 20 via @aecnewstoday #Independent #Asean #journalism based in #Cambodia #StayHome #isolate #prepare #WearAMask https://aecnewstoday.com/2020/philippines-morning-news-for-april-20-3,AecNewsToday,2020-04-20 00:04:02+00:00,,@AecNewsToday,#Independent #Asean #journalism #Cambodia #StayHome #StayHome #isolate #prepare #WearAMask,5,0,,pos,philippines morning news for april 20 via @aecnewstoday #independent #asean #journalism based in #cambodia #stayhome #isolate #prepare   https://aecnewstoday.com/2020/philippines-morning-news-for-april-20-3
1252024691545513985,https://twitter.com/AecNewsToday/status/1252024691545513985,Thailand morning news for April 20 via @aecnewstoday #Independent #Asean #journalism based in #Cambodia #StayHome #isolate #prepare #WearAMask https://aecnewstoday.com/2020/thailand-morning-news-for-april-20-3,AecNewsToday,2020-04-20 00:02:02+00:00,,@AecNewsToday,#Independent #Asean #journalism #Cambodia #StayHome #StayHome #isolate #prepare #WearAMask,5,0,,pos,thailand morning news for april 20 via @aecnewstoday #independent #asean #journalism based in #cambodia #stayhome #isolate #prepare   https://aecnewstoday.com/2020/thailand-morning-news-for-april-20-3
