id,url,raw_text,username,datetime_tweet,to,mentions,hashtags,retweets,favorites,geo,label,clean_text
1253517361577111552,https://twitter.com/aanondo/status/1253517361577111552,It’s Friday! Wear your fanciest mask today ;) #wearamask and enjoy the cool breeze! Post pics with the hashtag #humourthevirus. Let’s see who has prettiest mask :) today. Here’s wishing you a happy day from the virtual studios of \foreverrNow #stayhome… https://instagr.am/p/B_WMSAkFSz5/,aanondo,2020-04-24 02:53:22+00:00,,,#wearamask #humourthevirus #stayhome #stayhome,2,2,,pos,it’s friday! wear your fanciest mask today ;)   and enjoy the cool breeze! post pics with the hashtag #humourthevirus. let’s see who has prettiest mask :) today. here’s wishing you a happy day from the virtual studios of \foreverrnow #stayhome… https://instagr.am/p/b_wmsakfsz5/
1253515620206866432,https://twitter.com/z3roTrust/status/1253515620206866432,Stressful times cause us to look at problems differently approaching them from different perspectives. Our comfort zones in a professional & personal sense exist entirely in our own minds. Obliterate that mental geofencing & go after your goals in life while you #WearAMask. ,z3roTrust,2020-04-24 02:46:27+00:00,,,#WearAMask,0,3,,pos,stressful times cause us to look at problems differently approaching them from different perspectives. our comfort zones in a professional & personal sense exist entirely in our own minds. obliterate that mental geofencing & go after your goals in life while you  . 
1253513864290816000,https://twitter.com/GiftGarb/status/1253513864290816000,Blue floral cotton face mask 3 layers with filter pocket soft ear loops hands off face mask washable and reusable sizes S M L XL #facemasks #prettymask #wearamask https://etsy.me/3501cdS,GiftGarb,2020-04-24 02:39:29+00:00,,,#facemasks #prettymask #wearamask,0,0,,pos,blue floral cotton face mask 3 layers with filter pocket soft ear loops hands off face mask washable and reusable sizes s m l xl #facemasks #prettymask   https://etsy.me/3501cds
1253511207480373249,https://twitter.com/ansue67/status/1253511207480373249,Clean Clean Clean! #SocialDistancing #WearAMask #BeSafeOutThere ,ansue67,2020-04-24 02:28:55+00:00,,,#SocialDistancing #WearAMask #BeSafeOutThere,0,1,,pos,clean clean clean! #socialdistancing   #besafeoutthere 
1253509830423142400,https://twitter.com/jhou_will/status/1253509830423142400,DAY 32: Positive message: Another good things about wearing mask because of #COVID19 is that now you don’t need to feel uncomfortable saying when someone has bad breath. You don’t have to say anything actually. They will smell their own breath inside their mask. #WearAMask,jhou_will,2020-04-24 02:23:27+00:00,,,#COVID19 #WearAMask,0,3,,pos,day 32: positive message: another good things about wearing mask because of #covid19 is that now you don’t need to feel uncomfortable saying when someone has bad breath. you don’t have to say anything actually. they will smell their own breath inside their mask.  
1253509199805497344,https://twitter.com/sutefanii93/status/1253509199805497344,How it feels breathing with a mask on for plus hours #stayhome #stayin #stayhealthy #wearamask #wereallinthistogether #quarantineandchill #quaratings #quarantine #blogger #forever21 #mua https://www.instagram.com/p/B_WL2QlhXa1/?igshid=5kefwu66abzt,sutefanii93,2020-04-24 02:20:56+00:00,,,#stayhome #stayhome #stayin #stayhealthy #wearamask #wereallinthistogether #quarantineandchill #quaratings #quarantine #blogger #forever21 #mua,0,2,,pos,how it feels breathing with a mask on for plus hours #stayhome #stayin #stayhealthy   #wereallinthistogether #quarantineandchill #quaratings #quarantine #blogger #forever21 #mua https://www.instagram.com/p/b_wl2qlhxa1/?igshid=5kefwu66abzt
1253507648185655296,https://twitter.com/DaphneZ2015/status/1253507648185655296,It won’t kill YOU to just #WearAMask !! But YOU may kill someone if you don’t!! #Asymptomatic,DaphneZ2015,2020-04-24 02:14:47+00:00,,,#WearAMask #Asymptomatic,0,0,,pos,it won’t kill you to just   !! but you may kill someone if you don’t!! #asymptomatic
1253505416375517184,https://twitter.com/USforFreedom/status/1253505416375517184,#Connecticut: #COVID19 has arrived to Hartford County &amp; we're in the thick of it now. #StayHome #WearAMask Phone 211 to find out where's testing. Go to ER or call 911 if you cant breathe!!! You need oxygen! Take Tylenol for fever. Drink plenty juice water but not alcohol. ,USforFreedom,2020-04-24 02:05:54+00:00,USforFreedom,,#Connecticut #COVID19 #StayHome #StayHome #WearAMask,1,0,,pos,#connecticut: #covid19 has arrived to hartford county &amp; we're in the thick of it now. #stayhome   phone 211 to find out where's testing. go to er or call 911 if you cant breathe!!! you need oxygen! take tylenol for fever. drink plenty juice water but not alcohol. 
1253501987037069312,https://twitter.com/VidProducerGAL/status/1253501987037069312,Family bike ride at (sniffle sniffle) the MacArthur School & soaking up rays & tea at my favorite kitchen cafe. #quarentinelife #getoutside #wearamask #soakingupthesun https://www.instagram.com/p/B_WIg3SAgse/ via https://tweet.photo,VidProducerGAL,2020-04-24 01:52:17+00:00,,,#quarentinelife #getoutside #wearamask #soakingupthesun,0,0,,pos,family bike ride at (sniffle sniffle) the macarthur school & soaking up rays & tea at my favorite kitchen cafe. #quarentinelife #getoutside   #soakingupthesun https://www.instagram.com/p/b_wig3sagse/ via https://tweet.photo
1253491696404500485,https://twitter.com/2HeartsWellness/status/1253491696404500485,It was not your time to go and it is a gift that you are alive to share your story and help people to understand how serious this disease is @DavidLat . May your healing process be smooth and continuous and fruitful. #COVID19 #StayHome #WearAMask #WeAreAllInThisTogether,2HeartsWellness,2020-04-24 01:11:23+00:00,DavidLat,@DavidLat,#COVID19 #StayHome #StayHome #WearAMask #WeAreAllInThisTogether,0,1,,pos,it was not your time to go and it is a gift that you are alive to share your story and help people to understand how serious this disease is @davidlat . may your healing process be smooth and continuous and fruitful. #covid19 #stayhome   #weareallinthistogether
1253491531476086785,https://twitter.com/bambifransworth/status/1253491531476086785,Doing my part man. #StayHome #HealthWorkers #PPE #Coronavirus #WearAMask #SupportHealthcareHeroes,bambifransworth,2020-04-24 01:10:44+00:00,,,#StayHome #StayHome #HealthWorkers #PPE #Coronavirus #WearAMask #SupportHealthcareHeroes,0,1,,pos,doing my part man. #stayhome #healthworkers #ppe #coronavirus   #supporthealthcareheroes
1253490393817190401,https://twitter.com/maroney_joyce/status/1253490393817190401,Have made over 100 masks for friends and family. Stay safe everybody! #WearAMask ,maroney_joyce,2020-04-24 01:06:13+00:00,,,#WearAMask,0,1,,pos,have made over 100 masks for friends and family. stay safe everybody!   
1253488334434791424,https://twitter.com/RTaylorFBscout/status/1253488334434791424,No surprise to #NPvisor. Keep rolling! #wearamask ,RTaylorFBscout,2020-04-24 00:58:02+00:00,derekwilkinss,,#NPvisor #wearamask,0,1,,pos,no surprise to #npvisor. keep rolling!   
1253480334831869953,https://twitter.com/rozharlem45/status/1253480334831869953,To the smart and common sense people of the world. If your an essential worker have to go out for groceries. God bless you btw #Stayhome #WearAMask,rozharlem45,2020-04-24 00:26:15+00:00,,,#Stayhome #Stayhome #WearAMask,0,1,,pos,to the smart and common sense people of the world. if your an essential worker have to go out for groceries. god bless you btw #stayhome  
1253479552048750592,https://twitter.com/CrusePhoto/status/1253479552048750592,I was at Walmart and they do have one way aisles except these people were going the wrong way and taking up the whole aisle! #ShopAlone #WearAMask,CrusePhoto,2020-04-24 00:23:08+00:00,3LWTV,,#ShopAlone #WearAMask,0,3,,pos,i was at walmart and they do have one way aisles except these people were going the wrong way and taking up the whole aisle! #shopalone  
1253478044175462401,https://twitter.com/CrusePhoto/status/1253478044175462401,If you don’t need physical help please do not bring extra people with you shopping in the grocery store! It’s already difficult enough to keep #socialdistancing intact! And please #WearAMask,CrusePhoto,2020-04-24 00:17:08+00:00,,,#socialdistancing #WearAMask,0,3,,pos,if you don’t need physical help please do not bring extra people with you shopping in the grocery store! it’s already difficult enough to keep #socialdistancing intact! and please  
1253477649692766209,https://twitter.com/Salas50045257/status/1253477649692766209,#WearAMask #WuhanCoronaVirus #WHOLiedPeopleDied #COVIDー19 Scientists join calls for UK public to wear homemade face masks outdoors,Salas50045257,2020-04-24 00:15:34+00:00,,,#WearAMask #WuhanCoronaVirus #WHOLiedPeopleDied #COVID,0,0,,pos,  #wuhancoronavirus #wholiedpeopledied #covidー19 scientists join calls for uk public to wear homemade face masks outdoors
1253477261984096256,https://twitter.com/AecNewsToday/status/1253477261984096256,Cambodia morning news for April 24 via @aecnewstoday #Independent #Asean #journalism based in #Cambodia #StayHome #isolate #prepare #WearAMask https://aecnewstoday.com/2020/cambodia-morning-news-for-april-24-4,AecNewsToday,2020-04-24 00:14:02+00:00,,@AecNewsToday,#Independent #Asean #journalism #Cambodia #StayHome #StayHome #isolate #prepare #WearAMask,5,1,,pos,cambodia morning news for april 24 via @aecnewstoday #independent #asean #journalism based in #cambodia #stayhome #isolate #prepare   https://aecnewstoday.com/2020/cambodia-morning-news-for-april-24-4
1253477153653620738,https://twitter.com/ChiefQuintHoopr/status/1253477153653620738,Good seeing you on the @NFLDraft  Dr. Fauci! #NFLDraft #NFLDraft2020 #StayHome #StayAtHome #SocialDistancing #WashYourHands #WearAMask,ChiefQuintHoopr,2020-04-24 00:13:36+00:00,,@NFLDraft,#NFLDraft #NFLDraft2020 #StayHome #StayHome #StayAtHome #StayAtHome #SocialDistancing #WashYourHands #WashYourHands #WearAMask,0,0,,pos,good seeing you on the @nfldraft  dr. fauci! #nfldraft #nfldraft2020 #stayhome #stayathome #socialdistancing #washyourhands  
1253473915130859526,https://twitter.com/BubbaBlu3/status/1253473915130859526,#WearAMask ,BubbaBlu3,2020-04-24 00:00:44+00:00,,,#WearAMask,0,1,,pos,  
