id,url,raw_text,username,datetime_tweet,to,mentions,hashtags,retweets,favorites,geo,label,clean_text
1269087600502964224,https://twitter.com/olivier_patti/status/1269087600502964224,I miss you so much My Dear Cajun Right down the road So here comes the hug Arizona is insane folks The virus spiked We are out of control. Thanks Ducey #WearAMask #TrumpIsAnIdiot #BlackLivesMatter #BeSafeOutThere Friday mood.. ,olivier_patti,2020-06-06 02:03:57+00:00,CajunBlueAZ1,,#WearAMask #TrumpIsAnIdiot #BlackLivesMatter #BlackLivesMatter #BeSafeOutThere,5,10,,pos,i miss you so much my dear cajun right down the road so here comes the hug arizona is insane folks the virus spiked we are out of control. thanks ducey   #trumpisanidiot #blacklivesmatter #besafeoutthere friday mood.. 
1269085128619417601,https://twitter.com/DrYaraRobertson/status/1269085128619417601,Just because the media stopped reporting on it does not mean it has gone away. Remain vigilant. #COVID19 #coronavirus #WashYourHands #WearAMask #SocialDistanacing,DrYaraRobertson,2020-06-06 01:54:07+00:00,,,#COVID19 #coronavirus #WashYourHands #WashYourHands #WearAMask #SocialDistanacing,0,2,,pos,just because the media stopped reporting on it does not mean it has gone away. remain vigilant. #covid19 #coronavirus #washyourhands   #socialdistanacing
1269084980275302402,https://twitter.com/EarthSci_Info/status/1269084980275302402,The #COVID19 New Daily Cases Trend Assessment map has now be clipped to coastlines for easier viewing. #StayHomeStaySafe #WashYourHands #WearAMask ,EarthSci_Info,2020-06-06 01:53:32+00:00,,,#COVID19 #StayHomeStaySafe #WashYourHands #WashYourHands #WearAMask,3,9,,pos,the #covid19 new daily cases trend assessment map has now be clipped to coastlines for easier viewing. #stayhomestaysafe #washyourhands   
1269083575456018437,https://twitter.com/PJBrew2/status/1269083575456018437,Ummm..remember Covid??? #ItsStillHere #WearAMask #SocialDistanacing ,PJBrew2,2020-06-06 01:47:57+00:00,maddow,,#ItsStillHere #WearAMask #SocialDistanacing,0,2,,pos,ummm..remember covid??? #itsstillhere   #socialdistanacing 
1269082370902315008,https://twitter.com/voter1vote/status/1269082370902315008,How hard is it to #WearAMask ? ,voter1vote,2020-06-06 01:43:10+00:00,LovenTreasure,,#WearAMask,3,4,,pos,how hard is it to   ? 
1269077509548761091,https://twitter.com/joydhughes/status/1269077509548761091,Suddenly the public put the pieces together of Social Justice and Public Health. They are the same cause. Doctors volunteering on the #covid19 front lines are supporting the #BlackLivesMatter movement. It makes sense to the heart. We #WearAMask and fight for human rights.,joydhughes,2020-06-06 01:23:51+00:00,NAChristakis,,#covid19 #BlackLivesMatter #BlackLivesMatter #WearAMask,0,8,,pos,suddenly the public put the pieces together of social justice and public health. they are the same cause. doctors volunteering on the #covid19 front lines are supporting the #blacklivesmatter movement. it makes sense to the heart. we   and fight for human rights.
1269077127179075584,https://twitter.com/annalynnmartino/status/1269077127179075584,Thank you everyone who had my family in your thoughts. My uncle passed today. Covid affects everything... take care of each other. #WearAMask,annalynnmartino,2020-06-06 01:22:20+00:00,,,#WearAMask,0,4,,pos,thank you everyone who had my family in your thoughts. my uncle passed today. covid affects everything... take care of each other.  
1269074502216036353,https://twitter.com/FlaHarlock/status/1269074502216036353,I’m a nurse in Florida. Pray for me and #WearAMask ,FlaHarlock,2020-06-06 01:11:54+00:00,BarryVictor5,,#WearAMask,0,3,,pos,i’m a nurse in florida. pray for me and   
1269071979786592256,https://twitter.com/chiccomarx/status/1269071979786592256,Wear a hoodie. Saw an American tweet w suggestions for protesting so cops can’t grab u by the hair. #WearAHoodie and #WearAMask,chiccomarx,2020-06-06 01:01:52+00:00,,,#WearAHoodie #WearAMask,3,5,,pos,wear a hoodie. saw an american tweet w suggestions for protesting so cops can’t grab u by the hair. #wearahoodie and  
1269064884941213697,https://twitter.com/stefshap/status/1269064884941213697,Let’s not forget  there’s still a pandemic out there ! #WearAMask ,stefshap,2020-06-06 00:33:41+00:00,scrippsresearch,,#WearAMask,0,1,,pos,let’s not forget  there’s still a pandemic out there !   
1269062006818181121,https://twitter.com/Eric_Carroll/status/1269062006818181121,Come live in downtown Toronto & shop. Less than 1 in 5 wearing a mask. Nearing R(t)>1. Again. Unless you have a cottage you can flee to pretty sure this would change your mind. TTC mask wearing is 0. Grocery store mask wearing dropping. Ppl think its over. Its not. #WearAMask,Eric_Carroll,2020-06-06 00:22:15+00:00,COWasian,,#WearAMask,0,2,,pos,come live in downtown toronto & shop. less than 1 in 5 wearing a mask. nearing r(t)>1. again. unless you have a cottage you can flee to pretty sure this would change your mind. ttc mask wearing is 0. grocery store mask wearing dropping. ppl think its over. its not.  
1269058159668277248,https://twitter.com/zbigalke/status/1269058159668277248,I always hated grocery shopping but I hate it even more now these days... especially now that more and more people are going about in public without masks. #WearAMask,zbigalke,2020-06-06 00:06:57+00:00,,,#WearAMask,1,2,,pos,i always hated grocery shopping but i hate it even more now these days... especially now that more and more people are going about in public without masks.  
1269056976819851264,https://twitter.com/FingBullShiT/status/1269056976819851264,Some shit is worth risking harm for- #BlackLivesMatter &amp; protesting state murder is one of those things... #WearAMask &amp; do your best to keep some distance...but unless you devalue the reasons for the protests it's a false narrative to equate them to hair cuts and pilates,FingBullShiT,2020-06-06 00:02:15+00:00,20committee,,#BlackLivesMatter #BlackLivesMatter #WearAMask,1,11,,pos,some shit is worth risking harm for- #blacklivesmatter &amp; protesting state murder is one of those things...   &amp; do your best to keep some distance...but unless you devalue the reasons for the protests it's a false narrative to equate them to hair cuts and pilates
1269056963230351360,https://twitter.com/NurseRavenCNS/status/1269056963230351360,I’m happy to see the number of masks among the Denver protesters. Memorial day didn’t look so great...#WearAMask ,NurseRavenCNS,2020-06-06 00:02:12+00:00,denverpost,,#WearAMask,0,0,,pos,i’m happy to see the number of masks among the denver protesters. memorial day didn’t look so great...  
1269056622476828678,https://twitter.com/DinosWearChux/status/1269056622476828678,#blm #TakeAKnee #COVID #WearAMask ,DinosWearChux,2020-06-06 00:00:51+00:00,,,#blm #TakeAKnee #COVID #WearAMask,0,0,,pos,#blm #takeaknee #covid   
1269056532420968450,https://twitter.com/AecNewsToday/status/1269056532420968450,Out now!! 9 country editions with all of the #news you need to know for each Asean country on one page + an #Asean news roundup too No #clickbait No #popups No #paywalls #WearAMask Independent Asean #journalism based in #Cambodia https://aecnewstoday.com/morning-news-roundups/,AecNewsToday,2020-06-06 00:00:29+00:00,,,#news #Asean #clickbait #popups #paywalls #WearAMask #journalism #Cambodia,0,0,,pos,out now!! 9 country editions with all of the #news you need to know for each asean country on one page + an #asean news roundup too no #clickbait no #popups no #paywalls   independent asean #journalism based in #cambodia https://aecnewstoday.com/morning-news-roundups/
