id,url,raw_text,username,datetime_tweet,to,mentions,hashtags,retweets,favorites,geo,label,clean_text
1286609094422540289,https://twitter.com/Royal_Armouries/status/1286609094422540289,Masks are mandatory in UK shops as of today which got us thinking... Which piece of our prized PPE would you pick for your next trip out for milk and bread? #wearamask #facecoverings,Royal_Armouries,2020-07-24 10:28:06+00:00,,,#wearamask #facecoverings,16,63,,pos,masks are mandatory in uk shops as of today which got us thinking... which piece of our prized ppe would you pick for your next trip out for milk and bread?   #facecoverings
1286602063380717573,https://twitter.com/coseyfannitutti/status/1286602063380717573,Hydrangea mood today. #WearAMask #StaySafe ,coseyfannitutti,2020-07-24 10:00:10+00:00,,,#WearAMask #StaySafe,7,99,,pos,hydrangea mood today.   #staysafe 
1286595689489858560,https://twitter.com/JuliaBradbury/status/1286595689489858560,24 July. Wear a mask save lives. This splendid pink mask from UK company @aspigabeach #wearamask #maskssavelives #masks,JuliaBradbury,2020-07-24 09:34:50+00:00,,@aspigabeach,#wearamask #maskssavelives #masks,12,160,,pos,24 july. wear a mask save lives. this splendid pink mask from uk company @aspigabeach   #maskssavelives #masks
1286590220910174208,https://twitter.com/OneMinuteBriefs/status/1286590220910174208,One Minute Brief of the Day: Create posters to encourage people to wear #FaceCoverings as it becomes mandatory in enclosed public spaces. Full brief here: https://www.bankofcreativity.co.uk/blog/omb-facecoverings #GotItCovered #FaceMasks #WearAMask #MaskUp,OneMinuteBriefs,2020-07-24 09:13:07+00:00,,,#FaceCoverings #GotItCovered #FaceMasks #WearAMask #MaskUp,27,47,,pos,one minute brief of the day: create posters to encourage people to wear #facecoverings as it becomes mandatory in enclosed public spaces. full brief here: https://www.bankofcreativity.co.uk/blog/omb-facecoverings #gotitcovered #facemasks   #maskup
1286588671743926272,https://twitter.com/huncentnoodles/status/1286588671743926272,Just nipping into the shop for milk so like any right-minded responsible person who cares about the health of others I choose to wear a mask. The rest of you selfish none-mask wearing arseholes stay the fuck at home you absolute cunts. #WearAMask pic.twitter.com/lRvKYuiQCA,huncentnoodles,2020-07-24 09:06:57+00:00,,,#WearAMask,32,399,,pos,just nipping into the shop for milk so like any right-minded responsible person who cares about the health of others i choose to wear a mask. the rest of you selfish none-mask wearing arseholes stay the fuck at home you absolute cunts.   pic.twitter.com/lrvkyuiqca
1286587298851823617,https://twitter.com/hfxtransit/status/1286587298851823617,Today the provincial public health order of mandatory masks on transit goes into effect. If you forgot yours you can stop by one of our terminals to get a free reusable mask - thanks to @nsgov for supplying! Come see us and remember to #wearamask on Halifax Transit! ,hfxtransit,2020-07-24 09:01:30+00:00,,@nsgov,#wearamask,52,97,,pos,today the provincial public health order of mandatory masks on transit goes into effect. if you forgot yours you can stop by one of our terminals to get a free reusable mask - thanks to @nsgov for supplying! come see us and remember to   on halifax transit! 
1286579975743733761,https://twitter.com/stephen_collins/status/1286579975743733761,Friendly reminder from the owner of the wonderful @GoshComics. Please wear a mask! #WearAMask ,stephen_collins,2020-07-24 08:32:24+00:00,,@GoshComics,#WearAMask,61,86,,pos,friendly reminder from the owner of the wonderful @goshcomics. please wear a mask!   
1286569362795704320,https://twitter.com/DaveRowntree/status/1286569362795704320,Protect your friends and neighbours and #WearAMask in all enclosed public spaces in England from today. ,DaveRowntree,2020-07-24 07:50:14+00:00,,,#WearAMask,17,134,,pos,protect your friends and neighbours and   in all enclosed public spaces in england from today. 
1286564102094151683,https://twitter.com/EoinTennyson/status/1286564102094151683,Rules to live by... Love this from Barrel &amp; Bean Dromore. #WearAMask ,EoinTennyson,2020-07-24 07:29:19+00:00,,,#WearAMask,115,382,,pos,rules to live by... love this from barrel &amp; bean dromore.   
1286559262097977346,https://twitter.com/StrongerStabler/status/1286559262097977346,"Michael Gove said it was ""basic good manners"" to wear a face mask in shops...and he trusted the ""common sense"" of the British people. Here Gove fails to exhibit neither good manners or common sense. https://bbc.co.uk/news/uk-53381000 #CovidShambles #BorisHasFailedTheUK #WearAMask ",StrongerStabler,2020-07-24 07:10:05+00:00,,,#CovidShambles #BorisHasFailedTheUK #WearAMask,30,53,,pos,"michael gove said it was ""basic good manners"" to wear a face mask in shops...and he trusted the ""common sense"" of the british people. here gove fails to exhibit neither good manners or common sense. https://bbc.co.uk/news/uk-53381000 #covidshambles #borishasfailedtheuk   "
1286557932243558404,https://twitter.com/sarahjolney1/status/1286557932243558404,If you’re out shopping today #WearAMask ,sarahjolney1,2020-07-24 07:04:48+00:00,,,#WearAMask,42,146,,pos,if you’re out shopping today   
1286556682903068672,https://twitter.com/mrjamesob/status/1286556682903068672,What fresh hell is this? #WearAMask ,mrjamesob,2020-07-24 06:59:50+00:00,,,#WearAMask,131,3445,,pos,what fresh hell is this?   
1286551709465149441,https://twitter.com/StrongerStabler/status/1286551709465149441,World-Beating mismanagement of the #CovidCrisis by Boris Johnson has left 60000 dead. He dithered over lockdown and has dithered over mandating the wearing of masks. This Goverment are a disaster and need to be held to account! #WearAMask #ToryShambles,StrongerStabler,2020-07-24 06:40:05+00:00,,,#CovidCrisis #WearAMask #ToryShambles,106,198,,pos,world-beating mismanagement of the #covidcrisis by boris johnson has left 60000 dead. he dithered over lockdown and has dithered over mandating the wearing of masks. this goverment are a disaster and need to be held to account!   #toryshambles
1286549321400430594,https://twitter.com/Midgecat/status/1286549321400430594,"""Masks are like underwear they need to be clean on each day and changed if they get damp."" Not sure who came up with this but it is a classic. So is this ad. #MaskUp #WearAMask ",Midgecat,2020-07-24 06:30:35+00:00,,,#MaskUp #WearAMask,76,180,,pos,"""masks are like underwear they need to be clean on each day and changed if they get damp."" not sure who came up with this but it is a classic. so is this ad. #maskup   "
1286537125119135744,https://twitter.com/dextersoy/status/1286537125119135744,yknow its bad when you wearing mask underneath a mask #WearAMask ,dextersoy,2020-07-24 05:42:07+00:00,,,#WearAMask,29,210,,pos,yknow its bad when you wearing mask underneath a mask   
1286534245846937601,https://twitter.com/gostefaniego/status/1286534245846937601,I have asthma and can run 3 miles while wearing a mask. Grow up Karen. #WearAMask ,gostefaniego,2020-07-24 05:30:41+00:00,,,#WearAMask,155,1166,,pos,i have asthma and can run 3 miles while wearing a mask. grow up karen.   
1286519376183808000,https://twitter.com/morethanmySLE/status/1286519376183808000,If agree with Major League Baseball & trust & respect Dr. Fauci MORE than Trump respond with (even on the pitcher's mound Dr. Fauci WILL #WearAMask ),morethanmySLE,2020-07-24 04:31:36+00:00,,,#WearAMask,126,629,,pos,if agree with major league baseball & trust & respect dr. fauci more than trump respond with (even on the pitcher's mound dr. fauci will   )
1286511772988592128,https://twitter.com/SoyBoyManBun/status/1286511772988592128,Be like Miss Nessie. Wear a mask. Thank you for coming to Ted Talk. #WearAMask IG little.miss.nessie ,SoyBoyManBun,2020-07-24 04:01:23+00:00,,,#WearAMask,51,169,,pos,be like miss nessie. wear a mask. thank you for coming to ted talk.   ig little.miss.nessie 
1286510598365290502,https://twitter.com/GINIEJET11/status/1286510598365290502,No mask no flight —-> out #aviation #aviationphotography #aviationphotography #WearAMask #WearAMaskSaveALife #WearTheDamnMask #crewlife #AvGeek #travelphotography #Travel #travelblogger #masque #masqueobligatoire,GINIEJET11,2020-07-24 03:56:43+00:00,,,#aviation #aviationphotography #aviationphotography #WearAMask #WearAMaskSaveALife #WearTheDamnMask #crewlife #AvGeek #travelphotography #Travel #travelblogger #masque #masqueobligatoire,34,125,,pos,no mask no flight —-> out #aviation #aviationphotography #aviationphotography    savealife #wearthedamnmask #crewlife #avgeek #travelphotography #travel #travelblogger #masque #masqueobligatoire
1286508898116145153,https://twitter.com/morethanmySLE/status/1286508898116145153,What a beautiful tribute to Dr. Fauci (& all the heroes during #Covid_19) from Major League Baseball. Dr. Fauci NEVER misses an opportunity to remind us to #WearAMask It's CLEAR that the MLB trusts &amp; respects Dr. Fauci. If YOU trust Dr. Fauci MORE than Trump respond with ,morethanmySLE,2020-07-24 03:49:58+00:00,MLB,,#Covid_19 #WearAMask,179,593,,pos,what a beautiful tribute to dr. fauci (& all the heroes during #covid_19) from major league baseball. dr. fauci never misses an opportunity to remind us to   it's clear that the mlb trusts &amp; respects dr. fauci. if you trust dr. fauci more than trump respond with 
1286506255947902977,https://twitter.com/CTZebra/status/1286506255947902977,I hate how many of these Healthcare providers who have died of covid barely have any retweets never made it into the news; sacrifices that go unnoticed. There are over 800 on my page. #healthcareheroes #CovidDeaths #WearAMask,CTZebra,2020-07-24 03:39:28+00:00,,,#healthcareheroes #CovidDeaths #WearAMask,132,273,,pos,i hate how many of these healthcare providers who have died of covid barely have any retweets never made it into the news; sacrifices that go unnoticed. there are over 800 on my page. #healthcareheroes #coviddeaths  
1286496761637306370,https://twitter.com/TheCyberelf/status/1286496761637306370,Excuse the use of Tik Tok but you'll get the message. If she and my friends can put up with this you can put on a little covering...even if it could help 10% you have nothing to loose. Be positive Stay awesome! #WearAMask #WearADamnMask #WearAMaskSaveALife #Retweet,TheCyberelf,2020-07-24 03:01:44+00:00,,,#WearAMask #WearADamnMask #WearAMaskSaveALife #Retweet,8,23,,pos,excuse the use of tik tok but you'll get the message. if she and my friends can put up with this you can put on a little covering...even if it could help 10% you have nothing to loose. be positive stay awesome!   #wearadamnmask  savealife #retweet
1286493546728394752,https://twitter.com/HevBoyd/status/1286493546728394752,Just did my first masked-up grocery shop. I have asthma and as it happens am having a bad asthma day. Was it uncomfortable? Yes. Was it impossible? Absolutely not. #WearAMask #COVID19Vic,HevBoyd,2020-07-24 02:48:58+00:00,,,#WearAMask #COVID19Vic,4,20,,pos,just did my first masked-up grocery shop. i have asthma and as it happens am having a bad asthma day. was it uncomfortable? yes. was it impossible? absolutely not.   #covid19vic
1286492117821460480,https://twitter.com/jkwan_md/status/1286492117821460480,How to wear a mask (do's & don'ts!): #Masks4Canada #WearAMask https://www.canada.ca/content/dam/hc-sc/documents/services/publications/diseases-and-conditions/covid-19-safely-use-non-medical-mask-face-covering/covid-19-safely-use-non-medical-mask-face-covering-en.pdf,jkwan_md,2020-07-24 02:43:17+00:00,,,#Masks4Canada #WearAMask,37,73,,pos,how to wear a mask (do's & don'ts!): #masks4canada   https://www.canada.ca/content/dam/hc-sc/documents/services/publications/diseases-and-conditions/covid-19-safely-use-non-medical-mask-face-covering/covid-19-safely-use-non-medical-mask-face-covering-en.pdf
1286491376893362178,https://twitter.com/DrMarthaGulati/status/1286491376893362178,4000000 cases in the USA now. Milestones no one wants. Let’s stop this #wearamask #physicaldistance &amp; wash your hands. Please. ⁦@DocSavageTJU⁩ ⁦@DBelardoMD⁩ ⁦@fischman_david⁩ ⁦@iamritu⁩ ⁦@mmamas1973⁩,DrMarthaGulati,2020-07-24 02:40:20+00:00,,@DocSavageTJU @DBelardoMD @fischman_david @iamritu @mmamas1973,#wearamask #physicaldistance,5,17,,pos,4000000 cases in the usa now. milestones no one wants. let’s stop this   #physicaldistance &amp; wash your hands. please. ⁦@docsavagetju⁩ ⁦@dbelardomd⁩ ⁦@fischman_david⁩ ⁦@iamritu⁩ ⁦@mmamas1973⁩
1286487658139533313,https://twitter.com/HeartBobH/status/1286487658139533313,Still glad that he chose a career in medicine and science. #StandWithFauci #WearAMask #WashYourHands #SocialDistancing Proud to be @holy_cross @hcalumni “men and women for others”,HeartBobH,2020-07-24 02:25:34+00:00,espn,@holy_cross @hcalumni,#StandWithFauci #WearAMask #WashYourHands #WashYourHands #SocialDistancing,7,77,,pos,still glad that he chose a career in medicine and science. #standwithfauci   #washyourhands #socialdistancing proud to be @holy_cross @hcalumni “men and women for others”
1286484433961394176,https://twitter.com/tinawheat/status/1286484433961394176,Please wear your mask in public everyday. Please wear a mask when you are indoors around others not in your household. This isn’t new- but needs repeating. My 5 and 8 year olds can wear a mask all day so can most of you. #WearAMask,tinawheat,2020-07-24 02:12:45+00:00,,,#WearAMask,6,25,,pos,please wear your mask in public everyday. please wear a mask when you are indoors around others not in your household. this isn’t new- but needs repeating. my 5 and 8 year olds can wear a mask all day so can most of you.  
1286483992829624323,https://twitter.com/CTZebra/status/1286483992829624323,"Vidal Garay 60yo Security QueensCare Health Centers in East Los Angeles died of #covid19 6/20. He was a romantic husband and ""cool dad"". 27 of his family members were also sickened. #healthcareheroes #getusppe #WearAMask https://www.latimes.com/projects/coronavirus-lives-lost-in-california/",CTZebra,2020-07-24 02:11:00+00:00,,,#covid19 #healthcareheroes #getusppe #WearAMask,27,52,,pos,"vidal garay 60yo security queenscare health centers in east los angeles died of #covid19 6/20. he was a romantic husband and ""cool dad"". 27 of his family members were also sickened. #healthcareheroes #getusppe   https://www.latimes.com/projects/coronavirus-lives-lost-in-california/"
1286483668228218880,https://twitter.com/BFalchuk/status/1286483668228218880,Same. And I'm 5 months recovered. I can barely taste anything and everything smells like burning rubber/cinnamon #WearAMask,BFalchuk,2020-07-24 02:09:42+00:00,sherlyholmes,,#WearAMask,3,32,,pos,same. and i'm 5 months recovered. i can barely taste anything and everything smells like burning rubber/cinnamon  
1286483181470916609,https://twitter.com/WearePAHA/status/1286483181470916609,It’s important we do all we can to fight the pandemic. Masks make a major difference in preventing the spread of #COVID19. #WearAMask #HealthcareHeroes #S3599 @WearePAHA,WearePAHA,2020-07-24 02:07:46+00:00,NYGovCuomo,@WearePAHA,#COVID19 #WearAMask #HealthcareHeroes #S3599,114,108,,pos,it’s important we do all we can to fight the pandemic. masks make a major difference in preventing the spread of #covid19.   #healthcareheroes #s3599 @wearepaha
1286481830871535616,https://twitter.com/ScarsFan/status/1286481830871535616,Totally worth the wait!! Thank you @bakingjason and @THETomSavini for offering such a cool product!! #WearAMask ,ScarsFan,2020-07-24 02:02:24+00:00,,@bakingjason @THETomSavini,#WearAMask,4,57,,pos,totally worth the wait!! thank you @bakingjason and @thetomsavini for offering such a cool product!!   
1286475436281614336,https://twitter.com/CTZebra/status/1286475436281614336,Jacques McConico 49yo CNA at Diversicare Riverchase Birmingham AL died of #covid19 on 6/20. She was a sweet soul who never met a stranger. #healthcareheroes #getusppe #WearAMask https://www.google.com/amp/s/obits.al.com/obituaries/birmingham/obituary.aspx%3fn=jacques-r-mcconico&amp;pid=196356550&amp;fhid=23830,CTZebra,2020-07-24 01:37:00+00:00,,,#covid19 #healthcareheroes #getusppe #WearAMask,29,69,,pos,jacques mcconico 49yo cna at diversicare riverchase birmingham al died of #covid19 on 6/20. she was a sweet soul who never met a stranger. #healthcareheroes #getusppe   https://www.google.com/amp/s/obits.al.com/obituaries/birmingham/obituary.aspx%3fn=jacques-r-mcconico&amp;pid=196356550&amp;fhid=23830
1286470081535516675,https://twitter.com/HCrossWHockey/status/1286470081535516675,Dr. Anthony Fauci ‘62 looking good throwing out the first pitch on #OpeningDay! #WearAMask | #GoCrossGo,HCrossWHockey,2020-07-24 01:15:43+00:00,MLB,,#OpeningDay #OpeningDay #WearAMask #GoCrossGo,3,31,,pos,dr. anthony fauci ‘62 looking good throwing out the first pitch on #openingday!   | #gocrossgo
1286468677903298560,https://twitter.com/LtGovStratton/status/1286468677903298560,Today we hit the grim milestone of 4 million cases of #COVID19 in the U.S. But there’s something really simple we can do to significantly reduce the spread: #WearAMask or face covering in public. I wear a mask for my community. I wear a mask for you. ,LtGovStratton,2020-07-24 01:10:08+00:00,,,#COVID19 #WearAMask,22,54,,pos,today we hit the grim milestone of 4 million cases of #covid19 in the u.s. but there’s something really simple we can do to significantly reduce the spread:   or face covering in public. i wear a mask for my community. i wear a mask for you. 
1286463860002750464,https://twitter.com/CTZebra/status/1286463860002750464,Janita Fields-Yanez 41yo Phlebotomist WW Hastings Hosp Tahlequah OK died of #covid19 on 7/14. A member of the Cherokee Nation she was a bubbly hardworking single mother to 3 kids who enjoyed the simple things in life #healthcareheroes #WearAMask https://www.google.com/amp/s/www.dignitymemorial.com/obituaries/tahlequah-ok/janita-yanez-9264557,CTZebra,2020-07-24 00:51:00+00:00,,,#covid19 #healthcareheroes #WearAMask,102,189,,pos,janita fields-yanez 41yo phlebotomist ww hastings hosp tahlequah ok died of #covid19 on 7/14. a member of the cherokee nation she was a bubbly hardworking single mother to 3 kids who enjoyed the simple things in life #healthcareheroes   https://www.google.com/amp/s/www.dignitymemorial.com/obituaries/tahlequah-ok/janita-yanez-9264557
1286462036247945216,https://twitter.com/MerlinofCanada/status/1286462036247945216,#Alberta on July 9th had 590 active cases of #COVID19 as of today they have 1390 active cases. On July 9th Alberta had 7 patients in ICU as of today we have 21 in ICU. Things are not going well. #WashYourHands #WearAMask #PhysicalDistance Masking is critically important.,MerlinofCanada,2020-07-24 00:43:45+00:00,,,#Alberta #COVID19 #WashYourHands #WashYourHands #WearAMask #PhysicalDistance,51,72,,pos,#alberta on july 9th had 590 active cases of #covid19 as of today they have 1390 active cases. on july 9th alberta had 7 patients in icu as of today we have 21 in icu. things are not going well. #washyourhands   #physicaldistance masking is critically important.
1286461677446270978,https://twitter.com/LSD122070/status/1286461677446270978,I’m not gonna lie it’s great to see everyone out having fun again but damn at what price? The playgrounds are packed kids everywhere no masks in a few weeks I’m afraid that things are going swing back around and spike. #CoronavirusPandemic #WearAMask #StayHome #ONEV1,LSD122070,2020-07-24 00:42:19+00:00,,,#CoronavirusPandemic #WearAMask #StayHome #StayHome #ONEV1,16,32,,pos,i’m not gonna lie it’s great to see everyone out having fun again but damn at what price? the playgrounds are packed kids everywhere no masks in a few weeks i’m afraid that things are going swing back around and spike. #coronaviruspandemic   #stayhome #onev1
1286456769284366337,https://twitter.com/SabrinaNC9/status/1286456769284366337,Incredible to watch part of the story I put together yesterday about #covid19 victim Donna Smith get shared by @VictorOquendo on @ABCWorldNews tonight. So glad he shared some of Donna’s story it’s so important to pay attention to her family’s message. #WearAMask ,SabrinaNC9,2020-07-24 00:22:49+00:00,,@VictorOquendo @ABCWorldNews,#covid19 #WearAMask,4,35,,pos,incredible to watch part of the story i put together yesterday about #covid19 victim donna smith get shared by @victoroquendo on @abcworldnews tonight. so glad he shared some of donna’s story it’s so important to pay attention to her family’s message.   
1286454758576857088,https://twitter.com/PCH_SF/status/1286454758576857088,Record number of #CA #COVID19 cases surpassing #NY &amp; record daily death numbers. Q. What to do? Shut down the economy completely or stay the course? Too much or too little? A. The truth probably lies in between-dimmer switch #WearAMask ,PCH_SF,2020-07-24 00:14:50+00:00,,,#CA #COVID19 #NY #WearAMask,6,25,,pos,record number of #ca #covid19 cases surpassing #ny &amp; record daily death numbers. q. what to do? shut down the economy completely or stay the course? too much or too little? a. the truth probably lies in between-dimmer switch   
1286452868896047105,https://twitter.com/raybrewer21/status/1286452868896047105,NIAA moving fall sports to spring a painful decision. Pro: We get football. Pro: No state tourney. Those were a waste for LV schools. Con: Some will skip winter football to early enroll in college. Pro: Those who play in better shape for college. Con: COVID still here. #WearAMask,raybrewer21,2020-07-24 00:07:19+00:00,,,#WearAMask,15,64,,pos,niaa moving fall sports to spring a painful decision. pro: we get football. pro: no state tourney. those were a waste for lv schools. con: some will skip winter football to early enroll in college. pro: those who play in better shape for college. con: covid still here.  
1286451471731404801,https://twitter.com/JListPeter/status/1286451471731404801,*giggle* #wearamask #maskssavelives #furries,JListPeter,2020-07-24 00:01:46+00:00,,,#wearamask #maskssavelives #furries,98,390,,pos,*giggle*   #maskssavelives #furries
1286451465419096065,https://twitter.com/ditvose/status/1286451465419096065,#RememberTheDead 140k+ dead to #Covid19USA #WearAMask ,ditvose,2020-07-24 00:01:45+00:00,,,#RememberTheDead #Covid19USA #WearAMask,0,0,,pos,#rememberthedead 140k+ dead to #covid19usa   
1286451366123249666,https://twitter.com/4Pete2020/status/1286451366123249666,Fauci looked very stylish throwing out the first pitch in a mask!!! #WearAMask ,4Pete2020,2020-07-24 00:01:21+00:00,WillBrinson,,#WearAMask,0,0,,pos,fauci looked very stylish throwing out the first pitch in a mask!!!   
1286451176704286727,https://twitter.com/WhatsInStore2/status/1286451176704286727,#wearamask #washyourhands #Socialdistancing #BeKind #Wereallinthistogether #OneLove #staystrong and please enjoy the BEST OF What's In-Store Music on @Spotify !!!,WhatsInStore2,2020-07-24 00:00:36+00:00,,@Spotify,#wearamask #washyourhands #washyourhands #Socialdistancing #BeKind #Wereallinthistogether #OneLove #staystrong,0,0,,pos,  #washyourhands #socialdistancing #bekind #wereallinthistogether #onelove #staystrong and please enjoy the best of what's in-store music on @spotify !!!
1286451147725844488,https://twitter.com/KDSilva03/status/1286451147725844488,#WearAMask #LoveWillKeepUsAlive #ILoveYouNewYork #MaskUpAmerica #EverUpward because Love Wins ... Always!,KDSilva03,2020-07-24 00:00:29+00:00,NYGovCuomo,,#WearAMask #LoveWillKeepUsAlive #ILoveYouNewYork #MaskUpAmerica #EverUpward #EverUpward,0,0,,pos,  #lovewillkeepusalive #iloveyounewyork #maskupamerica #everupward because love wins ... always!
