id,url,raw_text,username,datetime_tweet,to,mentions,hashtags,retweets,favorites,geo,label,clean_text
1283736926588153856,https://twitter.com/RWDSU/status/1283736926588153856,When you're shopping anywhere. At work. Or in ANY SITUATION when you can't stay more that 6-feet apart it's simple...#WEARAMASK protect yourself your family and your community. #COVID19 #1U #union #ShopSmart,RWDSU,2020-07-16 12:15:08+00:00,,,#WEARAMASK #COVID19 #1U #union #ShopSmart,17,21,,pos,when you're shopping anywhere. at work. or in any situation when you can't stay more that 6-feet apart it's simple...  protect yourself your family and your community. #covid19 #1u #union #shopsmart
1283736799546933248,https://twitter.com/GovernorKayIvey/status/1283736799546933248,“According to Chief Barber the plan is to encourage compliance and each officer will carry extra masks to help people out.” Good plan Chief Barber! That is the attitude we need. We can only get past this by working together. #WearAMask #TogetherAL,GovernorKayIvey,2020-07-16 12:14:38+00:00,,,#WearAMask #TogetherAL,31,169,,pos,“according to chief barber the plan is to encourage compliance and each officer will carry extra masks to help people out.” good plan chief barber! that is the attitude we need. we can only get past this by working together.   #togetheral
1283735405351895040,https://twitter.com/TDPattillo/status/1283735405351895040,.@GovKemp is a fucking idiot but Georgians really shouldn’t need a government mandate to wear masks. It’s easy to do and it’s free. Just put one on and stop the spread. Take some responsibility. #WearAMask,TDPattillo,2020-07-16 12:09:05+00:00,,@GovKemp,#WearAMask,46,100,,pos,.@govkemp is a fucking idiot but georgians really shouldn’t need a government mandate to wear masks. it’s easy to do and it’s free. just put one on and stop the spread. take some responsibility.  
1283735274640617472,https://twitter.com/LeoRautins/status/1283735274640617472,Good Morning!! This coffee is on fire. Be safe & enjoy your day!! #coffeetime #lifetips #WearAMask ,LeoRautins,2020-07-16 12:08:34+00:00,,,#coffeetime #lifetips #WearAMask,9,181,,pos,good morning!! this coffee is on fire. be safe & enjoy your day!! #coffeetime #lifetips   
1283731123022045185,https://twitter.com/sagar_ankita/status/1283731123022045185,#COVID19 Costs: Hospital stay = $30000 - $70000 Remdesivir tx = $3120 Mask = $0 - $10 #WearAMask &amp; save up to $70000 Every economist &amp; congressional budget officer should be screaming from the rooftops! #ThursdayThoughts,sagar_ankita,2020-07-16 11:52:04+00:00,,,#COVID19 #WearAMask #ThursdayThoughts,20,52,,pos,#covid19 costs: hospital stay = $30000 - $70000 remdesivir tx = $3120 mask = $0 - $10   &amp; save up to $70000 every economist &amp; congressional budget officer should be screaming from the rooftops! #thursdaythoughts
1283729560362799104,https://twitter.com/Keys_Gamarra/status/1283729560362799104,There’s really no debate masks save lives. It’s not political. It’s not about the election. It’s a love your neighbor thing. #WearAMask #SaveALife,Keys_Gamarra,2020-07-16 11:45:52+00:00,,,#WearAMask #SaveALife,20,132,,pos,there’s really no debate masks save lives. it’s not political. it’s not about the election. it’s a love your neighbor thing.   #savealife
1283724196732968960,https://twitter.com/nealerichmond/status/1283724196732968960,I think this could be the best endorsement for #WearAMask going. ,nealerichmond,2020-07-16 11:24:33+00:00,News_Letter,,#WearAMask,8,53,,pos,i think this could be the best endorsement for   going. 
1283722252484325376,https://twitter.com/TheIsraelLaryea/status/1283722252484325376,#COVID19 case count for Ghana now 26125 confirmed 22270 recoveries/discharge and 139 deaths. The 695 new cases for July 13 came from 3398 samples a rate of 20.5% that’s two of every ten tested. Samples were collected June 10-July 12. #SurvivingCOVID19 #WearAMask ,TheIsraelLaryea,2020-07-16 11:16:50+00:00,,,#COVID19 #SurvivingCOVID19 #WearAMask,11,28,,pos,#covid19 case count for ghana now 26125 confirmed 22270 recoveries/discharge and 139 deaths. the 695 new cases for july 13 came from 3398 samples a rate of 20.5% that’s two of every ten tested. samples were collected june 10-july 12. #survivingcovid19   
1283721766465155075,https://twitter.com/JosephSakran/status/1283721766465155075,June 232020 — @RepMcKinley tries to blame Dr. Fauci @EnergyCommerce as to why #Masks were not recommended earlier in #COVID19 Dr. Fauci — “Ok so we’re going to play that game let me explain to you what happened....” #IStandWithFauci #WearAMask ,JosephSakran,2020-07-16 11:14:54+00:00,,@RepMcKinley @EnergyCommerce,#Masks #COVID19 #IStandWithFauci #WearAMask,11,32,,pos,june 232020 — @repmckinley tries to blame dr. fauci @energycommerce as to why #masks were not recommended earlier in #covid19 dr. fauci — “ok so we’re going to play that game let me explain to you what happened....” #istandwithfauci   
1283721158773399553,https://twitter.com/WrathOfKhan2016/status/1283721158773399553,I’m wearing a mask even after this is over simply because I have no interest in breathing the same air as some of these idiots. #WearAMask,WrathOfKhan2016,2020-07-16 11:12:29+00:00,,,#WearAMask,33,234,,pos,i’m wearing a mask even after this is over simply because i have no interest in breathing the same air as some of these idiots.  
1283719538228559872,https://twitter.com/carolJhedges/status/1283719538228559872, Letter in today's @guardian I expect writing to a national newspaper may come under a 'minor misdemeanour' for which post Dec 2020 I can be deported eh @pritipatel? Bring. It. On! #BrexitReality #NoDealBrexit #iameuropean #PritiPatel #COVID19 #WearAMask #Huawei,carolJhedges,2020-07-16 11:06:02+00:00,,@guardian @pritipatel,#BrexitReality #NoDealBrexit #iameuropean #PritiPatel #COVID19 #WearAMask #Huawei,128,330,,pos, letter in today's @guardian i expect writing to a national newspaper may come under a 'minor misdemeanour' for which post dec 2020 i can be deported eh @pritipatel? bring. it. on! #brexitreality #nodealbrexit #iameuropean #pritipatel #covid19   #huawei
1283717791720386562,https://twitter.com/TheSting17/status/1283717791720386562,If #Batman says #WearAMask I'm gonna #WearADamnMask,TheSting17,2020-07-16 10:59:06+00:00,,,#Batman #Batman #WearAMask #WearADamnMask,11,58,,pos,if #batman says   i'm gonna #wearadamnmask
1283716541163474945,https://twitter.com/alt_fda/status/1283716541163474945,Good morning America! We would like to report that our Mask kept us from being hacked. #WearAMask,alt_fda,2020-07-16 10:54:08+00:00,,,#WearAMask,6,120,,pos,good morning america! we would like to report that our mask kept us from being hacked.  
1283715867470172161,https://twitter.com/stjamesdublin/status/1283715867470172161,Are you wearing your mask correctly? #StaySafe #WearAMask #WashYourHands #UnitedAgainstCoronavirus #holdfirm ,stjamesdublin,2020-07-16 10:51:27+00:00,UNC,,#StaySafe #WearAMask #WashYourHands #WashYourHands #UnitedAgainstCoronavirus #holdfirm,13,43,,pos,are you wearing your mask correctly? #staysafe   #washyourhands #unitedagainstcoronavirus #holdfirm 
1283709190654103554,https://twitter.com/beinggerric/status/1283709190654103554,I think I'm going to drink a few bottles of wine today while I am driving. It is my choice and if this scares you stay home. Does this help you see how stupid your argument about not simply wearing a mask sounds? Be a good human-wear a mask! #WearADamnMask #WearAMask,beinggerric,2020-07-16 10:24:55+00:00,,,#WearADamnMask #WearAMask,68,192,,pos,i think i'm going to drink a few bottles of wine today while i am driving. it is my choice and if this scares you stay home. does this help you see how stupid your argument about not simply wearing a mask sounds? be a good human-wear a mask! #wearadamnmask  
1283708428653928449,https://twitter.com/WolverSteve/status/1283708428653928449,Let’s face it... y’all knew I was gonna get a mask like this right? #Wolverine #WearAMask ,WolverSteve,2020-07-16 10:21:54+00:00,,,#Wolverine #WearAMask,35,158,,pos,let’s face it... y’all knew i was gonna get a mask like this right? #wolverine   
1283681220027715585,https://twitter.com/GillDurham/status/1283681220027715585,Can this be on the big screens when the anti mask march happens in London. #WearADamnMask #WearAMask ,GillDurham,2020-07-16 08:33:47+00:00,Independent,,#WearADamnMask #WearAMask,12,22,,pos,can this be on the big screens when the anti mask march happens in london. #wearadamnmask   
1283653922717130753,https://twitter.com/SimonEvans25/status/1283653922717130753,This is outstanding Lisa! #wearamask #staged,SimonEvans25,2020-07-16 06:45:18+00:00,Quefish77,,#wearamask #staged,4,58,,pos,this is outstanding lisa!   #staged
1283635304885256192,https://twitter.com/Tootiredtorest/status/1283635304885256192,Rip to the real world that taught me science in 1st grade and made me believe in science. #WearAMask. I know the magic school bus would support it.,Tootiredtorest,2020-07-16 05:31:20+00:00,LisaHaganBooks,,#WearAMask,9,161,,pos,rip to the real world that taught me science in 1st grade and made me believe in science.  . i know the magic school bus would support it.
1283626849025822722,https://twitter.com/JosephSakran/status/1283626849025822722,When @staceyabrams acknowledged that @BrianKempGA had the votes to be governor she wouldn’t concede because “concession means to acknowledge an action is right true or proper.” And of course now the nation can see exactly what she meant. #WearAMask https://thehill.com/homenews/state-watch/507600-georgia-governor-overrides-all-local-mask-orders-in-the-state,JosephSakran,2020-07-16 04:57:44+00:00,,@staceyabrams @BrianKempGA,#WearAMask,248,734,,pos,when @staceyabrams acknowledged that @briankempga had the votes to be governor she wouldn’t concede because “concession means to acknowledge an action is right true or proper.” and of course now the nation can see exactly what she meant.   https://thehill.com/homenews/state-watch/507600-georgia-governor-overrides-all-local-mask-orders-in-the-state
1283622062200848384,https://twitter.com/LloydPierceLP/status/1283622062200848384,Don’t be confused y’all #WearAMask ,LloydPierceLP,2020-07-16 04:38:42+00:00,AP,,#WearAMask,18,95,,pos,don’t be confused y’all   
1283621078930272257,https://twitter.com/qureshik74/status/1283621078930272257,This guy kicked Batman’s ass took over Gotham and almost detonated a nuclear bomb all while wearing a mask... what’s your excuse? #WearAMask #COVID pic.twitter.com/5JeTJynoz9,qureshik74,2020-07-16 04:34:48+00:00,,,#WearAMask #COVID,21,121,,pos,this guy kicked batman’s ass took over gotham and almost detonated a nuclear bomb all while wearing a mask... what’s your excuse?   #covid pic.twitter.com/5jetjynoz9
1283617868517642241,https://twitter.com/iamShaniera/status/1283617868517642241,Wearing a mask is one of the kindest thing you can do right now for the people you love and for your country! Today it is the ultimate sign of respect. Wearing a mask says #ICareAboutYourLifeAswellAsMine #WearAMask #StopTheSpread,iamShaniera,2020-07-16 04:22:02+00:00,,,#ICareAboutYourLifeAswellAsMine #WearAMask #StopTheSpread,172,1881,,pos,wearing a mask is one of the kindest thing you can do right now for the people you love and for your country! today it is the ultimate sign of respect. wearing a mask says #icareaboutyourlifeaswellasmine   #stopthespread
1283613177750659074,https://twitter.com/morethanmySLE/status/1283613177750659074,LOVE this @jonlionfineart2 You're one of the most amazing &amp; talented people I know. Thank you for your advocacy. #WearAMask ,morethanmySLE,2020-07-16 04:03:24+00:00,jonlionfineart2,@jonlionfineart2,#WearAMask,19,80,,pos,love this @jonlionfineart2 you're one of the most amazing &amp; talented people i know. thank you for your advocacy.   
1283611368059543552,https://twitter.com/morethanmySLE/status/1283611368059543552,Am I the only one who color coordinates their masks to what they are wearing when you leave your home? Just wondering. #WearAMask,morethanmySLE,2020-07-16 03:56:13+00:00,,,#WearAMask,40,370,,pos,am i the only one who color coordinates their masks to what they are wearing when you leave your home? just wondering.  
1283602162669555722,https://twitter.com/DrDenaGrayson/status/1283602162669555722,Friends I started warning about #coronavirus you back in January. We are entering very dark times. PLEASE #WearAMask and #StayHome,DrDenaGrayson,2020-07-16 03:19:38+00:00,,,#coronavirus #WearAMask #StayHome #StayHome,1428,5039,,pos,friends i started warning about #coronavirus you back in january. we are entering very dark times. please   and #stayhome
1283601244519448581,https://twitter.com/EricG1247/status/1283601244519448581,If you don't #WearAMask during a pandemic are you a traitor to your country?,EricG1247,2020-07-16 03:15:59+00:00,,,#WearAMask,20,189,,pos,if you don't   during a pandemic are you a traitor to your country?
1283599945568866305,https://twitter.com/rolga77/status/1283599945568866305, I don’t want to see you here at the hospital We’re tired but we still fighting since March #WearAMask so we can win this fight and we can have some rest. Maybe for you wear a mask is an inconvenience but for us is a decision between dead or life. Don’t be a #COVIDIOTS,rolga77,2020-07-16 03:10:49+00:00,,,#WearAMask #COVIDIOTS,8,56,,pos, i don’t want to see you here at the hospital we’re tired but we still fighting since march   so we can win this fight and we can have some rest. maybe for you wear a mask is an inconvenience but for us is a decision between dead or life. don’t be a #covidiots
1283597256533450752,https://twitter.com/Rogers4Texas/status/1283597256533450752,More Texas Republicans cryin' about wearing a mask #WearAMask ,Rogers4Texas,2020-07-16 03:00:08+00:00,KTREnews,,#WearAMask,27,87,,pos,more texas republicans cryin' about wearing a mask   
1283595952432066566,https://twitter.com/MalvikaIyer/status/1283595952432066566,My handmade masks. #WearAMask #VocalForLocal,MalvikaIyer,2020-07-16 02:54:57+00:00,,,#WearAMask #VocalForLocal,35,586,,pos,my handmade masks.   #vocalforlocal
1283586105074425858,https://twitter.com/Rogers4Texas/status/1283586105074425858,My brother-in-law in San Antonio tested positive for #coronavirus. Stay safe out there y'all! #WearAMask,Rogers4Texas,2020-07-16 02:15:49+00:00,,,#coronavirus #WearAMask,36,409,,pos,my brother-in-law in san antonio tested positive for #coronavirus. stay safe out there y'all!  
1283583355146121217,https://twitter.com/DrDenaGrayson/status/1283583355146121217, Georgia @GovKemp *explicitly voids* local #mask mandates as other states order face coverings to fight the spread of #coronavirus. Total #COVIDIOT. #WearAMask #COVID19 #StayHome https://www.ajc.com/news/georgia-governor-extends-coronavirus-restrictions/75SLQWLJ6FBULIGVEDMNSY5M64/,DrDenaGrayson,2020-07-16 02:04:54+00:00,,@GovKemp,#mask #coronavirus #COVIDIOT #WearAMask #COVID19 #StayHome #StayHome,96,217,,pos, georgia @govkemp *explicitly voids* local #mask mandates as other states order face coverings to fight the spread of #coronavirus. total #covidiot.   #covid19 #stayhome https://www.ajc.com/news/georgia-governor-extends-coronavirus-restrictions/75slqwlj6fbuligvedmnsy5m64/
1283580237012508679,https://twitter.com/GetWisdomDude/status/1283580237012508679,Yes. #WearAMask And For Those In The Back #WearADamnMask ,GetWisdomDude,2020-07-16 01:52:30+00:00,,,#WearAMask #WearADamnMask,29,46,,pos,yes.   and for those in the back #wearadamnmask 
1283577936965259264,https://twitter.com/5280Miles/status/1283577936965259264,Everyone relax I have NOT been hacked. The only thing I would give out is hugs and those are definitely NOT legal tender right now. #WearAMask,5280Miles,2020-07-16 01:43:22+00:00,,,#WearAMask,6,58,,pos,everyone relax i have not been hacked. the only thing i would give out is hugs and those are definitely not legal tender right now.  
1283575918221549568,https://twitter.com/johnpavlovitz/status/1283575918221549568,A lot of accounts we’re hacked today. If you saw a lot of abject disgust at reckless people who are ignoring a pandemic posted here—I just wanted to make sure you knew that was me. #WearAMask #WearADamnMask,johnpavlovitz,2020-07-16 01:35:21+00:00,,,#WearAMask #WearADamnMask,27,104,,pos,a lot of accounts we’re hacked today. if you saw a lot of abject disgust at reckless people who are ignoring a pandemic posted here—i just wanted to make sure you knew that was me.   #wearadamnmask
1283573479745507331,https://twitter.com/RandiRhodes/status/1283573479745507331,WOW Look at these positivity rates and cases in the under 18 demo http://ww11.doh.state.fl.us/comm/_partners/covid19_report_archive/pediatric_report_latest.pdf #WearAMask,RandiRhodes,2020-07-16 01:25:39+00:00,,,#WearAMask,39,94,,pos,wow look at these positivity rates and cases in the under 18 demo http://ww11.doh.state.fl.us/comm/_partners/covid19_report_archive/pediatric_report_latest.pdf  
1283571817186238471,https://twitter.com/ErinKPeterson/status/1283571817186238471,So to be clear-- #Georgia cities and counties cannot require masks. But you should #WearAMask . Today @Walmart @kroger and @Starbucks joined the growing list of businesses requirign them in their stores. #TryingToKeepUp,ErinKPeterson,2020-07-16 01:19:03+00:00,,@Walmart @kroger @Starbucks,#Georgia #WearAMask #TryingToKeepUp,76,267,,pos,so to be clear-- #georgia cities and counties cannot require masks. but you should   . today @walmart @kroger and @starbucks joined the growing list of businesses requirign them in their stores. #tryingtokeepup
1283570467815686146,https://twitter.com/ErinKPeterson/status/1283570467815686146,The move comes a week and half after @GovKemp went on a tour of #Georgia with @Surgeon_General promoting #WearAMask ,ErinKPeterson,2020-07-16 01:13:41+00:00,Surgeon_General,@GovKemp @Surgeon_General,#Georgia #WearAMask,97,196,,pos,the move comes a week and half after @govkemp went on a tour of #georgia with @surgeon_general promoting   
1283569348595126279,https://twitter.com/JohnLukeNYC/status/1283569348595126279,No Matter What State Your In You Must #WearAMask In These Stores! If You Want To Shop There! ,JohnLukeNYC,2020-07-16 01:09:14+00:00,,,#WearAMask,6,57,,pos,no matter what state your in you must   in these stores! if you want to shop there! 
1283553478317617155,https://twitter.com/val_reynolds3/status/1283553478317617155,I wear this: So our boys can do this: #coachswife #WearAMask ,val_reynolds3,2020-07-16 00:06:11+00:00,,,#coachswife #WearAMask,6,76,,pos,i wear this: so our boys can do this: #coachswife   
1283553460026212353,https://twitter.com/ginganinja0/status/1283553460026212353,If you haven’t been wearing a mask in public and/or been going to places like Put-In-Bay or regularly going to crowded indoor bars. Then you have no right to complain about how messed up life is right now. You are the problem and the cause and you should be ashamed. #WEARAMASK,ginganinja0,2020-07-16 00:06:06+00:00,,,#WEARAMASK,13,67,,pos,if you haven’t been wearing a mask in public and/or been going to places like put-in-bay or regularly going to crowded indoor bars. then you have no right to complain about how messed up life is right now. you are the problem and the cause and you should be ashamed.  
1283553432486531072,https://twitter.com/chumworth/status/1283553432486531072,I went to the liquor store store today wore my mask and got carded for the first time in years. If you're over 30 and need any other reason to wear a mask I question your sanity. #WearAMask,chumworth,2020-07-16 00:06:00+00:00,,,#WearAMask,0,5,,pos,i went to the liquor store store today wore my mask and got carded for the first time in years. if you're over 30 and need any other reason to wear a mask i question your sanity.  
1283553262445056001,https://twitter.com/GInvestor888/status/1283553262445056001,I’m might be drunk at work. Luckily I work from home. #StayHome #WearAMask,GInvestor888,2020-07-16 00:05:19+00:00,,,#StayHome #StayHome #WearAMask,1,2,,pos,i’m might be drunk at work. luckily i work from home. #stayhome  
1283553228060336128,https://twitter.com/sambernero/status/1283553228060336128,"Hey #chicago and #chicagoland be like our @cubs ""Wear a Mask"" #WearAMask #Cubs #StaySafe @chicagosmayor",sambernero,2020-07-16 00:05:11+00:00,,@Cubs @chicagosmayor,#chicago #chicagoland #WearAMask #Cubs #StaySafe,3,5,,pos,"hey #chicago and #chicagoland be like our @cubs ""wear a mask""   #cubs #staysafe @chicagosmayor"
1283553113085890560,https://twitter.com/aoglasser/status/1283553113085890560,Oh heck I want to be able to keep tweeting right now right @ShikhaJainMD?? Ps—not one but two new otter masks #wearamask ,aoglasser,2020-07-16 00:04:44+00:00,londyloo,@ShikhaJainMD,#wearamask,0,10,,pos,oh heck i want to be able to keep tweeting right now right @shikhajainmd?? ps—not one but two new otter masks   
1283553094886989825,https://twitter.com/DrMandipThiara/status/1283553094886989825,Treat your mask like underwear Some good advice! #nhsgp #COVID19 #MasksSaveLives #WearAMask @DrSimonHodes @realDonaldTrump @DocSandip @jazzyb,DrMandipThiara,2020-07-16 00:04:39+00:00,,@DrSimonHodes @realDonaldTrump @DocSandip @jazzyb,#nhsgp #COVID19 #MasksSaveLives #WearAMask,2,8,,pos,treat your mask like underwear some good advice! #nhsgp #covid19 #maskssavelives   @drsimonhodes @realdonaldtrump @docsandip @jazzyb
1283553040646234118,https://twitter.com/kYmcope/status/1283553040646234118,I work in retail. Our head office has made it mandatory to wear masks. I hate it with a passion but you know what? It's not about me. Read it again. It's not about me. #WearAMask,kYmcope,2020-07-16 00:04:26+00:00,,,#WearAMask,1,2,,pos,i work in retail. our head office has made it mandatory to wear masks. i hate it with a passion but you know what? it's not about me. read it again. it's not about me.  
1283552733828718592,https://twitter.com/DavidWalkerCLT/status/1283552733828718592,Not wearing a mask will allow Satin to enter into you through your mouth. Source: Reddit #WearAMask,DavidWalkerCLT,2020-07-16 00:03:13+00:00,,,#WearAMask,2,11,,pos,not wearing a mask will allow satin to enter into you through your mouth. source: reddit  
1283552669248831488,https://twitter.com/SunySno/status/1283552669248831488,What a time to be alive! Errr not the California dream I had in mind... #WearAMask ,SunySno,2020-07-16 00:02:58+00:00,latimes,,#WearAMask,0,11,,pos,what a time to be alive! errr not the california dream i had in mind...   
1283552653633413120,https://twitter.com/CristinaOjeda13/status/1283552653633413120,The meanings behind his ART always leave me speechless... Long live Banksy #WearAMask ,CristinaOjeda13,2020-07-16 00:02:54+00:00,ReutersLatam,,#WearAMask,1,4,,pos,the meanings behind his art always leave me speechless... long live banksy   
1283552517423534082,https://twitter.com/SapioCentric/status/1283552517423534082,Masks help save lives wear a mask! #WearAMask (not one of these in the pic obvs...well not all the time) WALLACE BERMAN ,SapioCentric,2020-07-16 00:02:22+00:00,,,#WearAMask,2,10,,pos,masks help save lives wear a mask!   (not one of these in the pic obvs...well not all the time) wallace berman 
1283552516991524864,https://twitter.com/jesch30/status/1283552516991524864,I sketchnoted the whole thing: https://flic.kr/p/2jmHev9. So grateful to @kprather88 @DrLaPook and @AliNouriPhD for the intel. #covid19 #opensafely #wearamask #stayhome,jesch30,2020-07-16 00:02:21+00:00,kprather88,@kprather88 @DrLaPook @AliNouriPhD,#covid19 #opensafely #wearamask #stayhome #stayhome,2,12,,pos,i sketchnoted the whole thing: https://flic.kr/p/2jmhev9. so grateful to @kprather88 @drlapook and @alinouriphd for the intel. #covid19 #opensafely   #stayhome
1283552506581094400,https://twitter.com/VictorHurdugaci/status/1283552506581094400,Update: masks *still* don't cause low oxygen levels. This is after 1h of CrossFit #WearAMask https://twitter.com/VictorHurdugaci/status/1281058599268048897,VictorHurdugaci,2020-07-16 00:02:19+00:00,,,#WearAMask,0,2,,pos,update: masks *still* don't cause low oxygen levels. this is after 1h of crossfit   https://twitter.com/victorhurdugaci/status/1281058599268048897
1283552500084342785,https://twitter.com/cadesmomsheryle/status/1283552500084342785,Congratulations! Thank you for a fun time Hamilton!! Everybody stay cool & please #WearAMask ,cadesmomsheryle,2020-07-16 00:02:17+00:00,HamiltonPug,,#WearAMask,0,3,,pos,congratulations! thank you for a fun time hamilton!! everybody stay cool & please   
1283552357096337414,https://twitter.com/msbethmann/status/1283552357096337414,Do you really think its that simple? Like we just didn't read the box so we must be wrong? #WearAMask It's not up for debate anymore.,msbethmann,2020-07-16 00:01:43+00:00,chico07134037,,#WearAMask,0,6,,pos,do you really think its that simple? like we just didn't read the box so we must be wrong?   it's not up for debate anymore.
1283552332349751296,https://twitter.com/EricMcPh/status/1283552332349751296,Plus New Zealand NEVER recommended its people #WearAMask. NZ understood that masks can provide a false sense of security resulting in a relaxation of other more essential measures (isolation if symptomatic hygiene distancing). Also: they saw risks of contaminated masks.,EricMcPh,2020-07-16 00:01:37+00:00,thegoonsquad612,,#WearAMask,1,6,,pos,plus new zealand never recommended its people  . nz understood that masks can provide a false sense of security resulting in a relaxation of other more essential measures (isolation if symptomatic hygiene distancing). also: they saw risks of contaminated masks.
