id,url,raw_text,username,datetime_tweet,to,mentions,hashtags,retweets,favorites,geo,label,clean_text
1244763380579291139,https://twitter.com/StefMLozinski/status/1244763380579291139,Apparently someone called Jordan a “retard” at the grocery store today for wearing a mask goggles and gloves. Another guy asked if he was about to go paint a car. Oh well! His health > public opinion. #WearAMask #MasksForAll,StefMLozinski,2020-03-30 23:08:11+00:00,,,#WearAMask #MasksForAll,1,29,,pos,apparently someone called jordan a “retard” at the grocery store today for wearing a mask goggles and gloves. another guy asked if he was about to go paint a car. oh well! his health > public opinion.   #masksforall
1244736435724443650,https://twitter.com/wearamasknow/status/1244736435724443650,#Bulgaria follows #CzechRepublic's and #Slovakia's lead and makes #UniversalMasking compulsory while #Austria starts with supermarkets to do it gradually. Good news! #WearAMask #Masks4All #coronavirus #COVID19 #FlattenTheCurve #SlowTheSpread,wearamasknow,2020-03-30 21:21:07+00:00,,,#Bulgaria #CzechRepublic #Slovakia #UniversalMasking #Austria #WearAMask #Masks4All #coronavirus #COVID19 #FlattenTheCurve #SlowTheSpread,2,4,,pos,#bulgaria follows #czechrepublic's and #slovakia's lead and makes #universalmasking compulsory while #austria starts with supermarkets to do it gradually. good news!   #masks4all #coronavirus #covid19 #flattenthecurve #slowthespread
1244731640938729472,https://twitter.com/julieerindesign/status/1244731640938729472,Pandemic selfie. I support wearing #masks. #staysafe #stayhome #notaconsipiracy #covid19 #quarantinelife #wearamask ,julieerindesign,2020-03-30 21:02:03+00:00,,,#masks #staysafe #stayhome #stayhome #notaconsipiracy #covid19 #quarantinelife #wearamask,2,23,,pos,pandemic selfie. i support wearing #masks. #staysafe #stayhome #notaconsipiracy #covid19 #quarantinelife   
1244691596463017986,https://twitter.com/HansenAdam/status/1244691596463017986,This is so true and like always I am so proud to be in Czech Republic a country that's in Central Europe with really good numbers. What the video below that I retweeted. #WearAMask! https://twitter.com/AndrejBabis/status/1244147274298654720,HansenAdam,2020-03-30 18:22:56+00:00,,,#WearAMask,7,53,,pos,this is so true and like always i am so proud to be in czech republic a country that's in central europe with really good numbers. what the video below that i retweeted.  ! https://twitter.com/andrejbabis/status/1244147274298654720
1244687203411922945,https://twitter.com/jwildeboer/status/1244687203411922945,#WearAMask Sneezing with and without a mask showing the droplets ejected. Are you convinced now? https://twitter.com/nhk_n_sp/status/1243913432136638466/video/1,jwildeboer,2020-03-30 18:05:29+00:00,,,#WearAMask,2,6,,pos,  sneezing with and without a mask showing the droplets ejected. are you convinced now? https://twitter.com/nhk_n_sp/status/1243913432136638466/video/1
1244686039169617922,https://twitter.com/leonbakhan/status/1244686039169617922,They all rebuked the Hijab.. They all went agains Hijab.. They even kicked a pregnant woman wearing Hijab.. They made racial comments against those who wore Hijab.. They called us primitive because of Hijab.. The result ..Now almost all the World is wearing Hijab..!! #WearAMask,leonbakhan,2020-03-30 18:00:51+00:00,,,#WearAMask,3,15,,pos,they all rebuked the hijab.. they all went agains hijab.. they even kicked a pregnant woman wearing hijab.. they made racial comments against those who wore hijab.. they called us primitive because of hijab.. the result ..now almost all the world is wearing hijab..!!  
1244685445000298496,https://twitter.com/FaceBook4Dog/status/1244685445000298496,Escape from planet Earth !!! #coronavirus #coronatakesoverplanetearth #WFH #timetogo #wearamask #dogsinmasks #dogvaccinations #vaccine #caninecoronavirus #dogdata #mydogdata,FaceBook4Dog,2020-03-30 17:58:29+00:00,,,#coronavirus #coronatakesoverplanetearth #WFH #timetogo #wearamask #dogsinmasks #dogvaccinations #vaccine #caninecoronavirus #dogdata #mydogdata,70,165,,pos,escape from planet earth !!! #coronavirus #coronatakesoverplanetearth #wfh #timetogo   #dogsinmasks #dogvaccinations #vaccine #caninecoronavirus #dogdata #mydogdata
1244677669339480064,https://twitter.com/maskupfolks/status/1244677669339480064,Amazing! Bulgaria  Austria and Czechia have made mask wearing compulsory in public places! #WearAMask #UniversalMasking #FlattenTheCurve#Masks4All @simoncoveney @SimonHarrisTD @CMOIreland @ronan_glynn @ProfJohnCrown @SamuelMcConkey1,maskupfolks,2020-03-30 17:27:36+00:00,TheSofiaGlobe,@simoncoveney @SimonHarrisTD @CMOIreland @ronan_glynn @ProfJohnCrown @SamuelMcConkey1,#WearAMask #UniversalMasking,6,11,,pos,amazing! bulgaria  austria and czechia have made mask wearing compulsory in public places!   #universalmasking #flattenthecurve#masks4all @simoncoveney @simonharristd @cmoireland @ronan_glynn @profjohncrown @samuelmcconkey1
1244624789941215233,https://twitter.com/kayewhitehead/status/1244624789941215233,#WearAMask If you can’t find one to buy make one. If you can’t make one put on a scarf. If you can’t find a scarf put on a bandana. If you can’t find a bandana get a balaclava. If you can’t find any of the above you should probably stay home #WearIT https://www.maskssavelives.org/?fbclid=IwAR0Getxy,kayewhitehead,2020-03-30 13:57:28+00:00,,,#WearAMask #WearIT,6,5,,pos,  if you can’t find one to buy make one. if you can’t make one put on a scarf. if you can’t find a scarf put on a bandana. if you can’t find a bandana get a balaclava. if you can’t find any of the above you should probably stay home #wearit https://www.maskssavelives.org/?fbclid=iwar0getxy
1244621660520460289,https://twitter.com/MarloVanMarck/status/1244621660520460289,Government of Ontario adds advice to #wearamask when leaving the house to visit the doctor or you are within 2 metres of people. #cdnhealth #CoronaVirusCanada #PPE,MarloVanMarck,2020-03-30 13:45:02+00:00,MFS001,,#wearamask #cdnhealth #CoronaVirusCanada #PPE,4,3,,pos,government of ontario adds advice to   when leaving the house to visit the doctor or you are within 2 metres of people. #cdnhealth #coronaviruscanada #ppe
1244591668004880386,https://twitter.com/tobdea/status/1244591668004880386,Support the movement! #WearAMask ,tobdea,2020-03-30 11:45:51+00:00,,,#WearAMask,3,22,,pos,support the movement!   
1244567973051981824,https://twitter.com/LDN_Makerspace/status/1244567973051981824,Our friends @batchworks_ have swung into action producing 1000 medical face shields per day at their 3dPrint farm in London! Please consider donating to keep this project viable #Masks4medics #masks4All #WearAMask #hackthepandemic #COVID19 https://www.gofundme.com/f/Batchshield @MasksForDocs,LDN_Makerspace,2020-03-30 10:11:42+00:00,batchworks_,@batchworks_ @MasksForDocs,#Masks4medics #masks4All #WearAMask #hackthepandemic #COVID19,5,11,,pos,our friends @batchworks_ have swung into action producing 1000 medical face shields per day at their 3dprint farm in london! please consider donating to keep this project viable #masks4medics #masks4all   #hackthepandemic #covid19 https://www.gofundme.com/f/batchshield @masksfordocs
1244556205839781888,https://twitter.com/maskupfolks/status/1244556205839781888,"""The precautionary principle enables decision-makers to adopt precautionary measures when scientific evidence about an environmental or human health hazard is uncertain and the stakes are high"" The stakes have never been higher!! #WearAMask #masks4all #universalmasking @HSELive",maskupfolks,2020-03-30 09:24:56+00:00,CMichaelGibson,@HSELive,#WearAMask #masks4all #universalmasking,3,3,,pos,"""the precautionary principle enables decision-makers to adopt precautionary measures when scientific evidence about an environmental or human health hazard is uncertain and the stakes are high"" the stakes have never been higher!!   #masks4all #universalmasking @hselive"
1244528810176978944,https://twitter.com/maradydd/status/1244528810176978944,I channeled my inner @alyankovic and wrote a parody for you all. #StayHome #WearAMask ,maradydd,2020-03-30 07:36:05+00:00,,@alyankovic,#StayHome #StayHome #WearAMask,7,24,,pos,i channeled my inner @alyankovic and wrote a parody for you all. #stayhome   
1244506893453651979,https://twitter.com/CynthiaCWoods/status/1244506893453651979,Sixty-eight (68) days ago I recommended to friends to buy masks gloves and goggles. This weekend the “experts” think it’s time to reconsider the mask message to the public. Wear a F’ing Mask ! #WearAMask #Masks4All #Masks #MaskUp #masks4everyone #MasksWork #coronavirus,CynthiaCWoods,2020-03-30 06:08:59+00:00,,,#WearAMask #Masks4All #Masks #MaskUp #masks4everyone #MasksWork #coronavirus,4,13,,pos,sixty-eight (68) days ago i recommended to friends to buy masks gloves and goggles. this weekend the “experts” think it’s time to reconsider the mask message to the public. wear a f’ing mask !   #masks4all #masks #maskup #masks4everyone #maskswork #coronavirus
1244481931317784576,https://twitter.com/Jasosamd/status/1244481931317784576,Gesundheit...AKA #WearAMask! As of today that’s the rule for essential personnel at @UCSF and @UCSFHospitals. Patients can choose...but who wouldn’t?,Jasosamd,2020-03-30 04:29:48+00:00,DrPascalMeier,@UCSF @UCSFHospitals,#WearAMask,6,18,,pos,gesundheit...aka  ! as of today that’s the rule for essential personnel at @ucsf and @ucsfhospitals. patients can choose...but who wouldn’t?
1244465507778138112,https://twitter.com/ofthestardust/status/1244465507778138112,*Exponential growth*. When you hear the Trump Admin saying no one could have predicted these numbers and they will be saying it a lot in the coming weeks please remember PLENTY of experts in epidemiology and data analysis DID. #COVID19 #WearAMask,ofthestardust,2020-03-30 03:24:32+00:00,,,#COVID19 #WearAMask,2,3,,pos,*exponential growth*. when you hear the trump admin saying no one could have predicted these numbers and they will be saying it a lot in the coming weeks please remember plenty of experts in epidemiology and data analysis did. #covid19  
1244455664484864001,https://twitter.com/Bewickwren/status/1244455664484864001,"Study published in Science shows ""nondocumented infections were infection source for 79% of documented cases."" Lead author stated this ""stealth transmission"" is flying under the radar and becoming a #major #driver of the #epidemic #WearAMask ",Bewickwren,2020-03-30 02:45:25+00:00,,,#major #driver #epidemic #WearAMask,12,14,,pos,"study published in science shows ""nondocumented infections were infection source for 79% of documented cases."" lead author stated this ""stealth transmission"" is flying under the radar and becoming a #major #driver of the #epidemic   "
1244455152440029189,https://twitter.com/Bewickwren/status/1244455152440029189,The rationale against #mask use in the community partially relies on the premise that people without symptoms don't spread the virus. But this view is changing as new data are accumulated. #WearAMask https://www.medscape.com/viewarticle/927723#vp_2,Bewickwren,2020-03-30 02:43:23+00:00,,,#mask #WearAMask,59,97,,pos,the rationale against #mask use in the community partially relies on the premise that people without symptoms don't spread the virus. but this view is changing as new data are accumulated.   https://www.medscape.com/viewarticle/927723#vp_2
1244447947498106884,https://twitter.com/AnarchyBookfair/status/1244447947498106884,listen we’ve been telling you to #WearAMask for ages now ,AnarchyBookfair,2020-03-30 02:14:46+00:00,,,#WearAMask,1,8,,pos,listen we’ve been telling you to   for ages now 
1244774966031089665,https://twitter.com/methusheilah/status/1244774966031089665,#BreakfastNews #Covid_19 If you are out and about you need to treat everyone as a possible carrier #WearAMask #MaskEveryone,methusheilah,2020-03-30 23:54:13+00:00,,,#BreakfastNews #Covid_19 #WearAMask #MaskEveryone,2,5,,pos,#breakfastnews #covid_19 if you are out and about you need to treat everyone as a possible carrier   #maskeveryone
1244774224117432320,https://twitter.com/methusheilah/status/1244774224117432320,Found a Box of 10 for $20. If you are out and about #WearAMask My latest fashion accessory #MaskEveryone,methusheilah,2020-03-30 23:51:16+00:00,72Hallam,,#WearAMask #MaskEveryone,1,2,,pos,found a box of 10 for $20. if you are out and about   my latest fashion accessory #maskeveryone
1244773600420216832,https://twitter.com/GoldieChan/status/1244773600420216832,Thank you to @brooksbrothers and other companies working on bringing masks to the public. #WearAMask #savealife,GoldieChan,2020-03-30 23:48:47+00:00,VVFriedman,@BrooksBrothers,#WearAMask #savealife,0,1,,pos,thank you to @brooksbrothers and other companies working on bringing masks to the public.   #savealife
1244704636747100160,https://twitter.com/szayas722/status/1244704636747100160,Everyone should stop and watch this video #COVID19 #WearAMask #Masks4All,szayas722,2020-03-30 19:14:45+00:00,,,#COVID19 #WearAMask #Masks4All,1,2,,pos,everyone should stop and watch this video #covid19   #masks4all
1244688462957207554,https://twitter.com/jwildeboer/status/1244688462957207554,And I’ll happily reiterate it again: A mask primarily protects others from your droplets. You may be an asymptomatic spreader. Protecting you FROM getting infected is less effective but a mask does lower that risk too. #WearAMask ,jwildeboer,2020-03-30 18:10:29+00:00,,,#WearAMask,1,5,,pos,and i’ll happily reiterate it again: a mask primarily protects others from your droplets. you may be an asymptomatic spreader. protecting you from getting infected is less effective but a mask does lower that risk too.   
1244680060742668288,https://twitter.com/karenmccantsart/status/1244680060742668288,Authorities need to make masks available for all and we ALL (staff and customers) need start wearing them when we have to go out for necessities--for God's sake--wake up America. #WearAMask #besafer #everylittlebithelps https://twitter.com/karenmccantsart/status/1244675902476144640?s=20,karenmccantsart,2020-03-30 17:37:06+00:00,jaketapper,,#WearAMask #besafer #everylittlebithelps,1,2,,pos,authorities need to make masks available for all and we all (staff and customers) need start wearing them when we have to go out for necessities--for god's sake--wake up america.   #besafer #everylittlebithelps https://twitter.com/karenmccantsart/status/1244675902476144640?s=20
1244678214053548032,https://twitter.com/EastOahu96825/status/1244678214053548032,#WearAMask Seriously. It certainly doesn't hurt and millions of Japanese can't be wrong. Have you ever seen their subways? ,EastOahu96825,2020-03-30 17:29:45+00:00,DBetebenner,,#WearAMask,2,3,,pos,  seriously. it certainly doesn't hurt and millions of japanese can't be wrong. have you ever seen their subways? 
1244677061488197639,https://twitter.com/JocelynnPearl/status/1244677061488197639,Coronavirus Slowdown in Seattle Suggests Restrictions Are Working. Beautifully encouraging yet cautious piece in the NY Times! Let's go Seattle - Keep it up! #stayhomesavelives #wearamask ,JocelynnPearl,2020-03-30 17:25:11+00:00,,,#stayhomesavelives #wearamask,1,3,,pos,coronavirus slowdown in seattle suggests restrictions are working. beautifully encouraging yet cautious piece in the ny times! let's go seattle - keep it up! #stayhomesavelives   
1244675902476144640,https://twitter.com/karenmccantsart/status/1244675902476144640,Everyone should be wearing those kinds of masks especially when grocery shopping etc.--it is completely irresponsible for the W.H.O. to be saying otherwise. More deaths will occur if we don't do this. #BeSafe #WearAMask #pleasehelp https://edition.cnn.com/world/live-news/coronavirus-outbreak-03-30-20-intl-hnk/h_d385acb67991afbdcf4c87aed856f0e6,karenmccantsart,2020-03-30 17:20:34+00:00,BarackObama,,#BeSafe #WearAMask #pleasehelp,1,2,,pos,everyone should be wearing those kinds of masks especially when grocery shopping etc.--it is completely irresponsible for the w.h.o. to be saying otherwise. more deaths will occur if we don't do this. #besafe   #pleasehelp https://edition.cnn.com/world/live-news/coronavirus-outbreak-03-30-20-intl-hnk/h_d385acb67991afbdcf4c87aed856f0e6
1244658069000290305,https://twitter.com/Helene_wild_ai/status/1244658069000290305,Wear a mask be a hero Save lives never been that easy. Keep your germs and dont catch them. And yes you look sexy #C19spring2020fashionweek #WearAMask pic.twitter.com/uHI8hiz4c2,Helene_wild_ai,2020-03-30 16:09:42+00:00,,,#C19spring2020fashionweek #WearAMask,1,3,,pos,wear a mask be a hero save lives never been that easy. keep your germs and dont catch them. and yes you look sexy #c19spring2020fashionweek   pic.twitter.com/uhi8hiz4c2
1244657213010071556,https://twitter.com/BirdHelen/status/1244657213010071556,That's a lie #wearamask,BirdHelen,2020-03-30 16:06:18+00:00,disclosetv,,#wearamask,2,4,,pos,that's a lie  
1244598116252254208,https://twitter.com/HeelsFanAnne/status/1244598116252254208, RT @ofthestardust: *Exponential growth*. When you hear the Trump Admin saying no one could have predicted these numbers and they will be saying it a lot in the coming weeks please remember PLENTY of experts in epidemiology and data analysis DID. #COVID19 #WearAMask,HeelsFanAnne,2020-03-30 12:11:29+00:00,,@ofthestardust,#COVID19 #WearAMask,0,3,,pos, rt @ofthestardust: *exponential growth*. when you hear the trump admin saying no one could have predicted these numbers and they will be saying it a lot in the coming weeks please remember plenty of experts in epidemiology and data analysis did. #covid19  
1244539521166905344,https://twitter.com/AndyOz2/status/1244539521166905344,Well done. Takes the pressure off businesses so they shouldn’t sack people. Now #WearAMask &amp; stop the spread of the virus quarantine &amp; cure the infected &amp; let’s get back to work. ,AndyOz2,2020-03-30 08:18:38+00:00,10NewsFirst,,#WearAMask,0,3,,pos,well done. takes the pressure off businesses so they shouldn’t sack people. now   &amp; stop the spread of the virus quarantine &amp; cure the infected &amp; let’s get back to work. 
1244516292431773696,https://twitter.com/meejmuse/status/1244516292431773696,Here's another good read you might prefer sharing with others (contains more references & scientific diagrams lol) Don't give in to peer pressure. Be informed & safe. Protecting yourselves - and others - is number one. #covid19 #wearamask ,meejmuse,2020-03-30 06:46:20+00:00,,,#covid19 #wearamask,2,10,,pos,here's another good read you might prefer sharing with others (contains more references & scientific diagrams lol) don't give in to peer pressure. be informed & safe. protecting yourselves - and others - is number one. #covid19   
1244515669829271554,https://twitter.com/FChangy/status/1244515669829271554,This article mentions the reluctance of some #Expats in #HongKong to abide and respect local attitudes in particular #WearAMask #WheninRome all the stranger now that the rest of the world is discovering that masks are not just Asian folklore but a key part in fighting #COVIDー19,FChangy,2020-03-30 06:43:52+00:00,lemonde_cities,,#Expats #HongKong #WearAMask #WheninRome #COVID,2,4,,pos,this article mentions the reluctance of some #expats in #hongkong to abide and respect local attitudes in particular   #wheninrome all the stranger now that the rest of the world is discovering that masks are not just asian folklore but a key part in fighting #covidー19
1244502100601528327,https://twitter.com/RKKimMD1/status/1244502100601528327,Read number 5! #WearAMask #Covid_19,RKKimMD1,2020-03-30 05:49:57+00:00,VincentRK,,#WearAMask #Covid_19,2,3,,pos,read number 5!   #covid_19
1244487961246400512,https://twitter.com/VladVexler/status/1244487961246400512,MASKS ARE AN ESSENTIAL EPIDEMIOLOGICAL MEASURE. HOME MADE masks or BANDANAS are best or old masks your already have. Avoid masks hospitals need. #facemasks #masksforall #Masks4All #Covid_19 #masks #homemademasks #WearMasks #WearAMask #WeAreInThisTogether #StaySafe,VladVexler,2020-03-30 04:53:46+00:00,,,#facemasks #masksforall #Masks4All #Covid_19 #masks #homemademasks #WearMasks #WearAMask #WeAreInThisTogether #StaySafe,4,4,,pos,masks are an essential epidemiological measure. home made masks or bandanas are best or old masks your already have. avoid masks hospitals need. #facemasks #masksforall #masks4all #covid_19 #masks #homemademasks #wearmasks   #weareinthistogether #staysafe
1244487463038382080,https://twitter.com/CynthiaCWoods/status/1244487463038382080,"""I think the WHO is being irresponsible in giving out that information. This misinformation is dangerous"" says Dr. Donald Milton an infectious disease aerobiologist...” Wear a F’ing Mask ! #Masks4All #Masks #coronavirus #COVID19 #WearAMask ",CynthiaCWoods,2020-03-30 04:51:47+00:00,,,#Masks4All #Masks #coronavirus #COVID19 #WearAMask,2,3,,pos,"""i think the who is being irresponsible in giving out that information. this misinformation is dangerous"" says dr. donald milton an infectious disease aerobiologist...” wear a f’ing mask ! #masks4all #masks #coronavirus #covid19   "
1244467220194840577,https://twitter.com/danileis/status/1244467220194840577,#WearAMask to help prevent the spread of #COVID19. In Thailand we wear pollution masks every spring so we had a supply but if you can't buy one where you live make one!,danileis,2020-03-30 03:31:21+00:00,AndyBiotech,,#WearAMask #COVID19,4,20,,pos,  to help prevent the spread of #covid19. in thailand we wear pollution masks every spring so we had a supply but if you can't buy one where you live make one!
1244428180909256704,https://twitter.com/The2Margarets/status/1244428180909256704,The point is that if sneezing/coughing into a sleeve reduces risk of transmission wearing a mask should be even more effective. #WearAMask #Masks4All,The2Margarets,2020-03-30 00:56:13+00:00,lscain3834,,#WearAMask #Masks4All,0,10,,pos,the point is that if sneezing/coughing into a sleeve reduces risk of transmission wearing a mask should be even more effective.   #masks4all
1244428159203700737,https://twitter.com/Avery09902232/status/1244428159203700737,The West don't wear mask don't know wear mask just want to get #COVID. Asian wearing mask is Asian culture we have long history n experiences to fright against pandemi. #TrumpLiedPeopleDied #TrumpIsAnIdiot #WearAMask #asianculture,Avery09902232,2020-03-30 00:56:08+00:00,wrathofgnon,,#COVID #TrumpLiedPeopleDied #TrumpIsAnIdiot #WearAMask #asianculture,0,0,,pos,the west don't wear mask don't know wear mask just want to get #covid. asian wearing mask is asian culture we have long history n experiences to fright against pandemi. #trumpliedpeopledied #trumpisanidiot   #asianculture
1244427975312805888,https://twitter.com/AndyOz2/status/1244427975312805888,@WHO have demonstrated incredible incompetence or they are doing a great job of maximising the economic &amp; health devastation of free democracies. Time for a clean out. #WearAMask ,AndyOz2,2020-03-30 00:55:24+00:00,chrismartenson,@WHO,#WearAMask,0,0,,pos,@who have demonstrated incredible incompetence or they are doing a great job of maximising the economic &amp; health devastation of free democracies. time for a clean out.   
1244426779583852544,https://twitter.com/AndyOz2/status/1244426779583852544,My guess is #WearAMask stuffs up their facial recognition software and some ASIO or AFP bureaucratic wanker is gumming up the works. If #ScoMo doesn’t order masks then state Premiers need to immediately. They don’t have to be surgical masks. Make your own cloth masks would do.,AndyOz2,2020-03-30 00:50:39+00:00,Havenaar64,,#WearAMask #ScoMo,1,3,,pos,my guess is   stuffs up their facial recognition software and some asio or afp bureaucratic wanker is gumming up the works. if #scomo doesn’t order masks then state premiers need to immediately. they don’t have to be surgical masks. make your own cloth masks would do.
1244425208758321155,https://twitter.com/AndyOz2/status/1244425208758321155,Coronavirus: The Solution Is Becoming Clear https://youtu.be/2w9M6K9vSUM via @chrismartenson #WearAMask @MarkMcGowanMP,AndyOz2,2020-03-30 00:44:24+00:00,,@chrismartenson @MarkMcGowanMP,#WearAMask,0,1,,pos,coronavirus: the solution is becoming clear https://youtu.be/2w9m6k9vsum via @chrismartenson   @markmcgowanmp
1244421238509817856,https://twitter.com/CoffeeOnMyShoes/status/1244421238509817856,FACT: Scientific data proves otherwise. FACT: WHO is promoting incorrect information that WILL cost lives due to people underestimating how easily the virus spreads and continuing to put themselves and others at risk. #wearamask #truthsaveslives #coronavirus #educate,CoffeeOnMyShoes,2020-03-30 00:28:38+00:00,WHO,,#wearamask #truthsaveslives #coronavirus #educate,0,1,,pos,fact: scientific data proves otherwise. fact: who is promoting incorrect information that will cost lives due to people underestimating how easily the virus spreads and continuing to put themselves and others at risk.   #truthsaveslives #coronavirus #educate
1244421120498913280,https://twitter.com/rachael_tiow/status/1244421120498913280,#WearAMask #WeAreAllInThisTogether,rachael_tiow,2020-03-30 00:28:10+00:00,AndyBiotech,,#WearAMask #WeAreAllInThisTogether,0,0,,pos,  #weareallinthistogether
